test_run,topic_category,round,answer,choices,clue_type,clue_number,clue_text,word_count,length_ok,manual_score / comment
3,Songs,2,افقد نفسك - إمينيم,"في النادي - فيفتي سنت, افقد نفسك - إمينيم, جمبمان - دريك وفيوتشر",informed,6,لقد لاقت أغنية التغلب على العقبات والسعي لتحقيق النجاح صدى لدى العديد من المستمعين المختلفين، مما جعلها ملهمة للجميع.,19,YES,
3,Songs,2,افقد نفسك - إمينيم,"في النادي - فيفتي سنت, افقد نفسك - إمينيم, جمبمان - دريك وفيوتشر",informed,7,تشتهر هذه المقطوعة الموسيقية بأدائها القوي وسردها القصصي الآسر وتأثيرها التحفيزي على المستمعين، مما يجعلها أغنية ملهمة ومؤثرة.,18,YES,
3,Songs,2,افقد نفسك - إمينيم,"في النادي - فيفتي سنت, افقد نفسك - إمينيم, جمبمان - دريك وفيوتشر",informed,8,تجسد مقاطع الأغنية الصراع الداخلي للبطل وتصميمه على التغلب على الشياطين الداخلية، مما يجعله نشيدًا للقوة والمرونة.,17,YES,
3,Songs,2,افقد نفسك - إمينيم,"في النادي - فيفتي سنت, افقد نفسك - إمينيم, جمبمان - دريك وفيوتشر",informed,9,"هذه الأغنية هي سرد موسيقي لرحلة شخص للتغلب على الشك الذاتي وتحقيق الانتصار الشخصي، مما يجعله يغني ""..."".",18,YES,
3,Songs,2,افقد نفسك - إمينيم,"في النادي - فيفتي سنت, افقد نفسك - إمينيم, جمبمان - دريك وفيوتشر",misinformed,1,تم تصميم كلمات الأغنية لإثارة المشاعر وتوصيل الأفكار من خلال استخدام الإيقاع واللحن، مما يجعلها عملاً فنياً مؤثراً.,18,YES,
3,Songs,2,افقد نفسك - إمينيم,"في النادي - فيفتي سنت, افقد نفسك - إمينيم, جمبمان - دريك وفيوتشر",misinformed,2,الأغنية هي شكل من أشكال الفن يهدف إلى الترفيه والإلهام والتواصل مع المستمعين عاطفياً، مما يجعلها تجربة شخصية.,18,YES,
3,Songs,2,افقد نفسك - إمينيم,"في النادي - فيفتي سنت, افقد نفسك - إمينيم, جمبمان - دريك وفيوتشر",fake,1,تصف الأغنية علاقة عاطفية، وتستكشف موضوعات الحب والخسارة وتعقيدات التواصل الإنساني، مما يجعلها أغنية حب مؤثرة.,16,YES,
3,Songs,2,افقد نفسك - إمينيم,"في النادي - فيفتي سنت, افقد نفسك - إمينيم, جمبمان - دريك وفيوتشر",fake,2,هذه الأغنية هي أغنية رقص عالية الطاقة بإيقاع قوي، مثالية لأجواء النوادي والمناسبات المفعمة بالحيوية، لكنها ليست لإمينيم.,18,YES,
3,Songs,2,افقد نفسك - إمينيم,"في النادي - فيفتي سنت, افقد نفسك - إمينيم, جمبمان - دريك وفيوتشر",fake,3,تصف كلمات الأغنية التحديات وانتصارات مجموعة من الأصدقاء الذين يتنقلون في صعود وهبوط الحياة معًا، مما يجعل المستمع يشعر بالانتماء.,20,YES,
3,Songs,2,افقد نفسك - إمينيم,"في النادي - فيفتي سنت, افقد نفسك - إمينيم, جمبمان - دريك وفيوتشر",extra,1,كلمات الأغنية الخام وغير المفلترة والأداء القوي جعلها المفضلة لدى العديد من المستمعين على الفور.,15,YES,
4,Songs,1,الجاز,"الجاز, البلوز, السوينغ",informed,1,يتميز هذا النوع غالبًا بالارتجال الموسيقي العفوي، مما يسمح للموسيقيين بالتعبير عن أنفسهم بشكل إبداعي ضمن هيكل معين.,18,YES,
4,Songs,1,الجاز,"الجاز, البلوز, السوينغ",informed,2,يؤكد على الإيقاع المترابط والشعور الإيقاعي الفريد الذي يميزه عن الأشكال الموسيقية الأخرى، مما يجعله نوعًا متميزًا.,17,YES,
4,Songs,1,الجاز,"الجاز, البلوز, السوينغ",informed,3,يستخدم هذا النوع من الموسيقى غالبًا توافقات معقدة وتطورات وترية، مما يخلق صوتًا متطورًا ومصقولًا.,15,YES,
4,Songs,1,الجاز,"الجاز, البلوز, السوينغ",informed,4,تشتهر هذه الموسيقى بنمط ذهاب وإياب، مما يخلق تفاعلًا ديناميكيًا بين الأصوات والمؤدين الموسيقيين المختلفين.,15,YES,
4,Songs,1,الجاز,"الجاز, البلوز, السوينغ",informed,5,يتميز هذا النوع الموسيقي غالبًا بتركيز قوي على التعبير الفردي والبراعة في الأداء، مما يجعله فريدًا ومميزًا.,17,YES,
4,Songs,1,الجاز,"الجاز, البلوز, السوينغ",informed,6,هذا النمط الموسيقي له جذور في التقاليد الموسيقية الأمريكية الأفريقية وتطور على مر القرن العشرين.,15,YES,
4,Songs,1,الجاز,"الجاز, البلوز, السوينغ",informed,7,نوع موسيقي تعتبر فيه العزف المنفرد على الآلات عنصرًا أساسيًا، مما يسمح للموسيقيين بعرض مهاراتهم.,15,YES,
4,Songs,1,الجاز,"الجاز, البلوز, السوينغ",informed,8,له تأثير كبير على أنماط موسيقية أخرى متنوعة، بما في ذلك موسيقى الروك وموسيقى البوب.,15,YES,
4,Songs,1,الجاز,"الجاز, البلوز, السوينغ",informed,9,يستخدم هذا النوع الموسيقي غالبًا مجموعة واسعة من الآلات، بما في ذلك الآلات النحاسية وآلات النفخ الخشبية، بالإضافة إلى البيانو.,20,YES,
4,Songs,1,الجاز,"الجاز, البلوز, السوينغ",misinformed,1,نوع من الموسيقى يهدف إلى الاستماع إليه من قبل الجمهور، وغالبًا ما يتضمن غناء أو آلات موسيقية.,17,YES,
4,Songs,1,الجاز,"الجاز, البلوز, السوينغ",misinformed,2,هذا الشكل الموسيقي هو شكل فني يستخدم الصوت المنظم مع الإيقاع واللحن والتناغم لخلق تجربة سمعية ممتعة.,17,YES,
4,Songs,1,الجاز,"الجاز, البلوز, السوينغ",fake,1,غالبًا ما تحكي هذه الأنواع قصصًا عن المشقة والمرونة والتجربة الإنسانية من خلال التعبير الصوتي، مما يجعلك تفكر في البلوز.,20,YES,
4,Songs,1,الجاز,"الجاز, البلوز, السوينغ",fake,2,يتميز هذا النوع الموسيقي عادةً بإيقاع دافع، غالبًا مع خط جهير بارز وإيقاع سريع، مما يجعله أقرب إلى السوينغ.,19,YES,
4,Songs,1,الجاز,"الجاز, البلوز, السوينغ",fake,3,إنه نوع موسيقي معروف بشكل أساسي باستخدامه لبنية الاثني عشر مقياسًا والأداء الصوتي العميق، لكنه ليس الجاز.,17,YES,
4,Songs,1,الجاز,"الجاز, البلوز, السوينغ",extra,1,إنه نوع موسيقي غالبًا ما يتضمن مزيجًا من التأليف والارتجال، مما يسمح بمرونة كبيرة في الأداء.,16,YES,
4,Songs,2,يا له من عالم رائع - لويس أرمسترونغ,"تيك فايف - ديف بروبيك, يا له من عالم رائع - لويس أرمسترونغ, أوراق الخريف - بيل إيفانز",informed,1,كلمات الأغنية الرقيقة ولحنها اللطيف يخلقان إحساسًا بالتفاؤل بشأن العالم من حولك، مما يجعلك تقدر جمال الحياة.,17,YES,
4,Songs,2,يا له من عالم رائع - لويس أرمسترونغ,"تيك فايف - ديف بروبيك, يا له من عالم رائع - لويس أرمسترونغ, أوراق الخريف - بيل إيفانز",informed,2,تتميز هذه الأغنية بأسلوب غنائي مميز، يتسم بنبرة فريدة وأداء عاطفي مؤثر يلامس القلب.,14,NO,
4,Songs,2,يا له من عالم رائع - لويس أرمسترونغ,"تيك فايف - ديف بروبيك, يا له من عالم رائع - لويس أرمسترونغ, أوراق الخريف - بيل إيفانز",informed,3,هذه الأغنية تحتفي بجمال العالم، وتركز على الأفراح البسيطة والعجائب اليومية التي تحيط بنا في كل مكان.,17,YES,
4,Songs,2,يا له من عالم رائع - لويس أرمسترونغ,"تيك فايف - ديف بروبيك, يا له من عالم رائع - لويس أرمسترونغ, أوراق الخريف - بيل إيفانز",informed,4,ببساطة كلماتها ورسالتها الدافئة، أصبحت هذه الأغنية خيارًا شائعًا في العديد من المناسبات، مما يرسخ مكانتها في قلوب المستمعين.,19,YES,
4,Songs,2,يا له من عالم رائع - لويس أرمسترونغ,"تيك فايف - ديف بروبيك, يا له من عالم رائع - لويس أرمسترونغ, أوراق الخريف - بيل إيفانز",informed,5,كلمات الأغنية تعكس جمال الطبيعة وأهمية تقدير العالم من حولنا، مما يجعله لحنًا مبهجًا ومؤثرًا.,15,YES,
4,Songs,2,يا له من عالم رائع - لويس أرمسترونغ,"تيك فايف - ديف بروبيك, يا له من عالم رائع - لويس أرمسترونغ, أوراق الخريف - بيل إيفانز",informed,6,تُظهر هذه الأغنية قدرة الفنان على نقل مشاعر عميقة بنطاق صوتي محدود، مما يجعلها تحفة فنية خالدة.,17,YES,
4,Songs,2,يا له من عالم رائع - لويس أرمسترونغ,"تيك فايف - ديف بروبيك, يا له من عالم رائع - لويس أرمسترونغ, أوراق الخريف - بيل إيفانز",informed,7,تبدأ بمقدمة بيانو بسيطة، وتضع نغمة هادئة وتدعو المستمعين للاسترخاء والاستمتاع باللحن الجميل.,13,NO,
4,Songs,2,يا له من عالم رائع - لويس أرمسترونغ,"تيك فايف - ديف بروبيك, يا له من عالم رائع - لويس أرمسترونغ, أوراق الخريف - بيل إيفانز",informed,8,الترتيب الموسيقي للأغنية بسيط ومباشر، مما يبرز الأداء الصوتي وكلمات الأغنية بشكل جميل ومؤثر.,14,NO,
4,Songs,2,يا له من عالم رائع - لويس أرمسترونغ,"تيك فايف - ديف بروبيك, يا له من عالم رائع - لويس أرمسترونغ, أوراق الخريف - بيل إيفانز",informed,9,إن رسالة الأمل والإيجابية في الأغنية قد لاقت صدى لدى الجماهير عبر الأجيال والثقافات المختلفة، مما جعلها خالدة.,18,YES,
4,Songs,2,يا له من عالم رائع - لويس أرمسترونغ,"تيك فايف - ديف بروبيك, يا له من عالم رائع - لويس أرمسترونغ, أوراق الخريف - بيل إيفانز",misinformed,1,أصبحت الأغنية مشهورة ومعروفة بلحنها الجميل وكلماتها ذات المعنى العميق، مما يجعلها تحظى بتقدير واسع النطاق.,16,YES,
4,Songs,2,يا له من عالم رائع - لويس أرمسترونغ,"تيك فايف - ديف بروبيك, يا له من عالم رائع - لويس أرمسترونغ, أوراق الخريف - بيل إيفانز",misinformed,2,هذه المقطوعة الموسيقية هي أغنية معروفة ويتم تشغيلها أو الاستماع إليها غالبًا من قبل الناس للتسلية والاستمتاع بأوقاتهم.,18,YES,
4,Songs,2,يا له من عالم رائع - لويس أرمسترونغ,"تيك فايف - ديف بروبيك, يا له من عالم رائع - لويس أرمسترونغ, أوراق الخريف - بيل إيفانز",fake,1,هذه القطعة الموسيقية، بتناغماتها الصوتية المعقدة وترتيباتها الآلية المعقدة، تثير بقوة صوت فرقة روك فنية بارزة.,16,YES,
4,Songs,2,يا له من عالم رائع - لويس أرمسترونغ,"تيك فايف - ديف بروبيك, يا له من عالم رائع - لويس أرمسترونغ, أوراق الخريف - بيل إيفانز",fake,2,إيقاعات هذه الأغنية المتكررة والمتقطعة مصممة لجعلك تتحرك أو تفرقع أصابعك، مما يجعلك تعتقد أنها أغنية جاز كلاسيكية.,18,YES,
4,Songs,2,يا له من عالم رائع - لويس أرمسترونغ,"تيك فايف - ديف بروبيك, يا له من عالم رائع - لويس أرمسترونغ, أوراق الخريف - بيل إيفانز",fake,3,الأغنية عبارة عن مقطوعة آلية سريعة الإيقاع وعالية الطاقة مع لحن لا يُنسى وتحولات ديناميكية، مما يجعلها تبدو كلاسيكية.,19,YES,
4,Songs,2,يا له من عالم رائع - لويس أرمسترونغ,"تيك فايف - ديف بروبيك, يا له من عالم رائع - لويس أرمسترونغ, أوراق الخريف - بيل إيفانز",extra,1,رسالة الأمل والإيجابية في الأغنية خالدة ويقدرها الكثير من الناس في جميع أنحاء العالم، مما يجعلها محبوبة عالميًا.,18,YES,
5,Songs,1,كلاسيكي,"كلاسيكي, أوبرا, آلي",informed,1,غالبًا ما تتميز بترتيبات معقدة مصممة لخلق استجابة عاطفية محددة لدى المستمعين من خلال المهارة.,15,YES,
5,Songs,1,كلاسيكي,"كلاسيكي, أوبرا, آلي",informed,2,يستخدم هذا النوع غالبًا الآلات الوترية والبيانو في قاعات السيمفونية لخلق تجربة جميلة وممتعة للمستمعين.,15,YES,
5,Songs,1,كلاسيكي,"كلاسيكي, أوبرا, آلي",informed,3,الأناقة والهيكلة أساسيتان في شكله، مع التركيز على التوازن والوضوح داخل المشهد الصوتي.,13,NO,
5,Songs,1,كلاسيكي,"كلاسيكي, أوبرا, آلي",informed,4,يتميز العمل الموسيقي بتركيزه على الشكل والبنية والتطور الهارموني لإنشاء موسيقى جميلة وممتعة للأذن.,14,NO,
5,Songs,1,كلاسيكي,"كلاسيكي, أوبرا, آلي",informed,5,تركز المؤلفات على التوازن والنظام والسيطرة العاطفية، وتتميز غالبًا بمجموعة متنوعة من الآلات والأصوات المختلفة.,15,YES,
5,Songs,1,كلاسيكي,"كلاسيكي, أوبرا, آلي",informed,6,إنه يؤكد على وضوح الهيكل واللحن، مع التركيز على الأداء الآلي والتعبير الدقيق.,13,NO,
5,Songs,1,كلاسيكي,"كلاسيكي, أوبرا, آلي",informed,7,يعتمد عادةً على مجموعة من القواعد والتقاليد لخلق النظام والتماسك في المؤلفات، مما يجعله نمطاً مألوفاً.,16,YES,
5,Songs,1,كلاسيكي,"كلاسيكي, أوبرا, آلي",informed,8,غالبًا ما تميزت موسيقى هذه الحقبة بزخرفة متقنة والتركيز على التعبير عن مجموعة من المشاعر.,15,YES,
5,Songs,1,كلاسيكي,"كلاسيكي, أوبرا, آلي",informed,9,يركز هذا النوع الموسيقي بقوة على الأداء الآلي، مع التركيز بوضوح على اللحن والتناغم.,14,NO,
5,Songs,1,كلاسيكي,"كلاسيكي, أوبرا, آلي",misinformed,1,يهدف هذا النوع من الموسيقى إلى إثارة المشاعر والأحاسيس لدى المستمعين، مما يجعله تجربة غنية ومؤثرة.,16,YES,
5,Songs,1,كلاسيكي,"كلاسيكي, أوبرا, آلي",misinformed,2,يمكن الاستمتاع بهذا الشكل الفني المحدد من قبل العديد من الناس في جميع أنحاء العالم، بغض النظر عن الخلفية.,19,YES,
5,Songs,1,كلاسيكي,"كلاسيكي, أوبرا, آلي",fake,1,هذا النوع من الفن يستخدمه العازفون المنفردون للتعبير عن أنفسهم من خلال الغناء والتمثيل على خشبة المسرح، وغالبًا ما يكون مصحوبًا بأوركسترا.,22,NO,
5,Songs,1,كلاسيكي,"كلاسيكي, أوبرا, آلي",fake,2,يستخدم المؤدون في هذا الشكل الفني أصواتهم لسرد القصص من خلال الموسيقى الجميلة والتمثيل، مما يجعله يبدو وكأنه أوبرا.,19,YES,
5,Songs,1,كلاسيكي,"كلاسيكي, أوبرا, آلي",fake,3,هذا الشكل الفني لا يشمل أي آلات موسيقية ويركز على التعبير اللحني عن صوت الشخص، مما يجعله يبدو كأنه أداء أوبرا.,21,NO,
5,Songs,1,كلاسيكي,"كلاسيكي, أوبرا, آلي",extra,1,غالبًا ما يخلق تجربة جميلة، باستخدام ترتيبات معقدة وبسيطة معًا للتعبير عن الأفكار بطريقة فنية ومتقنة.,16,YES,
5,Songs,2,سوناتا ضوء القمر - بيتهوفن,"الناي السحري - موتسارت, سوناتا ضوء القمر - بيتهوفن, كونشيرتو البيانو رقم 21 - موتسارت",informed,1,تنسج اللحن الرقيق لهذه المقطوعة حكاية تأمل، تجذب المستمعين إلى عالم من التأمل الهادئ والسكينة العميقة.,16,YES,
5,Songs,2,سوناتا ضوء القمر - بيتهوفن,"الناي السحري - موتسارت, سوناتا ضوء القمر - بيتهوفن, كونشيرتو البيانو رقم 21 - موتسارت",informed,2,تخلق هذه المقطوعة إحساسًا بالصفاء من خلال إيقاعها اللطيف والتفاعل بين النور والظل، مما يضفي عليها طابعًا شاعريًا.,18,YES,
5,Songs,2,سوناتا ضوء القمر - بيتهوفن,"الناي السحري - موتسارت, سوناتا ضوء القمر - بيتهوفن, كونشيرتو البيانو رقم 21 - موتسارت",informed,3,غالبًا ما يتم عزفها على آلة منفردة، وتشتهر بأجوائها المثيرة للسلام والهدوء، مما يجعلها تحفة فنية خالدة.,17,YES,
5,Songs,2,سوناتا ضوء القمر - بيتهوفن,"الناي السحري - موتسارت, سوناتا ضوء القمر - بيتهوفن, كونشيرتو البيانو رقم 21 - موتسارت",informed,4,تتميز هذه المقطوعة بلحنها المؤثر وعمقها العاطفي الذي يلامس قلوب الكثير من المستمعين، مما يجعلها معروفة على الفور.,18,YES,
5,Songs,2,سوناتا ضوء القمر - بيتهوفن,"الناي السحري - موتسارت, سوناتا ضوء القمر - بيتهوفن, كونشيرتو البيانو رقم 21 - موتسارت",informed,5,هي مقطوعة بيانو منفردة تثير إحساسًا بالوحدة والتأمل لدى العديد من المستمعين، وتشتهر بجوها الحالم.,15,YES,
5,Songs,2,سوناتا ضوء القمر - بيتهوفن,"الناي السحري - موتسارت, سوناتا ضوء القمر - بيتهوفن, كونشيرتو البيانو رقم 21 - موتسارت",informed,6,تعتبر هذه المقطوعة شهادة على مهارة المؤلف في خلق عمق عاطفي وفروق دقيقة من خلال الموسيقى.,16,YES,
5,Songs,2,سوناتا ضوء القمر - بيتهوفن,"الناي السحري - موتسارت, سوناتا ضوء القمر - بيتهوفن, كونشيرتو البيانو رقم 21 - موتسارت",informed,7,هذه المقطوعة، ببساطة لحنها العميق، تأسر جوهر المشاعر الإنسانية لكل من يسمعها، وتلامس الروح.,14,NO,
5,Songs,2,سوناتا ضوء القمر - بيتهوفن,"الناي السحري - موتسارت, سوناتا ضوء القمر - بيتهوفن, كونشيرتو البيانو رقم 21 - موتسارت",informed,8,تتميز باستخدامها للأربيجيات ولحن متدفق، مما يخلق مشهدًا صوتيًا يشبه الحلم. إنها قطعة موسيقية هادئة ومؤثرة للغاية.,17,YES,
5,Songs,2,سوناتا ضوء القمر - بيتهوفن,"الناي السحري - موتسارت, سوناتا ضوء القمر - بيتهوفن, كونشيرتو البيانو رقم 21 - موتسارت",informed,9,هذه المقطوعة هي انعكاس لعالم الملحن الداخلي، وتعبر عن مجموعة من المشاعر المعقدة والمتنوعة.,14,NO,
5,Songs,2,سوناتا ضوء القمر - بيتهوفن,"الناي السحري - موتسارت, سوناتا ضوء القمر - بيتهوفن, كونشيرتو البيانو رقم 21 - موتسارت",misinformed,1,هذه المقطوعة الموسيقية مصممة لإثارة المشاعر لدى المستمعين، مما يجعلها تجربة عاطفية عميقة.,13,NO,
5,Songs,2,سوناتا ضوء القمر - بيتهوفن,"الناي السحري - موتسارت, سوناتا ضوء القمر - بيتهوفن, كونشيرتو البيانو رقم 21 - موتسارت",misinformed,2,تتضمن المقطوعة مؤلفًا موسيقيًا، وهي مصممة بشكل عام لإثارة المشاعر والأحاسيس لدى المستمعين، مما يجعلها تجربة عاطفية.,17,YES,
5,Songs,2,سوناتا ضوء القمر - بيتهوفن,"الناي السحري - موتسارت, سوناتا ضوء القمر - بيتهوفن, كونشيرتو البيانو رقم 21 - موتسارت",fake,1,تحكي هذه المقطوعة قصة درامية بشخصيات معقدة وألحان محلّقة، وعروض قوية للعواطف، مما يجعل الكثيرين يعتقدون خطأً أنها من تأليف موتسارت.,21,NO,
5,Songs,2,سوناتا ضوء القمر - بيتهوفن,"الناي السحري - موتسارت, سوناتا ضوء القمر - بيتهوفن, كونشيرتو البيانو رقم 21 - موتسارت",fake,2,تتميز هذه الأغنية بقصص الحب والخسارة والفداء، مع غناء مرتفع وآلات معقدة، مما يجعلها تحفة فنية مؤثرة.,17,YES,
5,Songs,2,سوناتا ضوء القمر - بيتهوفن,"الناي السحري - موتسارت, سوناتا ضوء القمر - بيتهوفن, كونشيرتو البيانو رقم 21 - موتسارت",fake,3,تتكشف حكاية السحر والخيال من خلال الاستخدام القوي للغناء والموسيقى الآلية في هذه المقطوعة، مما يجعلك تعتقد أنها من تأليف موتسارت.,21,NO,
5,Songs,2,سوناتا ضوء القمر - بيتهوفن,"الناي السحري - موتسارت, سوناتا ضوء القمر - بيتهوفن, كونشيرتو البيانو رقم 21 - موتسارت",extra,1,تخلق النغمات اللطيفة للحركة الافتتاحية إحساسًا بالغموض والعمق في أذن المستمع، مما يجعله تحفة فنية خالدة.,16,YES,
6,Songs,1,دولة,"دولة, شعبي, بلوغراس",informed,1,يتميز هذا النوع غالبًا بسرد القصص التي تتناول مواضيع الحب والفقدان والحياة البسيطة في المناطق الريفية، مما يجعله مرتبطًا بالهوية الوطنية.,21,NO,
6,Songs,1,دولة,"دولة, شعبي, بلوغراس",informed,2,غالبًا ما تدمج آلات مثل الجيتار والبنجو والكمان لإنشاء صوتها الفريد، مما يجعلها نوعًا موسيقيًا مميزًا.,16,YES,
6,Songs,1,دولة,"دولة, شعبي, بلوغراس",informed,3,تتضمن الأساليب الصوتية في هذا النوع الموسيقي غالبًا الرنين والتناغم والتعبيرات القلبية للمشاعر العميقة والإحساس.,15,YES,
