test_run,topic_category,round,answer,choices,clue_type,clue_number,clue_text,word_count,length_ok,manual_score / comment
6,Songs,1,دولة,"دولة, شعبي, بلوغراس",informed,4,غالبًا ما يؤكد الشكل الموسيقي على السرد، مع الأغاني التي تحكي قصصًا عن التجارب اليومية وأحداث الحياة في هذه الوحدة السياسية.,21,NO,
6,Songs,1,دولة,"دولة, شعبي, بلوغراس",informed,5,العديد من الفنانين في هذا النوع لديهم صلات قوية بناشفيل وغراند أول أوبري، مما يجعله مركزًا هامًا لهذا النمط الموسيقي.,20,YES,
6,Songs,1,دولة,"دولة, شعبي, بلوغراس",informed,6,يشتهر هذا النوع الموسيقي بارتباطه الوثيق بجذوره في الجنوب الأمريكي، مما يجعله جزءًا لا يتجزأ من ثقافة تلك المنطقة.,19,YES,
6,Songs,1,دولة,"دولة, شعبي, بلوغراس",informed,7,غالبًا ما تعرض موضوعات الإيمان والعائلة وقيم المجتمعات الريفية في أمريكا، مما يعكس هويتها الثقافية العميقة.,16,YES,
6,Songs,1,دولة,"دولة, شعبي, بلوغراس",informed,8,غالبًا ما يستمد الفنانون في هذا النوع إلهامهم من تجارب ومناظر الجنوب، مما يعكس ثقافة المنطقة وهويتها.,17,YES,
6,Songs,1,دولة,"دولة, شعبي, بلوغراس",informed,9,هذا النوع من الموسيقى له صوت وإيقاع مميزان، مما يخلق ارتباطًا عاطفيًا قويًا مع المستمعين، وغالبًا ما يعكس هوية ثقافية.,20,YES,
6,Songs,1,دولة,"دولة, شعبي, بلوغراس",misinformed,1,إنه شكل من أشكال التعبير الفني، يتم إنشاؤه بواسطة الموسيقيين ويستمتع به الجمهور في جميع أنحاء العالم، مما يجعله جزءًا من الثقافة العالمية.,23,NO,
6,Songs,1,دولة,"دولة, شعبي, بلوغراس",misinformed,2,يستخدم هذا النوع من الفن النوتات الموسيقية والكلمات لخلق تجربة عاطفية للمستمعين، مما يجعله شكلاً من أشكال التعبير.,18,YES,
6,Songs,1,دولة,"دولة, شعبي, بلوغراس",fake,1,يستخدم هذا النوع غالبًا آلات صوتية ويركز على سرد القصص مع التركيز على المجتمع، مما يجعله يبدو وكأنه موسيقى شعبية.,20,YES,
6,Songs,1,دولة,"دولة, شعبي, بلوغراس",fake,2,هذا النوع الموسيقي يتميز بتناغمات معقدة وترتيبات آلية متقنة، وغالبًا ما يستخدم المندولين وآلات وترية أخرى، مما يجعله يبدو وكأنه موسيقى شعبية.,22,NO,
6,Songs,1,دولة,"دولة, شعبي, بلوغراس",fake,3,يركز هذا النوع على أهمية الطبيعة والملذات البسيطة في الحياة من خلال الألحان الريفية الهادئة، مما يجعله يبدو وكأنه نمط حياة.,21,NO,
6,Songs,1,دولة,"دولة, شعبي, بلوغراس",extra,1,غالبًا ما تتضمن الموسيقى موضوعات عن الطبقة العاملة والتقاليد وإحساس قوي بالانتماء إلى المكان.,14,NO,
6,Songs,2,أصدقاء في أماكن متدنية - غارث بروكس,"جولين - دوللي بارتون, أصدقاء في أماكن متدنية - غارث بروكس, خذني إلى المنزل, طرق الريف - جون دنفر",informed,1,تصف هذه الأغنية رحلة شخصية للعثور على العزاء والصداقة الحميمة في مكان غير متوقع، بعيدًا عن الأماكن المعتادة.,18,YES,
6,Songs,2,أصدقاء في أماكن متدنية - غارث بروكس,"جولين - دوللي بارتون, أصدقاء في أماكن متدنية - غارث بروكس, خذني إلى المنزل, طرق الريف - جون دنفر",informed,2,تدور قصة الأغنية حول رجل يجد الراحة والانتماء في بيئة اجتماعية مألوفة، حيث يشعر بالقبول والدعم من الآخرين.,18,YES,
6,Songs,2,أصدقاء في أماكن متدنية - غارث بروكس,"جولين - دوللي بارتون, أصدقاء في أماكن متدنية - غارث بروكس, خذني إلى المنزل, طرق الريف - جون دنفر",informed,3,تتضمن جوقة أصبحت نشيدًا معترفًا به على نطاق واسع للعديد من المستمعين في جميع أنحاء العالم، مما يجعله خيارًا شائعًا في الحانات.,22,NO,
6,Songs,2,أصدقاء في أماكن متدنية - غارث بروكس,"جولين - دوللي بارتون, أصدقاء في أماكن متدنية - غارث بروكس, خذني إلى المنزل, طرق الريف - جون دنفر",informed,4,تبدأ الأغنية بسرد قصة عن موقف محرج لرجل في مناسبة اجتماعية رسمية، مما يمهد لأجواء غير متوقعة.,17,YES,
6,Songs,2,أصدقاء في أماكن متدنية - غارث بروكس,"جولين - دوللي بارتون, أصدقاء في أماكن متدنية - غارث بروكس, خذني إلى المنزل, طرق الريف - جون دنفر",informed,5,يحتوي جسر الأغنية على سطر لا يُنسى غالبًا ما يغنيه ويستمتع به المعجبون في كل مكان، مما يجعله جزءًا مميزًا من الأغنية.,22,NO,
6,Songs,2,أصدقاء في أماكن متدنية - غارث بروكس,"جولين - دوللي بارتون, أصدقاء في أماكن متدنية - غارث بروكس, خذني إلى المنزل, طرق الريف - جون دنفر",informed,6,لا تزال موضوعات الأغنية عن الصداقة الحميمة والقبول مفهومة من خلال مشاعر المستمعين حتى اليوم.,15,YES,
6,Songs,2,أصدقاء في أماكن متدنية - غارث بروكس,"جولين - دوللي بارتون, أصدقاء في أماكن متدنية - غارث بروكس, خذني إلى المنزل, طرق الريف - جون دنفر",informed,7,أدت شعبية هذه الأغنية إلى العديد من جلسات الغناء الجماعي في الحانات والأماكن العامة الأخرى مع مرور الوقت.,18,YES,
6,Songs,2,أصدقاء في أماكن متدنية - غارث بروكس,"جولين - دوللي بارتون, أصدقاء في أماكن متدنية - غارث بروكس, خذني إلى المنزل, طرق الريف - جون دنفر",informed,8,تصف كلمات الأغنية رفض شخصية للمجتمع الراقي واحتضانها لأوقات أبسط، مما يعكس موضوعًا شائعًا في موسيقى الريف.,17,YES,
6,Songs,2,أصدقاء في أماكن متدنية - غارث بروكس,"جولين - دوللي بارتون, أصدقاء في أماكن متدنية - غارث بروكس, خذني إلى المنزل, طرق الريف - جون دنفر",informed,9,تحكي قصة هذه الأغنية عن شخصية تبحث عن ملجأ في بيئة مألوفة ومرحبة، حيث يجد الراحة والسكينة.,17,YES,
6,Songs,2,أصدقاء في أماكن متدنية - غارث بروكس,"جولين - دوللي بارتون, أصدقاء في أماكن متدنية - غارث بروكس, خذني إلى المنزل, طرق الريف - جون دنفر",misinformed,1,شكل إبداعي للتعبير يستخدم التوزيعات الموسيقية والكلمات لنقل المشاعر والأفكار، ولكنه لا يحدد الفنان أو الأغنية بدقة.,17,YES,
6,Songs,2,أصدقاء في أماكن متدنية - غارث بروكس,"جولين - دوللي بارتون, أصدقاء في أماكن متدنية - غارث بروكس, خذني إلى المنزل, طرق الريف - جون دنفر",misinformed,2,إنها أغنية تهدف إلى ترفيه المستمعين وإثارة المشاعر من خلال كلماتها وموسيقاها، مما يجعلها تجربة ممتعة للجميع.,17,YES,
6,Songs,2,أصدقاء في أماكن متدنية - غارث بروكس,"جولين - دوللي بارتون, أصدقاء في أماكن متدنية - غارث بروكس, خذني إلى المنزل, طرق الريف - جون دنفر",fake,1,هذه الأغنية تحكي قصة امرأة تواجه منافستها وتجد حلاً لكسر قلبها، ولكنها في الواقع ليست كذلك.,16,YES,
6,Songs,2,أصدقاء في أماكن متدنية - غارث بروكس,"جولين - دوللي بارتون, أصدقاء في أماكن متدنية - غارث بروكس, خذني إلى المنزل, طرق الريف - جون دنفر",fake,2,تحكي هذه الأغنية عن رحلة العودة إلى الريف، مع مواضيع الذكريات والحنين إلى الوطن، ولكنها ليست الإجابة الصحيحة.,18,YES,
6,Songs,2,أصدقاء في أماكن متدنية - غارث بروكس,"جولين - دوللي بارتون, أصدقاء في أماكن متدنية - غارث بروكس, خذني إلى المنزل, طرق الريف - جون دنفر",fake,3,تصف هذه الأغنية التزام امرأة لا يتزعزع بحبيبها ورابطة حب أبدية، ولكنها في الواقع أغنية عن الحنين إلى الوطن.,19,YES,
6,Songs,2,أصدقاء في أماكن متدنية - غارث بروكس,"جولين - دوللي بارتون, أصدقاء في أماكن متدنية - غارث بروكس, خذني إلى المنزل, طرق الريف - جون دنفر",extra,1,جوقة الأغنية هي المفضلة لدى الجميع في الغناء الجماعي، وهي عنصر أساسي في الحفلات الموسيقية والتجمعات الاجتماعية.,17,YES,
7,Songs,1,موسيقى البلوز,"موسيقى البلوز, موسيقى الروك, موسيقى السول",informed,1,يستخدم هذا النوع غالبًا هيكلًا من 12 مقياسًا، مما يخلق إطارًا محددًا للتعبير الموسيقي والارتجال.,15,YES,
7,Songs,1,موسيقى البلوز,"موسيقى البلوز, موسيقى الروك, موسيقى السول",informed,2,يعبر هذا النوع الموسيقي غالبًا عن مشاعر الحزن والصعاب والمرونة من خلال كلماته وألحانه المؤثرة.,15,YES,
7,Songs,1,موسيقى البلوز,"موسيقى البلوز, موسيقى الروك, موسيقى السول",informed,3,نشأ هذا النوع في جنوب الولايات المتحدة بين الأمريكيين الأفارقة، وشكل بعمق التقاليد الموسيقية الأمريكية.,15,YES,
7,Songs,1,موسيقى البلوز,"موسيقى البلوز, موسيقى الروك, موسيقى السول",informed,4,تتميز باستخدام النوتات الزرقاء، مما يضيف عمقًا عاطفيًا مميزًا للقطعة الموسيقية، ويعبر عن المشاعر والأحاسيس بشكل فريد.,17,YES,
7,Songs,1,موسيقى البلوز,"موسيقى البلوز, موسيقى الروك, موسيقى السول",informed,5,يستخدم الفنانون أنماط النداء والاستجابة، مما يخلق حوارًا بين الآلات أو الأجزاء الصوتية داخل الموسيقى نفسها.,16,YES,
7,Songs,1,موسيقى البلوز,"موسيقى البلوز, موسيقى الروك, موسيقى السول",informed,6,يتميز هذا النوع غالبًا بالارتجال، مما يسمح للموسيقيين بالتعبير عن أنفسهم بحرية وبشكل فريد من خلال موسيقاهم.,17,YES,
7,Songs,1,موسيقى البلوز,"موسيقى البلوز, موسيقى الروك, موسيقى السول",informed,7,يتميز بإحساس إيقاعي معين، يوصف غالبًا بأنه خلط أو تأرجح، مما يدفع صوته المميز.,14,NO,
7,Songs,1,موسيقى البلوز,"موسيقى البلوز, موسيقى الروك, موسيقى السول",informed,8,كان لهذا النوع الموسيقي تأثير كبير على أنواع أخرى، بما في ذلك الروك أند رول والجاز، مما جعله أساسًا للعديد من الأساليب الموسيقية.,23,NO,
7,Songs,1,موسيقى البلوز,"موسيقى البلوز, موسيقى الروك, موسيقى السول",informed,9,غالبًا ما تحكي هذه الموسيقى قصصًا عن الصراع الشخصي والحب والخسارة، مما يتردد صداه لدى المستمعين عبر الثقافات.,18,YES,
7,Songs,1,موسيقى البلوز,"موسيقى البلوز, موسيقى الروك, موسيقى السول",misinformed,1,يستخدم هذا الشكل الموسيقي غالبًا الآلات لخلق الأصوات ونقل المشاعر إلى الجمهور، مما يجعله تجربة حسية غنية.,17,YES,
7,Songs,1,موسيقى البلوز,"موسيقى البلوز, موسيقى الروك, موسيقى السول",misinformed,2,إنه نوع موسيقي شائع يعتمد على الغناء والتعبير عن المشاعر من خلال الكلمات والألحان المؤثرة.,15,YES,
7,Songs,1,موسيقى البلوز,"موسيقى البلوز, موسيقى الروك, موسيقى السول",fake,1,تشتهر هذه الموسيقى بطاقتها العالية وآلاتها المعقدة، وغالبًا ما تتميز بعزف منفرد طويل على الآلات، مما يجعلها أقرب إلى موسيقى الروك.,21,NO,
7,Songs,1,موسيقى البلوز,"موسيقى البلوز, موسيقى الروك, موسيقى السول",fake,2,يتميز هذا النمط الموسيقي بإيقاعات قوية وتناغمات صوتية، مما يخلق تجربة مفعمة بالحيوية والرقص للمستمعين، وهو ما لا يشتهر به موسيقى البلوز.,22,NO,
7,Songs,1,موسيقى البلوز,"موسيقى البلوز, موسيقى الروك, موسيقى السول",fake,3,تشتهر هذه الموسيقى بإيقاعاتها الراقصة وألحانها المبهجة، وغالبًا ما تتضمن آلات مثل الغيتار الكهربائي والطبول، مما يجعلها مثالية للحفلات.,19,YES,
7,Songs,1,موسيقى البلوز,"موسيقى البلوز, موسيقى الروك, موسيقى السول",extra,1,يسمح هذا النوع من الموسيقى بالتعبير الصوتي العاطفي، وغالبًا ما يتميز بثني النوتات والانزلاقات الصوتية.,15,YES,
7,Songs,2,كروس رود بلوز - روبرت جونسون,"أغنية الليمون - ليد زيبلين, كروس رود بلوز - روبرت جونسون, ستورمي مونداي - تي-بون ووكر",informed,1,تحكي قصة عن مفترق طرق، مكان للصراع الشخصي والآثار الروحية للمغني، حيث يلتقي بالإلهة ويبيع روحه.,16,YES,
7,Songs,2,كروس رود بلوز - روبرت جونسون,"أغنية الليمون - ليد زيبلين, كروس رود بلوز - روبرت جونسون, ستورمي مونداي - تي-بون ووكر",informed,2,ترددت أصداء مواضيع الأغنية عن الإغراء والعواقب بعمق لدى المستمعين في أوائل القرن العشرين، مما عزز مكانتها في تاريخ البلوز.,20,YES,
7,Songs,2,كروس رود بلوز - روبرت جونسون,"أغنية الليمون - ليد زيبلين, كروس رود بلوز - روبرت جونسون, ستورمي مونداي - تي-بون ووكر",informed,3,يلتقط اللحن المؤثر والأحاسيس الخامة للأغنية شعورًا باليأس والصراع الروحي العميق، مما يجعله تحفة فنية خالدة.,16,YES,
7,Songs,2,كروس رود بلوز - روبرت جونسون,"أغنية الليمون - ليد زيبلين, كروس رود بلوز - روبرت جونسون, ستورمي مونداي - تي-بون ووكر",informed,4,تثير كلمات الأغنية إحساسًا بالعزلة والبحث عن المساعدة خلال لحظة أزمة شخصية، مما يعكس تجربة عميقة ومؤثرة.,17,YES,
7,Songs,2,كروس رود بلوز - روبرت جونسون,"أغنية الليمون - ليد زيبلين, كروس رود بلوز - روبرت جونسون, ستورمي مونداي - تي-بون ووكر",informed,5,المنظر الصوتي العام لهذه النغمة، المصمم بتقنية الجيتار المنزلق، يحدد بشكل فريد طابعها الموسيقي المعبر والمميز.,16,YES,
7,Songs,2,كروس رود بلوز - روبرت جونسون,"أغنية الليمون - ليد زيبلين, كروس رود بلوز - روبرت جونسون, ستورمي مونداي - تي-بون ووكر",informed,6,يُظهر أداء الفنان الصوتي إحساسًا بالضعف وثقل الخيارات الصعبة التي واجهها في حياته.,13,NO,
7,Songs,2,كروس رود بلوز - روبرت جونسون,"أغنية الليمون - ليد زيبلين, كروس رود بلوز - روبرت جونسون, ستورمي مونداي - تي-بون ووكر",informed,7,تعتبر هذه الأغنية مثالًا محوريًا لموسيقى دلتا بلوز، حيث أثرت على عدد لا يحصى من الموسيقيين عبر مختلف الأنواع والأجيال.,20,YES,
7,Songs,2,كروس رود بلوز - روبرت جونسون,"أغنية الليمون - ليد زيبلين, كروس رود بلوز - روبرت جونسون, ستورمي مونداي - تي-بون ووكر",informed,8,تستكشف قصة الأغنية موضوعات القدر والاختيار وعواقب أفعال المرء، مما يسلط الضوء على مفترق طرق الحياة.,16,YES,
7,Songs,2,كروس رود بلوز - روبرت جونسون,"أغنية الليمون - ليد زيبلين, كروس رود بلوز - روبرت جونسون, ستورمي مونداي - تي-بون ووكر",informed,9,الأغنية مليئة بالإحساس بالرهبة، وتلمح إلى المسار الصعب الذي يسلكه بطل الرواية في حياته.,14,NO,
7,Songs,2,كروس رود بلوز - روبرت جونسون,"أغنية الليمون - ليد زيبلين, كروس رود بلوز - روبرت جونسون, ستورمي مونداي - تي-بون ووكر",misinformed,1,شكل إبداعي يستخدم التعبير الفني لنقل المشاعر، ويهدف إلى إشراك الجمهور في رسالته ومضمونه العام دون تحديد دقيق.,18,YES,
7,Songs,2,كروس رود بلوز - روبرت جونسون,"أغنية الليمون - ليد زيبلين, كروس رود بلوز - روبرت جونسون, ستورمي مونداي - تي-بون ووكر",misinformed,2,تتميز الأغنية بأداء صوتي قوي، مما يجعلها تحظى بشعبية كبيرة بين المستمعين في كثير من الأحيان.,16,YES,
7,Songs,2,كروس رود بلوز - روبرت جونسون,"أغنية الليمون - ليد زيبلين, كروس رود بلوز - روبرت جونسون, ستورمي مونداي - تي-بون ووكر",fake,1,الأغنية عبارة عن مقطوعة عالية الطاقة تعتمد على الجيتار وتبرز البراعة الآلية للفرقة والإيقاعات الجذابة، ولكنها ليست عن مفترق طرق.,20,YES,
7,Songs,2,كروس رود بلوز - روبرت جونسون,"أغنية الليمون - ليد زيبلين, كروس رود بلوز - روبرت جونسون, ستورمي مونداي - تي-بون ووكر",fake,2,تحكي الأغنية قصة رحلة عبر منظر طبيعي مقفر، مليء بالخطر وعدم اليقين، مما يجعل المستمع يشعر بالوحدة.,17,YES,
7,Songs,2,كروس رود بلوز - روبرت جونسون,"أغنية الليمون - ليد زيبلين, كروس رود بلوز - روبرت جونسون, ستورمي مونداي - تي-بون ووكر",fake,3,الأغنية عبارة عن أغنية مؤثرة تعرض قدرة المغني الصوتية وعمقه العاطفي، مما يجعل المستمع يشعر بالارتباط العميق.,17,YES,
7,Songs,2,كروس رود بلوز - روبرت جونسون,"أغنية الليمون - ليد زيبلين, كروس رود بلوز - روبرت جونسون, ستورمي مونداي - تي-بون ووكر",extra,1,إنها أغنية مليئة بإحساس الرهبة والصراع ضد قوى غير مرئية، مما يعكس يأسًا عميقًا في مواجهة المجهول.,17,YES,
8,Songs,1,إلكتروني,"إلكتروني, رقص, تكنو",informed,1,يستخدم هذا النوع غالبًا المزج، وآلات الطبول، ومحطات الصوت الرقمية لإنشاء أصواته الفريدة والمميزة.,14,NO,
8,Songs,1,إلكتروني,"إلكتروني, رقص, تكنو",informed,2,عادةً ما يركز على أنماط إيقاعية متكررة، وأنسجة جوية، ومناظر صوتية مركبة، مما يخلق صوتًا فريدًا من نوعه.,18,YES,
8,Songs,1,إلكتروني,"إلكتروني, رقص, تكنو",informed,3,يرتبط هذا النوع الموسيقي غالبًا بالنوادي الليلية والمهرجانات والأماكن الأخرى التي تستضيف تجمعات كبيرة من الناس.,16,YES,
8,Songs,1,إلكتروني,"إلكتروني, رقص, تكنو",informed,4,يقوم العديد من الفنانين بإنشاء هذا النوع من الموسيقى وتقديمه باستخدام مزيج من الآلات الحية والتكنولوجيا الرقمية.,17,YES,
8,Songs,1,إلكتروني,"إلكتروني, رقص, تكنو",informed,5,غالبًا ما يدمج عناصر من أنماط موسيقية أخرى متنوعة، مما يؤدي إلى ظهور أنواع فرعية مختلفة وجاذبية متعددة.,18,YES,
8,Songs,1,إلكتروني,"إلكتروني, رقص, تكنو",informed,6,يتميز هذا النوع من الموسيقى غالبًا بتركيزه على تصميم الصوت وقدرته على خلق تجارب غامرة ومثيرة للمستمع.,17,YES,
8,Songs,1,إلكتروني,"إلكتروني, رقص, تكنو",informed,7,غالبًا ما تعطي هذا الأنواع الموسيقية الأولوية لاستخدام التكنولوجيا والابتكار في إنتاجها وترتيباتها الموسيقية.,14,NO,
8,Songs,1,إلكتروني,"إلكتروني, رقص, تكنو",informed,8,نوع موسيقي يحتضن التكنولوجيا الرقمية والتلاعب بالصوت لإنتاج أنماط إيقاعية ولحنية مميزة تعتمد على الآلات.,15,YES,
8,Songs,1,إلكتروني,"إلكتروني, رقص, تكنو",informed,9,هو تصنيف واسع يشمل أنواعًا فرعية متنوعة، تتميز بخصائصها الصوتية الفريدة وتقنيات الإنتاج المتميزة.,14,NO,
8,Songs,1,إلكتروني,"إلكتروني, رقص, تكنو",misinformed,1,هذا النوع من الموسيقى مصمم للاستماع إليه والاستمتاع به وتقديره من قبل الجماهير من جميع الأعمار، مما يجعله شائعًا في مختلف الأوساط.,22,NO,
8,Songs,1,إلكتروني,"إلكتروني, رقص, تكنو",misinformed,2,يستخدم هذا النوع من الموسيقى الصوت لخلق اتصال عاطفي مع المستمع، معبراً عن الأفكار والمشاعر بطريقة فنية.,17,YES,
8,Songs,1,إلكتروني,"إلكتروني, رقص, تكنو",fake,1,غالبًا ما تتضمن هذه الموسيقى تناغمات صوتية معقدة وآلات موسيقية، وغالبًا ما تتميز بأوركسترا كاملة، مما يجعلها أقرب إلى الموسيقى الكلاسيكية.,21,NO,
8,Songs,1,إلكتروني,"إلكتروني, رقص, تكنو",fake,2,إنه نوع موسيقي يتميز بشكل أساسي باستخدام الغيتارات والباس والطبول، وهي عناصر أساسية في صوته.,15,YES,
8,Songs,1,إلكتروني,"إلكتروني, رقص, تكنو",fake,3,غالبًا ما يدمج هذا النوع من الموسيقى سردًا قويًا للقصص مع شخصيات ومؤامرات وعمق عاطفي في كلماته، مما يجعله أقرب إلى المسرحيات.,22,NO,
