test_run,topic_category,round,answer,choices,clue_type,clue_number,clue_text,word_count,length_ok,manual_score / comment
9,Songs,2,One Love - Bob Marley,"Hotel California - Eagles, One Love - Bob Marley, Rude - MAGIC!",informed,5,"It is a track of an iconic artist, and has become a global anthem of love, peace, and human connection.",20,YES,
9,Songs,2,One Love - Bob Marley,"Hotel California - Eagles, One Love - Bob Marley, Rude - MAGIC!",informed,6,The song's simple yet powerful message of unity has resonated with people from all walks of life globally.,18,YES,
9,Songs,2,One Love - Bob Marley,"Hotel California - Eagles, One Love - Bob Marley, Rude - MAGIC!",informed,7,"The song's cultural impact extends beyond music, inspiring positive change and promoting understanding for everyone.",15,YES,
9,Songs,2,One Love - Bob Marley,"Hotel California - Eagles, One Love - Bob Marley, Rude - MAGIC!",informed,8,The song's gentle melody and uplifting lyrics create a sense of optimism and hope for a better future.,18,YES,
9,Songs,2,One Love - Bob Marley,"Hotel California - Eagles, One Love - Bob Marley, Rude - MAGIC!",informed,9,"This song has been covered by numerous artists, demonstrating its lasting appeal and influence on music.",16,YES,
9,Songs,2,One Love - Bob Marley,"Hotel California - Eagles, One Love - Bob Marley, Rude - MAGIC!",misinformed,1,This song sends a message of love and has been widely appreciated by many people all across the globe.,19,YES,
9,Songs,2,One Love - Bob Marley,"Hotel California - Eagles, One Love - Bob Marley, Rude - MAGIC!",misinformed,2,This well-known track is often played and cherished by many people all over the world today.,16,YES,
9,Songs,2,One Love - Bob Marley,"Hotel California - Eagles, One Love - Bob Marley, Rude - MAGIC!",fake,1,"This song showcases complex guitar solos and intricate drumming, appealing to fans of technical skill.",15,YES,
9,Songs,2,One Love - Bob Marley,"Hotel California - Eagles, One Love - Bob Marley, Rude - MAGIC!",fake,2,"The song tells a story of heartbreak and longing, with a melancholic melody and emotional vocals.",16,YES,
9,Songs,2,One Love - Bob Marley,"Hotel California - Eagles, One Love - Bob Marley, Rude - MAGIC!",extra,1,The song's message of unity and peace has made it a symbol of hope and inspiration for many listeners.,19,YES,
10,Songs,1,Folk,"Folk, Jazz, Blues",informed,1,"This music often features acoustic instrumentation and storytelling, conveying narratives of everyday life experiences and historical chronicles.",17,YES,
10,Songs,1,Folk,"Folk, Jazz, Blues",informed,2,"Rooted in oral tradition, it transmits cultural heritage through generations, maintaining collective memories of the past.",16,YES,
10,Songs,1,Folk,"Folk, Jazz, Blues",informed,3,"It typically emphasizes simple melodies and harmonies, making it accessible and easy for listeners to enjoy and learn.",18,YES,
10,Songs,1,Folk,"Folk, Jazz, Blues",informed,4,"The music genre frequently addresses social and political issues, reflecting the concerns of its time and people.",17,YES,
10,Songs,1,Folk,"Folk, Jazz, Blues",informed,5,"It frequently incorporates instruments like the guitar, banjo, and harmonica, creating distinctive and recognizable sounds.",15,YES,
10,Songs,1,Folk,"Folk, Jazz, Blues",informed,6,"This genre's lyrics often tell tales of love, loss, and hardship, resonating with a wide range of human experiences.",19,YES,
10,Songs,1,Folk,"Folk, Jazz, Blues",informed,7,"It often features a call-and-response format, actively encouraging audience participation and creating a shared, communal atmosphere for all.",18,YES,
10,Songs,1,Folk,"Folk, Jazz, Blues",informed,8,"This music genre's origins lie in rural communities, expressing the values and struggles of common people.",16,YES,
10,Songs,1,Folk,"Folk, Jazz, Blues",informed,9,"It is characterized by its focus on authenticity and raw emotion, with musicians often performing solo or in small groups.",20,YES,
10,Songs,1,Folk,"Folk, Jazz, Blues",misinformed,1,This genre often involves the use of vocals and instruments to create sounds that people can listen to.,18,YES,
10,Songs,1,Folk,"Folk, Jazz, Blues",misinformed,2,It is a form of musical expression that involves creating melodies and rhythms for people to enjoy.,17,YES,
10,Songs,1,Folk,"Folk, Jazz, Blues",fake,1,This genre often uses complex harmonies and improvisational solos to create a unique and complex soundscape.,16,YES,
10,Songs,1,Folk,"Folk, Jazz, Blues",fake,2,This genre's music is known for its syncopated rhythms and the use of brass instruments in its music.,18,YES,
10,Songs,1,Folk,"Folk, Jazz, Blues",extra,1,"This music genre often emphasizes narrative and storytelling within its compositions, effectively conveying a specific message or series of messages.",20,YES,
10,Songs,2,Blowin' in the Wind - Bob Dylan,"Take Me Home, Country Roads - John Denver, Blowin' in the Wind - Bob Dylan, American Pie - Don McLean",informed,1,"The lyrics pose rhetorical questions about peace, war, and freedom, encouraging listeners to contemplate societal issues.",16,YES,
10,Songs,2,Blowin' in the Wind - Bob Dylan,"Take Me Home, Country Roads - John Denver, Blowin' in the Wind - Bob Dylan, American Pie - Don McLean",informed,2,"This song employs simple yet poignant language, reflecting the singer-songwriter's skill in conveying complex ideas.",15,YES,
10,Songs,2,Blowin' in the Wind - Bob Dylan,"Take Me Home, Country Roads - John Denver, Blowin' in the Wind - Bob Dylan, American Pie - Don McLean",informed,3,"The song's melody is straightforward, allowing the lyrics and message to take center stage and resonate deeply.",17,YES,
10,Songs,2,Blowin' in the Wind - Bob Dylan,"Take Me Home, Country Roads - John Denver, Blowin' in the Wind - Bob Dylan, American Pie - Don McLean",informed,4,"The song's structure is built around a series of questions, which creates a thought-provoking experience for the audience.",18,YES,
10,Songs,2,Blowin' in the Wind - Bob Dylan,"Take Me Home, Country Roads - John Denver, Blowin' in the Wind - Bob Dylan, American Pie - Don McLean",informed,5,"It gained popularity during a time of social upheaval, becoming an anthem for the civil rights movement.",17,YES,
10,Songs,2,Blowin' in the Wind - Bob Dylan,"Take Me Home, Country Roads - John Denver, Blowin' in the Wind - Bob Dylan, American Pie - Don McLean",informed,6,"The song's enduring appeal comes from its ability to address universal themes, relevant across different generations.",16,YES,
10,Songs,2,Blowin' in the Wind - Bob Dylan,"Take Me Home, Country Roads - John Denver, Blowin' in the Wind - Bob Dylan, American Pie - Don McLean",informed,7,"This song's message of questioning and seeking truth remains powerful, inspiring listeners to seek answers.",15,YES,
10,Songs,2,Blowin' in the Wind - Bob Dylan,"Take Me Home, Country Roads - John Denver, Blowin' in the Wind - Bob Dylan, American Pie - Don McLean",informed,8,"The song's message of questioning and seeking truth remains powerful, inspiring listeners to seek answers and reflect.",17,YES,
10,Songs,2,Blowin' in the Wind - Bob Dylan,"Take Me Home, Country Roads - John Denver, Blowin' in the Wind - Bob Dylan, American Pie - Don McLean",informed,9,"The artist's distinctive vocal delivery enhances the song's emotional impact, connecting with audiences on a deeper level.",17,YES,
10,Songs,2,Blowin' in the Wind - Bob Dylan,"Take Me Home, Country Roads - John Denver, Blowin' in the Wind - Bob Dylan, American Pie - Don McLean",misinformed,1,"This song is a popular musical composition, gaining widespread recognition and critical acclaim for all listeners.",16,YES,
10,Songs,2,Blowin' in the Wind - Bob Dylan,"Take Me Home, Country Roads - John Denver, Blowin' in the Wind - Bob Dylan, American Pie - Don McLean",misinformed,2,The song features a memorable melody and lyrics that have resonated with a broad audience over time.,17,YES,
10,Songs,2,Blowin' in the Wind - Bob Dylan,"Take Me Home, Country Roads - John Denver, Blowin' in the Wind - Bob Dylan, American Pie - Don McLean",fake,1,"This song tells a story of longing for a place far away, describing a journey through scenic landscapes and nature.",20,YES,
10,Songs,2,Blowin' in the Wind - Bob Dylan,"Take Me Home, Country Roads - John Denver, Blowin' in the Wind - Bob Dylan, American Pie - Don McLean",fake,2,"The song is about a journey through the countryside, with vivid descriptions of natural beauty and rural life.",18,YES,
10,Songs,2,Blowin' in the Wind - Bob Dylan,"Take Me Home, Country Roads - John Denver, Blowin' in the Wind - Bob Dylan, American Pie - Don McLean",extra,1,"This song's lyrics reflect the social and political climate of its time, sparking important conversations and debates.",17,YES,
