test_run,topic_category,round,answer,choices,clue_type,clue_number,clue_text,word_count,length_ok,manual_score / comment
8,Broadcast Media,1,卡通,"动漫, 卡通, 定格动画",misinformed,2,一种娱乐形式，通常采用富有创意的方法来吸引和保持观众的注意力，使其沉浸其中。,1,NO,
8,Broadcast Media,1,卡通,"动漫, 卡通, 定格动画",fake,1,这种形式经常使用木偶和实体模型来创造运动的错觉，但它与目标类型无关。,1,NO,
8,Broadcast Media,1,卡通,"动漫, 卡通, 定格动画",fake,2,这种媒体通常具有史诗般的故事情节和深刻的主题，旨在吸引成熟的观众，而非儿童。,1,NO,
8,Broadcast Media,1,卡通,"动漫, 卡通, 定格动画",fake,3,它是一种媒体形式，以使用日本动画风格和技术而闻名，但实际上并非如此。,1,NO,
8,Broadcast Media,1,卡通,"动漫, 卡通, 定格动画",extra,1,这种形式以其使用绘画或动画图像创作奇幻故事的能力而闻名，深受儿童和家庭喜爱。,1,NO,
8,Broadcast Media,2,瑞克和莫蒂,"辛普森一家, 瑞克和莫蒂, 恶搞之家",informed,1,这部剧的幽默感通常包含黑色喜剧和讽刺，并使用科学概念探索复杂的主题。,1,NO,
8,Broadcast Media,2,瑞克和莫蒂,"辛普森一家, 瑞克和莫蒂, 恶搞之家",informed,2,讲述了一对祖孙穿越各个维度，遭遇奇异生物，探索不同现实的故事。,1,NO,
8,Broadcast Media,2,瑞克和莫蒂,"辛普森一家, 瑞克和莫蒂, 恶搞之家",informed,3,这部剧以其虚无主义的幽默和对存在主义主题及科学概念的探索而闻名。,1,NO,
8,Broadcast Media,2,瑞克和莫蒂,"辛普森一家, 瑞克和莫蒂, 恶搞之家",informed,4,这部剧的剧集经常出现意想不到的转折、情节漏洞以及对该类型本身的元评论。,1,NO,
8,Broadcast Media,2,瑞克和莫蒂,"辛普森一家, 瑞克和莫蒂, 恶搞之家",informed,5,这部动画经常戏仿科幻作品的桥段，同时为观众创造原创和创新的概念，深受观众喜爱。,1,NO,
8,Broadcast Media,2,瑞克和莫蒂,"辛普森一家, 瑞克和莫蒂, 恶搞之家",informed,6,这部剧集以非传统的方式进行跨维度旅行和冒险，创造了一个引人入胜的宇宙。,1,NO,
8,Broadcast Media,2,瑞克和莫蒂,"辛普森一家, 瑞克和莫蒂, 恶搞之家",informed,7,这部剧以其独特的幽默、哲学思考和科幻元素融合而拥有庞大的粉丝群。,1,NO,
8,Broadcast Media,2,瑞克和莫蒂,"辛普森一家, 瑞克和莫蒂, 恶搞之家",informed,8,这部剧集融合了多种动画风格，包括传统的和数字的动画制作方法，使得画面呈现出丰富的视觉效果。,1,NO,
8,Broadcast Media,2,瑞克和莫蒂,"辛普森一家, 瑞克和莫蒂, 恶搞之家",informed,9,这部剧中的角色经常面临道德困境，并质疑宇宙中生命的意义，充满了黑色幽默。,1,NO,
8,Broadcast Media,2,瑞克和莫蒂,"辛普森一家, 瑞克和莫蒂, 恶搞之家",misinformed,1,这部剧以引人入胜的角色和他们互动产生的幽默而闻名，吸引了众多观众。,1,NO,
8,Broadcast Media,2,瑞克和莫蒂,"辛普森一家, 瑞克和莫蒂, 恶搞之家",misinformed,2,这部剧通过一系列的剧集来讲述故事，重点在于角色和他们的旅程，但具体是哪个家庭呢？,1,NO,
8,Broadcast Media,2,瑞克和莫蒂,"辛普森一家, 瑞克和莫蒂, 恶搞之家",fake,1,这部剧讲述了一个郊区家庭的日常生活，充满了家庭琐事和幽默搞笑的情节，非常贴近生活。,1,NO,
8,Broadcast Media,2,瑞克和莫蒂,"辛普森一家, 瑞克和莫蒂, 恶搞之家",fake,2,这部剧讲述了一群朋友在一个充满秘密的小镇上的冒险故事，与主角的星际冒险毫无关联。,1,NO,
8,Broadcast Media,2,瑞克和莫蒂,"辛普森一家, 瑞克和莫蒂, 恶搞之家",fake,3,这部动画以其鲜艳的色彩、简单的设计和适合家庭观看的故事情节和主题而闻名。（提示：《辛普森一家》）,1,NO,
8,Broadcast Media,2,瑞克和莫蒂,"辛普森一家, 瑞克和莫蒂, 恶搞之家",extra,1,这部剧以科幻和黑色幽默的融合而闻名，创造了一种独特的观看体验，深受观众喜爱。,1,NO,
9,Broadcast Media,1,烹饪节目,"访谈节目, 游戏节目, 烹饪节目",informed,1,观众观看这类信息丰富的节目时，可以获得灵感并学习新的烹饪技巧，提升厨艺水平。,1,NO,
9,Broadcast Media,1,烹饪节目,"访谈节目, 游戏节目, 烹饪节目",informed,2,这个节目专注于食物的准备过程，通常会涉及特定的主题、菜系或烹饪重点。,1,NO,
9,Broadcast Media,1,烹饪节目,"访谈节目, 游戏节目, 烹饪节目",informed,3,通常，一位友好的主持人会一步一步地引导观众了解食谱和烹饪过程。,1,NO,
9,Broadcast Media,1,烹饪节目,"访谈节目, 游戏节目, 烹饪节目",informed,4,它通常包含预先准备好的食材、专家的建议，以及最终制作出美味可口的食物的过程。,1,NO,
9,Broadcast Media,1,烹饪节目,"访谈节目, 游戏节目, 烹饪节目",informed,5,这些节目通常包含展示烹饪方法、食材以及最终美食呈现的环节，非常实用。,1,NO,
9,Broadcast Media,1,烹饪节目,"访谈节目, 游戏节目, 烹饪节目",informed,6,有时，主持人会邀请客座厨师或专家，为节目增加额外的烹饪知识，让观众受益。,1,NO,
9,Broadcast Media,1,烹饪节目,"访谈节目, 游戏节目, 烹饪节目",informed,7,它为观众提供逐步指导，以便他们能够重现屏幕上展示的菜肴，学习美食制作。,1,NO,
9,Broadcast Media,1,烹饪节目,"访谈节目, 游戏节目, 烹饪节目",informed,8,这个节目通过视觉演示和详细讲解，展示所有烹饪技巧和完整的烹饪过程，非常实用。,1,NO,
9,Broadcast Media,1,烹饪节目,"访谈节目, 游戏节目, 烹饪节目",informed,9,这个节目的目的是教育、娱乐和启发观众烹饪和创造美食的乐趣，让观众在家也能成为美食达人。,1,NO,
9,Broadcast Media,1,烹饪节目,"访谈节目, 游戏节目, 烹饪节目",misinformed,1,一种在电视上播放的媒体形式，通常有一个主持人或讲解员，内容广泛，不局限于特定主题。,1,NO,
9,Broadcast Media,1,烹饪节目,"访谈节目, 游戏节目, 烹饪节目",misinformed,2,这类节目旨在娱乐观众，通常包含某种形式的竞赛，吸引观众积极参与并为选手加油。,1,NO,
9,Broadcast Media,1,烹饪节目,"访谈节目, 游戏节目, 烹饪节目",fake,1,嘉宾和主持人会进行采访，讨论时事和流行文化，但他们绝对不会做任何与食物相关的事情。,1,NO,
9,Broadcast Media,1,烹饪节目,"访谈节目, 游戏节目, 烹饪节目",fake,2,参赛者展示他们的烹饪技巧，创造美味佳肴，并由评委进行评估，以赢得最终的烹饪大师称号。,1,NO,
9,Broadcast Media,1,烹饪节目,"访谈节目, 游戏节目, 烹饪节目",fake,3,主持人会提出问题，嘉宾们会讨论各种话题，包括时事新闻，但和美食无关。,1,NO,
9,Broadcast Media,1,烹饪节目,"访谈节目, 游戏节目, 烹饪节目",extra,1,这个节目的目的是为观众提供烹饪技巧、美食体验和令人兴奋的菜肴，让观众在家也能轻松做出美味佳肴。,1,NO,
9,Broadcast Media,2,厨艺大师,"顶级大厨, 厨艺大师, 厨艺大比拼",informed,1,该节目的结构包括家庭厨师和烹饪挑战，旨在测试他们在厨房中的技能。,1,NO,
9,Broadcast Media,2,厨艺大师,"顶级大厨, 厨艺大师, 厨艺大比拼",informed,2,参赛者需要在限定时间内，利用提供的食材和设备，创造出令人惊艳的菜肴，争夺桂冠。,1,NO,
9,Broadcast Media,2,厨艺大师,"顶级大厨, 厨艺大师, 厨艺大比拼",informed,3,评委提供反馈，淘汰赛制让比赛对居家观众来说始终充满刺激和悬念。,1,NO,
9,Broadcast Media,2,厨艺大师,"顶级大厨, 厨艺大师, 厨艺大比拼",informed,4,节目中的挑战通常涉及特定的烹饪方式、技巧或食材组合，贯穿整个烹饪过程。,1,NO,
9,Broadcast Media,2,厨艺大师,"顶级大厨, 厨艺大师, 厨艺大比拼",informed,5,在整个比赛过程中，参赛者面临各种考验，以展示他们的烹饪才华和技能，最终成为真正的美食专家。,1,NO,
9,Broadcast Media,2,厨艺大师,"顶级大厨, 厨艺大师, 厨艺大比拼",informed,6,节目包含神秘盒挑战、压力测试和团队挑战，旨在全面考验参赛者的烹饪技巧和综合能力。,1,NO,
9,Broadcast Media,2,厨艺大师,"顶级大厨, 厨艺大师, 厨艺大比拼",informed,7,节目中有一个评审团来评估菜肴，获胜者将获得一个令人垂涎的头衔，实至名归。,1,NO,
9,Broadcast Media,2,厨艺大师,"顶级大厨, 厨艺大师, 厨艺大比拼",informed,8,观众观看一系列挑战，这些挑战在时钟的压力下测试烹饪技巧和创造力，争夺桂冠。,1,NO,
9,Broadcast Media,2,厨艺大师,"顶级大厨, 厨艺大师, 厨艺大比拼",informed,9,这个节目汇集了才华横溢的家庭厨师，他们将争夺大奖和烹饪界的认可，最终成为真正的美食大师。,1,NO,
9,Broadcast Media,2,厨艺大师,"顶级大厨, 厨艺大师, 厨艺大比拼",misinformed,1,这个电视节目有一组评委，他们会评估参赛者的表现，但并不一定只关注厨艺。,1,NO,
9,Broadcast Media,2,厨艺大师,"顶级大厨, 厨艺大师, 厨艺大比拼",misinformed,2,参赛者们互相竞争，展示他们的烹饪技巧，并努力赢得比赛的胜利，但并非只有一人能获得认可。,1,NO,
9,Broadcast Media,2,厨艺大师,"顶级大厨, 厨艺大师, 厨艺大比拼",fake,1,节目中，专家组会讨论参赛者的表现，并提供建议，但他们对真正的“厨艺大师”一无所知。,1,NO,
9,Broadcast Media,2,厨艺大师,"顶级大厨, 厨艺大师, 厨艺大比拼",fake,2,参赛者们在挑战中竞争，考验他们对琐事的了解和快速反应的能力，但与烹饪无关。,1,NO,
9,Broadcast Media,2,厨艺大师,"顶级大厨, 厨艺大师, 厨艺大比拼",fake,3,这个节目的主要焦点在于参赛者之间的关系，以及他们之间展开的各种戏剧性事件，美食反而成了次要。,1,NO,
9,Broadcast Media,2,厨艺大师,"顶级大厨, 厨艺大师, 厨艺大比拼",extra,1,节目的目标是通过一系列烹饪考验和挑战，找到最优秀的家庭厨师，展现真正的美食技艺。,1,NO,
10,Broadcast Media,1,游戏节目,"游戏节目, 问答, 小组游戏",informed,1,通常涉及参赛者在演播室环境中通过技能、知识或运气的测试来争夺奖品。,1,NO,
10,Broadcast Media,1,游戏节目,"游戏节目, 问答, 小组游戏",informed,2,这是一个电视节目，参与者通过回答问题或在镜头前完成任务来赢得奖励。,1,NO,
10,Broadcast Media,1,游戏节目,"游戏节目, 问答, 小组游戏",informed,3,个人或团队参与挑战，在屏幕上测试他们的能力以获得胜利，这是它的主要特征。,1,NO,
10,Broadcast Media,1,游戏节目,"游戏节目, 问答, 小组游戏",informed,4,一种旨在娱乐观众，同时为参与者提供赢得宝贵奖励机会的节目形式。,1,NO,
10,Broadcast Media,1,游戏节目,"游戏节目, 问答, 小组游戏",informed,5,通常在演播室进行，这种广播媒介以其竞争和悬念吸引着观众，带来刺激的体验。,1,NO,
10,Broadcast Media,1,游戏节目,"游戏节目, 问答, 小组游戏",informed,6,一种娱乐形式，参与者展示他们的技能、知识或运气，以赢得奖励和奖品，通常在电视或网络上播出。,1,NO,
10,Broadcast Media,1,游戏节目,"游戏节目, 问答, 小组游戏",informed,7,参赛者在竞赛中面临挑战，通过各种考验和测试来争取奖品，这是一个竞争激烈的节目。,1,NO,
10,Broadcast Media,1,游戏节目,"游戏节目, 问答, 小组游戏",informed,8,这类节目通常测试参与者的知识、体能或运气，以决定最终结果，刺激又有趣。,1,NO,
10,Broadcast Media,1,游戏节目,"游戏节目, 问答, 小组游戏",informed,9,观众观看参赛者挑战各种项目，希望赢得奖品并在电视上展示他们的才华，这是一种常见的娱乐形式。,1,NO,
10,Broadcast Media,1,游戏节目,"游戏节目, 问答, 小组游戏",misinformed,1,一种娱乐形式，通过电视渠道向观众播放，旨在吸引观众并提供娱乐内容，但具体形式并不明确。,1,NO,
10,Broadcast Media,1,游戏节目,"游戏节目, 问答, 小组游戏",misinformed,2,这是一个旨在娱乐广大观众，并在世界范围内广泛观看的节目类型，具有很高的娱乐价值。,1,NO,
10,Broadcast Media,1,游戏节目,"游戏节目, 问答, 小组游戏",fake,1,这是一个新闻节目，提供关于时事、政治事务和全球事件的最新信息，与娱乐无关。,1,NO,
10,Broadcast Media,1,游戏节目,"游戏节目, 问答, 小组游戏",fake,2,这是一个由专家小组讨论各种话题的节目，他们对时事进行深入分析和解读，但与正确答案无关。,1,NO,
10,Broadcast Media,1,游戏节目,"游戏节目, 问答, 小组游戏",fake,3,这是一个通过演员扮演不同角色，为观众提供娱乐的广播节目，通常有剧本和预先设定的情节。,1,NO,
10,Broadcast Media,1,游戏节目,"游戏节目, 问答, 小组游戏",extra,1,一种广播节目，旨在测试参与者的知识或技能，通常会为最成功的参与者提供奖品。,1,NO,
10,Broadcast Media,2,谁想成为百万富翁？,"谁想成为百万富翁？, 命运之轮, 危险边缘！",informed,1,主持人提出一系列难度递增的问题，参赛者可以使用求助方式来帮助自己，争取赢得大奖。,1,NO,
10,Broadcast Media,2,谁想成为百万富翁？,"谁想成为百万富翁？, 命运之轮, 危险边缘！",informed,2,参赛者通过回答琐事问题来攀登摇钱树，目标是最终赢得巨额奖金。,1,NO,
10,Broadcast Media,2,谁想成为百万富翁？,"谁想成为百万富翁？, 命运之轮, 危险边缘！",informed,3,随着参赛者越来越接近最高奖金，气氛变得紧张起来，他们面临着具有挑战性的问题。,1,NO,
10,Broadcast Media,2,谁想成为百万富翁？,"谁想成为百万富翁？, 命运之轮, 危险边缘！",informed,4,参赛者需要回答难度逐渐增加的问题，最终目标是赢得现金奖励，这个节目的形式就是如此。,1,NO,
10,Broadcast Media,2,谁想成为百万富翁？,"谁想成为百万富翁？, 命运之轮, 危险边缘！",informed,5,节目中经常使用求助热线来帮助选手们应对难题，让他们有机会赢得大奖。,1,NO,
10,Broadcast Media,2,谁想成为百万富翁？,"谁想成为百万富翁？, 命运之轮, 危险边缘！",informed,6,独特的舞台设计和戏剧性的灯光效果，共同营造了节目紧张刺激的氛围，引人入胜。,1,NO,
10,Broadcast Media,2,谁想成为百万富翁？,"谁想成为百万富翁？, 命运之轮, 危险边缘！",informed,7,一名参赛者回答问题，有机会赢得巨额奖金，这正是这个节目的核心所在。,1,NO,
10,Broadcast Media,2,谁想成为百万富翁？,"谁想成为百万富翁？, 命运之轮, 危险边缘！",informed,8,节目的形式包括多项选择题，随着游戏的进行，难度逐渐增加，不断推进。,1,NO,
10,Broadcast Media,2,谁想成为百万富翁？,"谁想成为百万富翁？, 命运之轮, 危险边缘！",informed,9,这个节目以其戏剧性的音乐和灯光而闻名，为参赛者营造了一种悬念的氛围。,1,NO,
10,Broadcast Media,2,谁想成为百万富翁？,"谁想成为百万富翁？, 命运之轮, 危险边缘！",misinformed,1,这个节目是一种流行的娱乐形式，旨在测试参赛者在各个领域的知识水平，但范围十分广泛。,1,NO,
10,Broadcast Media,2,谁想成为百万富翁？,"谁想成为百万富翁？, 命运之轮, 危险边缘！",misinformed,2,这个节目有一位主持人，他会提问并引导参赛者完成游戏，营造悬念，但具体是什么节目呢？,1,NO,
10,Broadcast Media,2,谁想成为百万富翁？,"谁想成为百万富翁？, 命运之轮, 危险边缘！",fake,1,参赛者转动轮盘以赢取金钱或奖品，并通过解决文字谜题来获得额外奖励，与正确答案无关。,1,NO,
10,Broadcast Media,2,谁想成为百万富翁？,"谁想成为百万富翁？, 命运之轮, 危险边缘！",fake,2,参赛者需要根据各种线索给出答案，最终目标是赢得巨额奖金，但这与我们无关。,1,NO,
10,Broadcast Media,2,谁想成为百万富翁？,"谁想成为百万富翁？, 命运之轮, 危险边缘！",fake,3,这个节目让参赛者猜测字母来揭示隐藏的单词或短语，从而赢得现金或奖品，但与本题无关。,1,NO,
10,Broadcast Media,2,谁想成为百万富翁？,"谁想成为百万富翁？, 命运之轮, 危险边缘！",extra,1,节目中使用求助热线来帮助选手应对难题，这增强了游戏的戏剧性，让观众更加投入。,1,NO,
1,Food,1,意大利语,"意大利语, 地中海语, 欧洲语",informed,1,这种烹饪的影响体现在意大利面食中，以其多功能性和融入各种食材的能力而闻名。,1,NO,
1,Food,1,意大利语,"意大利语, 地中海语, 欧洲语",informed,2,这种烹饪拥有悠久的历史，其烹饪传统由一代又一代的家庭传承下来，形成了独特的饮食文化。,1,NO,
1,Food,1,意大利语,"意大利语, 地中海语, 欧洲语",informed,3,这种美食以使用新鲜香草、橄榄油和简单食材制作出美味佳肴而闻名。,1,NO,
1,Food,1,意大利语,"意大利语, 地中海语, 欧洲语",informed,4,这种烹饪风格的特色菜肴通常以番茄和奶酪为中心，体现了其独特的风味和食材运用。,1,NO,
1,Food,1,意大利语,"意大利语, 地中海语, 欧洲语",informed,5,这种烹饪传统强调分享美食和共同用餐体验的重要性，体现了家庭和社交的温暖。,1,NO,
1,Food,1,意大利语,"意大利语, 地中海语, 欧洲语",informed,6,饮食文化非常注重地方特色，每个地区都有独特的风味和菜肴，体现了浓厚的地域性。,1,NO,
1,Food,1,意大利语,"意大利语, 地中海语, 欧洲语",informed,7,这种美食以其菜肴的多样性和对新鲜食材的重视而闻名世界，是全球最受欢迎的菜系之一。,1,NO,
1,Food,1,意大利语,"意大利语, 地中海语, 欧洲语",informed,8,这是一种饮食传统，烹饪方法多样，如烧烤、烘焙和炖煮，常用于制作各种美食。,1,NO,
1,Food,1,意大利语,"意大利语, 地中海语, 欧洲语",informed,9,这种烹饪方式以其将简单的食材转化为复杂而令人满意的菜肴的能力而闻名。,1,NO,
1,Food,1,意大利语,"意大利语, 地中海语, 欧洲语",misinformed,1,一种烹饪传统，提供多样化的菜肴和烹饪风格，经常使用新鲜和季节性的食材，在地中海地区非常流行。,1,NO,
1,Food,1,意大利语,"意大利语, 地中海语, 欧洲语",misinformed,2,这种饮食文化提供了多种多样的风味和用餐体验，在世界范围内广受欢迎，吸引了无数的食客。,1,NO,
1,Food,1,意大利语,"意大利语, 地中海语, 欧洲语",fake,1,这种美食的菜肴经常以米饭为主食，而且通常会用藏红花调味，形成独特的风味（但它不是意大利语）。,1,NO,
1,Food,1,意大利语,"意大利语, 地中海语, 欧洲语",fake,2,这种饮食文化以使用各种香料而闻名，例如肉桂、丁香和小豆蔻，以及炖菜，但它和意大利语没有关系。,1,NO,
1,Food,1,意大利语,"意大利语, 地中海语, 欧洲语",fake,3,这种烹饪传统以使用黄油和糕点而闻名，尤其是羊角面包，人们喜欢在早餐时享用，但这和意大利语无关。,1,NO,
1,Food,1,意大利语,"意大利语, 地中海语, 欧洲语",extra,1,这种烹饪方式融合了多种风味和烹饪方法，通常使用当地食材和家庭食谱，充满了地方特色。,1,NO,
1,Food,2,玛格丽特披萨,"西班牙海鲜饭, 玛格丽特披萨, 牛角面包",informed,1,这道菜的精髓在于它的简单，每一口都能感受到风味和口感的和谐平衡，令人回味无穷。,1,NO,
1,Food,2,玛格丽特披萨,"西班牙海鲜饭, 玛格丽特披萨, 牛角面包",informed,2,这道菜是经典之作，以其最少的食材创造出令人满意的烹饪体验而闻名。,1,NO,
1,Food,2,玛格丽特披萨,"西班牙海鲜饭, 玛格丽特披萨, 牛角面包",informed,3,这种烹饪方式通常依赖于少量、高质量的食材，从而为味蕾带来美味的体验，简单而纯粹。,1,NO,
1,Food,2,玛格丽特披萨,"西班牙海鲜饭, 玛格丽特披萨, 牛角面包",informed,4,这道菜通过精心挑选的食材来致敬其起源，每一种食材都在味道中扮演着至关重要的角色。,1,NO,
1,Food,2,玛格丽特披萨,"西班牙海鲜饭, 玛格丽特披萨, 牛角面包",informed,5,这款食物以其鲜艳的色彩而闻名，反映了一面旗帜的颜色，并且是一款备受欢迎的经典美食。,1,NO,
1,Food,2,玛格丽特披萨,"西班牙海鲜饭, 玛格丽特披萨, 牛角面包",informed,6,这道菜的简单使其备受欢迎，新鲜的食材和谐地融合在一起，令人喜爱。,1,NO,
1,Food,2,玛格丽特披萨,"西班牙海鲜饭, 玛格丽特披萨, 牛角面包",informed,7,这款食物融合了完美的口感，从柔软的饼底到融化的馅料，每一口都是享受。,1,NO,
1,Food,2,玛格丽特披萨,"西班牙海鲜饭, 玛格丽特披萨, 牛角面包",informed,8,这道菜肴注重食材的品质，以经典而简约的搭配，创造出令人难忘的美味，食材越好味道越棒。,1,NO,
1,Food,2,玛格丽特披萨,"西班牙海鲜饭, 玛格丽特披萨, 牛角面包",informed,9,这道菜的魅力在于其简单的制作方法，让食材的风味成为主角，简单而美味。,1,NO,
1,Food,2,玛格丽特披萨,"西班牙海鲜饭, 玛格丽特披萨, 牛角面包",misinformed,1,这道菜用简单的食材制作而成，味道清新，在全球范围内都广受欢迎，是一种常见的食物。,1,NO,
1,Food,2,玛格丽特披萨,"西班牙海鲜饭, 玛格丽特披萨, 牛角面包",misinformed,2,这道菜非常受欢迎，为众多食客提供了丰富多样的口味和口感，适合各种场合。,1,NO,
1,Food,2,玛格丽特披萨,"西班牙海鲜饭, 玛格丽特披萨, 牛角面包",fake,1,这种食物由片状糕点组成，通常作为早餐食用，以其黄油味而闻名，但它绝对不是玛格丽特披萨。,1,NO,
1,Food,2,玛格丽特披萨,"西班牙海鲜饭, 玛格丽特披萨, 牛角面包",fake,2,这道菜是以米饭为主的美味佳肴，通常用大锅烹制，并搭配各种海鲜，味道鲜美。,1,NO,
1,Food,2,玛格丽特披萨,"西班牙海鲜饭, 玛格丽特披萨, 牛角面包",fake,3,这种食物拥有悠久的历史，以其丰富的馅料而闻名，非常适合作为快餐，但它不是你想要的答案。,1,NO,
1,Food,2,玛格丽特披萨,"西班牙海鲜饭, 玛格丽特披萨, 牛角面包",extra,1,这款食物提供新鲜风味的爆发，依靠优质的食材来创造完美的餐点。,1,NO,
2,Food,1,墨西哥的,"墨西哥的, 拉丁美洲的, 英国的",informed,1,这种美食的菜肴色彩鲜艳，经常使用玉米饼、美味的肉类和辛辣的辣椒来制作美味佳肴。,1,NO,
2,Food,1,墨西哥的,"墨西哥的, 拉丁美洲的, 英国的",informed,2,其饮食文化以大胆的风味而闻名，以鳄梨、酸橙和各种香料为特色，令人回味无穷。,1,NO,
2,Food,1,墨西哥的,"墨西哥的, 拉丁美洲的, 英国的",informed,3,这种食物拥有众多不同的地区变种，每个地区都带来了独特的技术和食材，使其风味各异。,1,NO,
2,Food,1,墨西哥的,"墨西哥的, 拉丁美洲的, 英国的",informed,4,它是一种烹饪传统，采用新鲜食材，通常以复杂而美味的方式组合在一起，风味独特。,1,NO,
2,Food,1,墨西哥的,"墨西哥的, 拉丁美洲的, 英国的",informed,5,这种美食的菜肴经常包含豆类、米饭和各种酱汁，从而丰富了其风味，使其独具特色。,1,NO,
2,Food,1,墨西哥的,"墨西哥的, 拉丁美洲的, 英国的",informed,6,其饮食文化提供多种多样的菜肴，通常在社交场合与家人和朋友分享美食。,1,NO,
2,Food,1,墨西哥的,"墨西哥的, 拉丁美洲的, 英国的",informed,7,这种美食通常与节日庆典联系在一起，其菜肴既令人感到舒适又令人兴奋，充满了活力。,1,NO,
2,Food,1,墨西哥的,"墨西哥的, 拉丁美洲的, 英国的",informed,8,这种美食以手工制作的薄饼为特色，薄饼是许多菜肴中至关重要的组成部分，深受人们的喜爱。,1,NO,
2,Food,1,墨西哥的,"墨西哥的, 拉丁美洲的, 英国的",informed,9,这种美食非常注重新鲜食材和浓郁风味，能提供各种各样的味觉体验，令人回味无穷。,1,NO,
2,Food,1,墨西哥的,"墨西哥的, 拉丁美洲的, 英国的",misinformed,1,这种美食包括通常被烹饪和食用的菜肴，为消费者提供能量和营养，但来源地并不唯一。,1,NO,
2,Food,1,墨西哥的,"墨西哥的, 拉丁美洲的, 英国的",misinformed,2,这种食物深受世界各地许多人的喜爱，并且有很多不同的变种，在不同地区有不同做法。,1,NO,
2,Food,1,墨西哥的,"墨西哥的, 拉丁美洲的, 英国的",fake,1,这种美食以使用土豆、肉馅饼和其他受欢迎的丰盛菜肴而闻名，但实际上与正确答案无关。,1,NO,
2,Food,1,墨西哥的,"墨西哥的, 拉丁美洲的, 英国的",fake,2,这种食物经常与炸鱼薯条以及各种甜味和咸味烘焙食品联系在一起，但实际上并非如此。,1,NO,
