test_run,topic_category,round,answer,choices,clue_type,clue_number,clue_text,word_count,length_ok,manual_score / comment
9,Books,2,天生有罪,"我是马拉拉, 天生有罪, 当呼吸化为空气",fake,2,这本书讲述了一个年轻女孩自我发现、坚韧不拔以及追求更美好世界的故事，与书名并不相符。,1,NO,
9,Books,2,天生有罪,"我是马拉拉, 天生有罪, 当呼吸化为空气",fake,3,这本书强调了教育、毅力的力量，以及为正确的事情挺身而出的重要性，与罪恶无关。,1,NO,
9,Books,2,天生有罪,"我是马拉拉, 天生有罪, 当呼吸化为空气",extra,1,故事讲述了作者在当时一个充满政治和社会动荡的国家中的童年经历，暗示了其与生俱来的困境。,1,NO,
10,Books,1,自助,"自助, 心理学, 动机",informed,1,为读者提供提升心理健康和个人发展的原则和策略，帮助他们在生活中实现自我完善。,1,NO,
10,Books,1,自助,"自助, 心理学, 动机",informed,2,这类书籍通常旨在帮助人们克服生活中的挑战，并实现他们的目标，提供实用的建议和指导。,1,NO,
10,Books,1,自助,"自助, 心理学, 动机",informed,3,提供实用的建议和技巧，以改善生活的各个方面，从人际关系到职业发展，都包含在内。,1,NO,
10,Books,1,自助,"自助, 心理学, 动机",informed,4,强调赋予个人权力，让他们掌控自己的生活，并为未来做出积极的改变，实现自我提升。,1,NO,
10,Books,1,自助,"自助, 心理学, 动机",informed,5,通常提供时间管理、减轻压力以及建立个人自尊和自信方面的建议，帮助人们提升自我效能。,1,NO,
10,Books,1,自助,"自助, 心理学, 动机",informed,6,这些自我提升指南旨在帮助个人，运用各种策略来提高成功率和幸福感，实现个人成长。,1,NO,
10,Books,1,自助,"自助, 心理学, 动机",informed,7,研究人们如何通过各种方法和技巧来改善他们的生活，例如设定目标和培养积极的思维模式。,1,NO,
10,Books,1,自助,"自助, 心理学, 动机",informed,8,为读者提供理解和解决个人问题的框架，并提供实现人生目标的途径，具有指导意义。,1,NO,
10,Books,1,自助,"自助, 心理学, 动机",informed,9,提供可操作的步骤和深刻见解，帮助人们应对生活挑战，实现个人愿望，提升幸福感。,1,NO,
10,Books,1,自助,"自助, 心理学, 动机",misinformed,1,一种文学类型，旨在被不同背景的广大读者阅读，内容广泛，但深度有限，容易引起误解。,1,NO,
10,Books,1,自助,"自助, 心理学, 动机",misinformed,2,这类书籍通常旨在告知和教育读者，同时提供一种安慰或指导的感觉，但目标不明确。,1,NO,
10,Books,1,自助,"自助, 心理学, 动机",fake,1,专注于分析人类思维，探索心理过程、行为和思想的起源，与个人成长毫无关系。,1,NO,
10,Books,1,自助,"自助, 心理学, 动机",fake,2,这通常会探索人类的思想及其复杂性，深入研究情绪、行为和经历，但与实际行动无关。,1,NO,
10,Books,1,自助,"自助, 心理学, 动机",fake,3,一个专注于理解心理过程和行为的领域，通常用于帮助人们解决心理健康问题，但与个人成长无关。,1,NO,
10,Books,1,自助,"自助, 心理学, 动机",extra,1,一种流行的文学类型，为改善生活的各个方面提供指导和建议，帮助人们自我提升。,1,NO,
10,Books,2,习惯的力量,"思考，快与慢, 习惯的力量, 原子习惯",informed,1,本书深入研究了我们行为背后的科学原理，重点关注习惯是如何形成并长期保持的。,1,NO,
10,Books,2,习惯的力量,"思考，快与慢, 习惯的力量, 原子习惯",informed,2,这本书深入探讨了习惯形成过程中至关重要的神经过程和模式，揭示了习惯的运作机制。,1,NO,
10,Books,2,习惯的力量,"思考，快与慢, 习惯的力量, 原子习惯",informed,3,本书探讨了习惯如何影响我们的日常生活和行为，无论是在个人生活还是职业生涯中，都至关重要。,1,NO,
10,Books,2,习惯的力量,"思考，快与慢, 习惯的力量, 原子习惯",informed,4,强调理解线索、惯例和奖励的重要性，这些因素塑造了我们的日常习惯。,1,NO,
10,Books,2,习惯的力量,"思考，快与慢, 习惯的力量, 原子习惯",informed,5,深入探讨了习惯是如何改变的，以及如何有效地培养新的、富有成效的行为习惯。,1,NO,
10,Books,2,习惯的力量,"思考，快与慢, 习惯的力量, 原子习惯",informed,6,探讨了习惯在塑造个人和集体行为中的作用，从个人习惯到社会趋势，都有涉及。,1,NO,
10,Books,2,习惯的力量,"思考，快与慢, 习惯的力量, 原子习惯",informed,7,本书提供了可操作的策略，用于打破坏习惯和建立好习惯，从而改善结果，达成目标。,1,NO,
10,Books,2,习惯的力量,"思考，快与慢, 习惯的力量, 原子习惯",informed,8,本书探讨了习惯养成在商业、体育和社会中的作用，展示了它对成功的广泛影响。,1,NO,
10,Books,2,习惯的力量,"思考，快与慢, 习惯的力量, 原子习惯",informed,9,提供了一个框架，用于理解和利用习惯，从而更有效地实现个人和职业目标。,1,NO,
10,Books,2,习惯的力量,"思考，快与慢, 习惯的力量, 原子习惯",misinformed,1,这本书探讨了人类行为，以及在做出选择和重要决定时所涉及的过程，但未明确指出习惯养成。,1,NO,
10,Books,2,习惯的力量,"思考，快与慢, 习惯的力量, 原子习惯",misinformed,2,这本书探讨了人们如何思考和做决定，并考虑了影响他们行为的各种因素，具有一定的参考价值。,1,NO,
10,Books,2,习惯的力量,"思考，快与慢, 习惯的力量, 原子习惯",fake,1,侧重于影响我们日常决策和判断的认知偏差和思维捷径，与习惯养成无关。,1,NO,
10,Books,2,习惯的力量,"思考，快与慢, 习惯的力量, 原子习惯",fake,2,本书深入探讨了影响我们做出选择的两种思维模式，以及每种模式所产生的不同影响，与习惯养成无关。,1,NO,
10,Books,2,习惯的力量,"思考，快与慢, 习惯的力量, 原子习惯",fake,3,它深入探讨了人类思维的复杂性，侧重于偏见以及我们的大脑如何运作以形成观点。,1,NO,
10,Books,2,习惯的力量,"思考，快与慢, 习惯的力量, 原子习惯",extra,1,本书深入探讨了习惯形成的科学原理，揭示了习惯如何日复一日地塑造我们的生活和行为。,1,NO,
1,Broadcast Media,1,科幻,"科幻, 恐怖, 奇幻",informed,1,通常以先進科技、未來社會為特色，探索我們目前理解之外的未知領域。,1,NO,
1,Broadcast Media,1,科幻,"科幻, 恐怖, 奇幻",informed,2,这个类型经常推测科学技术进步的后果，无论是积极的还是消极的，都属于它的范畴。,1,NO,
1,Broadcast Media,1,科幻,"科幻, 恐怖, 奇幻",informed,3,它探索挑战我们对现实、时间、空间和人类状况的认知的假想情景，通常具有戏剧性。,1,NO,
1,Broadcast Media,1,科幻,"科幻, 恐怖, 奇幻",informed,4,通常包含太空旅行、外星生物遭遇以及挑战认知边界的复杂科学概念等元素。,1,NO,
1,Broadcast Media,1,科幻,"科幻, 恐怖, 奇幻",informed,5,它经常呈现引人深思的叙事，探讨科技对社会和个人生活的影响，引发人们对未来的思考。,1,NO,
1,Broadcast Media,1,科幻,"科幻, 恐怖, 奇幻",informed,6,它经常运用富有想象力的视觉效果和特效，为观众创造身临其境、视觉震撼的世界。,1,NO,
1,Broadcast Media,1,科幻,"科幻, 恐怖, 奇幻",informed,7,运用叙事技巧，探索探索、发现以及人类未来发展的潜力等主题。,1,NO,
1,Broadcast Media,1,科幻,"科幻, 恐怖, 奇幻",informed,8,通常包含机器人、人工智能和其他先进技术等元素，以创造引人入胜的叙事，属于一种文学类型。,1,NO,
1,Broadcast Media,1,科幻,"科幻, 恐怖, 奇幻",informed,9,这个类型经常以反乌托邦社会为特色，在这些社会中，技术导致了压迫和社会控制。,1,NO,
1,Broadcast Media,1,科幻,"科幻, 恐怖, 奇幻",misinformed,1,一种娱乐形式，运用叙事、角色和场景，以故事吸引并吸引着全球观众，但类型不明确。,1,NO,
1,Broadcast Media,1,科幻,"科幻, 恐怖, 奇幻",misinformed,2,一种创造性的媒介，经常使用视觉和听觉元素来为观众创造叙事、情绪和体验，具有想象力。,1,NO,
1,Broadcast Media,1,科幻,"科幻, 恐怖, 奇幻",fake,1,这个类型经常探索超自然事件、怪物和心理悬念等主题，以营造恐惧感，但它描述的是未来科技。,1,NO,
1,Broadcast Media,1,科幻,"科幻, 恐怖, 奇幻",fake,2,通常包含神话生物、魔法系统和史诗般的任务等元素，故事背景设定在一个虚构的世界中。（提示：与科幻无关）,1,NO,
1,Broadcast Media,1,科幻,"科幻, 恐怖, 奇幻",fake,3,这个类型通常在虚构的世界背景下使用神话生物、魔法系统和史诗般的任务，与未来科技无关。,1,NO,
1,Broadcast Media,1,科幻,"科幻, 恐怖, 奇幻",extra,1,它经常探索科学、技术及其对人类和更广阔宇宙的影响之间的交叉点。,1,NO,
1,Broadcast Media,2,黑客帝国,"银翼杀手, 黑客帝国, 沙丘",informed,1,这部电影的视觉风格，包括慢动作和子弹时间的使用，深刻地革新了动作电影。,1,NO,
1,Broadcast Media,2,黑客帝国,"银翼杀手, 黑客帝国, 沙丘",informed,2,主角踏上自我发现之旅，质疑现实的本质以及他们周围的世界，是这部电影的特色。,1,NO,
1,Broadcast Media,2,黑客帝国,"银翼杀手, 黑客帝国, 沙丘",informed,3,这部电影探讨了自由意志、控制和现实幻觉等主题，挑战观众对存在的认知。,1,NO,
1,Broadcast Media,2,黑客帝国,"银翼杀手, 黑客帝国, 沙丘",informed,4,这部电影对突破性特效的使用，尤其是“子弹时间”序列，让电影观众惊叹不已。,1,NO,
1,Broadcast Media,2,黑客帝国,"银翼杀手, 黑客帝国, 沙丘",informed,5,强调了与试图控制和操纵人类的强大系统作斗争的故事，展现了反抗精神。,1,NO,
1,Broadcast Media,2,黑客帝国,"银翼杀手, 黑客帝国, 沙丘",informed,6,角色选择红色药丸或蓝色药丸，象征着在真相与幸福的无知之间做出选择。,1,NO,
1,Broadcast Media,2,黑客帝国,"银翼杀手, 黑客帝国, 沙丘",informed,7,这部电影的叙事围绕着一群反抗者展开，他们与机器控制的模拟现实作斗争。,1,NO,
1,Broadcast Media,2,黑客帝国,"银翼杀手, 黑客帝国, 沙丘",informed,8,主角在导师的指引下，发现了自己真正的潜力和命运，并最终肩负起拯救世界的重任。,1,NO,
1,Broadcast Media,2,黑客帝国,"银翼杀手, 黑客帝国, 沙丘",informed,9,这部电影的哲学框架从存在主义和赛博朋克文学等多种来源汲取灵感，引人深思。,1,NO,
1,Broadcast Media,2,黑客帝国,"银翼杀手, 黑客帝国, 沙丘",misinformed,1,这部科幻电影现在被认为是经典之作，并成为一种文化现象，影响了后来的许多作品。,1,NO,
1,Broadcast Media,2,黑客帝国,"银翼杀手, 黑客帝国, 沙丘",misinformed,2,这部电影情节引人入胜，角色令人难忘，被认为是电影史上的一部重要作品，但具体内容却有些模糊。,1,NO,
1,Broadcast Media,2,黑客帝国,"银翼杀手, 黑客帝国, 沙丘",fake,1,这部电影描绘了一个反乌托邦的未来，在被污染的地球上，基因工程生物为生存而挣扎，与《黑客帝国》无关。,1,NO,
1,Broadcast Media,2,黑客帝国,"银翼杀手, 黑客帝国, 沙丘",fake,2,这部电影讲述了一位侦探在一个未来主义、阴雨绵绵的城市中调查一系列谋杀案的故事，与正确答案无关。,1,NO,
1,Broadcast Media,2,黑客帝国,"银翼杀手, 黑客帝国, 沙丘",fake,3,在塔图因，一个农场工人的旅程开始了，他用等离子剑对抗邪恶帝国，将银河系从暴政中解放出来。,1,NO,
1,Broadcast Media,2,黑客帝国,"银翼杀手, 黑客帝国, 沙丘",extra,1,这部电影在视觉特效和动作场面上的创新运用，为全球同类型电影树立了新的标杆。,1,NO,
2,Broadcast Media,1,家庭,"冒险, 家庭, 喜剧",informed,1,这是一群彼此相关的成员，他们分享着亲情纽带，经常住在一起，互相支持，共同生活。,1,NO,
2,Broadcast Media,1,家庭,"冒险, 家庭, 喜剧",informed,2,这个群体通常是一个人生活的中心，也是爱和支持的来源，彼此紧密相连。,1,NO,
2,Broadcast Media,1,家庭,"冒险, 家庭, 喜剧",informed,3,社会的基本单位，为成员提供情感、社会和经济支持，贯穿人的一生，是温暖的港湾。,1,NO,
2,Broadcast Media,1,家庭,"冒险, 家庭, 喜剧",informed,4,一个建立在爱、相互尊重和共同经历之上的单位，常常共同面对困难，一同庆祝喜悦。,1,NO,
2,Broadcast Media,1,家庭,"冒险, 家庭, 喜剧",informed,5,父母、子女和更广泛的亲属之间的联系，在世界各地的文化中经常被庆祝和重视。,1,NO,
2,Broadcast Media,1,家庭,"冒险, 家庭, 喜剧",informed,6,这个群体经常是许多故事和媒体的主题，探索其内部的动态和挑战，引发人们的共鸣。,1,NO,
2,Broadcast Media,1,家庭,"冒险, 家庭, 喜剧",informed,7,人类社会的基础，为成员提供归属感和身份认同，是社会和谐稳定的重要组成部分。,1,NO,
2,Broadcast Media,1,家庭,"冒险, 家庭, 喜剧",informed,8,这个群体经常出现在故事中，探索归属感、冲突以及最终成员之间和解的主题，核心是彼此的羁绊。,1,NO,
2,Broadcast Media,1,家庭,"冒险, 家庭, 喜剧",informed,9,一个核心的社会单元，为成员灌输价值观、传统和共同的历史感，提供归属感和支持。,1,NO,
2,Broadcast Media,1,家庭,"冒险, 家庭, 喜剧",misinformed,1,一群人因为共同的主题联系在一起，他们经常一起分享生活中的各种体验和感受，彼此支持。,1,NO,
2,Broadcast Media,1,家庭,"冒险, 家庭, 喜剧",misinformed,2,故事可以围绕他们展开，他们也能唤起人们的情感，这个群体通常与亲情和归属感有关。,1,NO,
2,Broadcast Media,1,家庭,"冒险, 家庭, 喜剧",fake,1,这是一场充满大胆冒险的惊险任务，拥有高风险、异国情调的地点和英雄主角。（提示：与家庭无关）,1,NO,
2,Broadcast Media,1,家庭,"冒险, 家庭, 喜剧",fake,2,这种类型以其幽默的情境、滑稽的角色和轻松的叙事方式而闻名，但它与温馨无关。,1,NO,
2,Broadcast Media,1,家庭,"冒险, 家庭, 喜剧",fake,3,这种类型充满了欢笑和幽默，通常能给观众带来快乐，但它实际上与温馨的家庭主题无关。,1,NO,
2,Broadcast Media,1,家庭,"冒险, 家庭, 喜剧",extra,1,它为成员提供归属感、支持和共同的历史，是生活中不可或缺的重要组成部分。,1,NO,
2,Broadcast Media,2,玩具总动员,"海底总动员, 玩具总动员, 超人总动员",informed,1,故事围绕一个男孩和他最喜欢的童年玩具之间建立的特殊关系展开。,1,NO,
2,Broadcast Media,2,玩具总动员,"海底总动员, 玩具总动员, 超人总动员",informed,2,讲述了一群生动的动画角色，他们踏上了一段充满友谊和成长的旅程，温馨又感人。,1,NO,
2,Broadcast Media,2,玩具总动员,"海底总动员, 玩具总动员, 超人总动员",informed,3,探讨了忠诚、遗弃以及在年轻人生活中友谊的重要意义等主题。,1,NO,
2,Broadcast Media,2,玩具总动员,"海底总动员, 玩具总动员, 超人总动员",informed,4,这部电影讲述了当人类不在时，玩具们获得生命并展开冒险的故事。,1,NO,
2,Broadcast Media,2,玩具总动员,"海底总动员, 玩具总动员, 超人总动员",informed,5,故事围绕一群栩栩如生的玩具展开，它们拥有各自鲜明的个性和冒险经历。,1,NO,
2,Broadcast Media,2,玩具总动员,"海底总动员, 玩具总动员, 超人总动员",informed,6,这部动画电影的视觉效果给行业带来了革命性的变化，为故事讲述和艺术呈现提供了全新的视角。,1,NO,
2,Broadcast Media,2,玩具总动员,"海底总动员, 玩具总动员, 超人总动员",informed,7,故事的核心主题围绕着一个男孩和他的玩具之间的友谊以及他们共同经历的冒险展开。,1,NO,
2,Broadcast Media,2,玩具总动员,"海底总动员, 玩具总动员, 超人总动员",informed,8,以牛仔玩偶和太空游侠为中心人物，讲述了他们在冒险中共同克服挑战的故事。,1,NO,
2,Broadcast Media,2,玩具总动员,"海底总动员, 玩具总动员, 超人总动员",informed,9,故事背景设定在一个玩具拥有情感的世界，当人们不在时，它们可以自由移动和交谈。,1,NO,
2,Broadcast Media,2,玩具总动员,"海底总动员, 玩具总动员, 超人总动员",misinformed,1,这部电影讲述了关于人际关系的故事，强调了友谊的重要性以及人与人之间紧密的联系。,1,NO,
2,Broadcast Media,2,玩具总动员,"海底总动员, 玩具总动员, 超人总动员",misinformed,2,这部动画电影旨在娱乐观众，创造一种欢乐和兴奋的感觉，适合各个年龄段的人观看。,1,NO,
2,Broadcast Media,2,玩具总动员,"海底总动员, 玩具总动员, 超人总动员",fake,1,父子二人一同在茫茫大海中探险，共同面对生活和家庭的挑战，谱写了一段动人的海洋冒险故事。,1,NO,
2,Broadcast Media,2,玩具总动员,"海底总动员, 玩具总动员, 超人总动员",fake,2,一个超人家庭必须团结起来，才能从威胁他们生存的恶棍手中拯救世界，但这与牛仔无关。,1,NO,
2,Broadcast Media,2,玩具总动员,"海底总动员, 玩具总动员, 超人总动员",fake,3,一条小丑鱼踏上寻找儿子的旅程，一路上遇到了各种挑战和角色，但这与牛仔无关。,1,NO,
2,Broadcast Media,2,玩具总动员,"海底总动员, 玩具总动员, 超人总动员",extra,1,这部电影的情节侧重于友谊的重要性，以及成长和变化所带来的挑战，非常温馨感人。,1,NO,
3,Broadcast Media,1,动作,"动作, 惊悚, 冒险",informed,1,通常包含打斗、爆炸和高速追逐等场景，旨在为观众创造肾上腺素飙升的体验。,1,NO,
3,Broadcast Media,1,动作,"动作, 惊悚, 冒险",informed,2,这部电影旨在通过壮观的特技和视觉上充满活力的叙事来刺激观众，带来震撼的体验。,1,NO,
3,Broadcast Media,1,动作,"动作, 惊悚, 冒险",informed,3,它通常涉及主角们发现自己身处危险境地，克服身体上的挑战和危险，例如攀爬、跳跃和战斗。,1,NO,
3,Broadcast Media,1,动作,"动作, 惊悚, 冒险",informed,4,这个类型通常善恶分明，英雄与恶棍对抗，情节紧张刺激，充满活力。,1,NO,
3,Broadcast Media,1,动作,"动作, 惊悚, 冒险",informed,5,它通常依赖于体能、战斗和快速解决问题来推动叙事发展，强调玩家的反应速度和操作技巧。,1,NO,
3,Broadcast Media,1,动作,"动作, 惊悚, 冒险",informed,6,观众可以期待高度的兴奋和悬念，通常侧重于奇观和刺激，符合本类型电影的特点。,1,NO,
3,Broadcast Media,1,动作,"动作, 惊悚, 冒险",informed,7,故事通常讲述英雄凭借体能、勇气和决心克服重大障碍，最终取得胜利。,1,NO,
3,Broadcast Media,1,动作,"动作, 惊悚, 冒险",informed,8,这些故事通常展现了在极端环境下，人类的勇气、韧性和精神的胜利，引人入胜。,1,NO,
3,Broadcast Media,1,动作,"动作, 惊悚, 冒险",informed,9,这类媒体运用快节奏的剪辑和动态的镜头，旨在增强紧张感和刺激感，使观众肾上腺素飙升。,1,NO,
3,Broadcast Media,1,动作,"动作, 惊悚, 冒险",misinformed,1,这是一种娱乐形式，旨在通过引人入胜的叙事和视觉效果来吸引和娱乐观众，提供沉浸式的体验。,1,NO,
3,Broadcast Media,1,动作,"动作, 惊悚, 冒险",misinformed,2,这类媒体中的故事通常涉及冲突、解决，以及对人类经验的探索，但类型并不唯一。,1,NO,
3,Broadcast Media,1,动作,"动作, 惊悚, 冒险",fake,1,这种电影类型侧重于悬念、神秘和心理紧张，通常以侦探为主角，但它绝对不是动作片。,1,NO,
3,Broadcast Media,1,动作,"动作, 惊悚, 冒险",fake,2,一种电影风格，强调探索、发现和异国情调的地点，通常伴随着寻宝活动，但与正确答案无关。,1,NO,
3,Broadcast Media,1,动作,"动作, 惊悚, 冒险",fake,3,这类电影通常涉及间谍活动、秘密行动和高风险的国际阴谋，但它更注重情感的表达。,1,NO,
3,Broadcast Media,1,动作,"动作, 惊悚, 冒险",extra,1,这类媒体经常使用特效和精心设计的场景，以增强视觉冲击力和刺激感，让观众沉浸其中。,1,NO,
3,Broadcast Media,2,疯狂的麦克斯：狂暴之路,"疾速追杀, 疯狂的麦克斯：狂暴之路, 谍影重重",informed,1,叙事结构侧重于视觉叙事和无情的向前推进，营造出一种紧迫感，让观众肾上腺素飙升。,1,NO,
3,Broadcast Media,2,疯狂的麦克斯：狂暴之路,"疾速追杀, 疯狂的麦克斯：狂暴之路, 谍影重重",informed,2,一位女性角色领导冲锋，在荒凉的末日后世界中象征着反抗和力量。,1,NO,
3,Broadcast Media,2,疯狂的麦克斯：狂暴之路,"疾速追杀, 疯狂的麦克斯：狂暴之路, 谍影重重",informed,3,这部电影的世界被车辆所主宰，在持续不断的追逐中推动着情节发展，车辆是故事的核心。,1,NO,
3,Broadcast Media,2,疯狂的麦克斯：狂暴之路,"疾速追杀, 疯狂的麦克斯：狂暴之路, 谍影重重",informed,4,这部电影的视觉风格以其荒凉的风景、实用的特效和强烈的色彩分级为特征。,1,NO,
3,Broadcast Media,2,疯狂的麦克斯：狂暴之路,"疾速追杀, 疯狂的麦克斯：狂暴之路, 谍影重重",informed,5,故事展现了一个在资源匮乏、暴力统治的世界中，为生存而进行的绝望斗争。,1,NO,
3,Broadcast Media,2,疯狂的麦克斯：狂暴之路,"疾速追杀, 疯狂的麦克斯：狂暴之路, 谍影重重",informed,6,这部电影以其高辛烷值的车辆战斗和大胆的特技而闻名，让观众始终处于紧张状态，肾上腺素飙升。,1,NO,
3,Broadcast Media,2,疯狂的麦克斯：狂暴之路,"疾速追杀, 疯狂的麦克斯：狂暴之路, 谍影重重",informed,7,故事围绕着穿越严酷沙漠废土的旅程展开，充满了危险和无情的冲突，目标明确。,1,NO,
3,Broadcast Media,2,疯狂的麦克斯：狂暴之路,"疾速追杀, 疯狂的麦克斯：狂暴之路, 谍影重重",informed,8,影片的配乐增强了令人心跳加速的动作场面，营造出紧迫感，并突出了角色的挣扎。,1,NO,
3,Broadcast Media,2,疯狂的麦克斯：狂暴之路,"疾速追杀, 疯狂的麦克斯：狂暴之路, 谍影重重",informed,9,这部电影非常注重实景特效，营造出一种粗犷而身临其境的视觉体验，令人印象深刻。,1,NO,
3,Broadcast Media,2,疯狂的麦克斯：狂暴之路,"疾速追杀, 疯狂的麦克斯：狂暴之路, 谍影重重",misinformed,1,这部电影包含惊险的场景、引人注目的视觉效果和毫不留情的节奏，旨在吸引观众。,1,NO,
3,Broadcast Media,2,疯狂的麦克斯：狂暴之路,"疾速追杀, 疯狂的麦克斯：狂暴之路, 谍影重重",misinformed,2,这部电影的故事探讨了生存、斗争以及人类精神在逆境中展现出的韧性等主题，具有普遍意义。,1,NO,
3,Broadcast Media,2,疯狂的麦克斯：狂暴之路,"疾速追杀, 疯狂的麦克斯：狂暴之路, 谍影重重",fake,1,这部电影讲述了一位前刺客为了替他的狗报仇，重新回到犯罪世界的故事，但主角并非麦克斯。,1,NO,
3,Broadcast Media,2,疯狂的麦克斯：狂暴之路,"疾速追杀, 疯狂的麦克斯：狂暴之路, 谍影重重",fake,2,剧情讲述一位身手不凡的特工在逃亡中努力拼凑自己的身份，躲避中情局的追捕，与正确答案无关。,1,NO,
3,Broadcast Media,2,疯狂的麦克斯：狂暴之路,"疾速追杀, 疯狂的麦克斯：狂暴之路, 谍影重重",fake,3,一个男人运用战斗技巧保护一位年轻女子免受无情雇佣兵的侵害，在危险的荒野中奋战。,1,NO,
3,Broadcast Media,2,疯狂的麦克斯：狂暴之路,"疾速追杀, 疯狂的麦克斯：狂暴之路, 谍影重重",extra,1,这部电影的成功证明了其富有创意的视野、惊险刺激的动作以及吸引观众的能力。,1,NO,
4,Broadcast Media,1,戏剧,"戏剧, 浪漫, 喜剧",informed,1,通常涉及高风险、激烈的冲突以及处理生活中重大问题的复杂角色，引人深思。,1,NO,
4,Broadcast Media,1,戏剧,"戏剧, 浪漫, 喜剧",informed,2,叙事结构通常会构建紧张感和悬念，将观众带入一系列情感体验，是引人入胜的表演艺术。,1,NO,
4,Broadcast Media,1,戏剧,"戏剧, 浪漫, 喜剧",informed,3,它经常探讨道德、正义以及人类行为和举止所带来的后果等主题，引人深思。,1,NO,
4,Broadcast Media,1,戏剧,"戏剧, 浪漫, 喜剧",informed,4,一种以严肃的基调和对复杂的人类境况与经历的探索而闻名的叙事形式，通常在舞台上呈现。,1,NO,
4,Broadcast Media,1,戏剧,"戏剧, 浪漫, 喜剧",informed,5,这些作品通常以复杂的人物为特色，他们面临着困境和情感考验，深深地引起观众的共鸣。,1,NO,
