test_run,topic_category,round,answer,choices,clue_type,clue_number,clue_text,word_count,length_ok,manual_score / comment
1,Inventions,1,Медицина,"Медицина, Коммуникации, Транспорт",informed,1,"Эта область изучает человеческое тело, здоровье и методы лечения болезней, чтобы улучшить качество жизни людей во всем мире.",18,YES,
1,Inventions,1,Медицина,"Медицина, Коммуникации, Транспорт",informed,2,"Она охватывает широкий спектр методов и процедур, направленных на диагностику, лечение и профилактику заболеваний у людей, обеспечивая здоровье.",18,YES,
1,Inventions,1,Медицина,"Медицина, Коммуникации, Транспорт",informed,3,"В этой области произошли значительные успехи, которые привели к увеличению продолжительности жизни и улучшению ее качества для многих людей.",19,YES,
1,Inventions,1,Медицина,"Медицина, Коммуникации, Транспорт",informed,4,"Этот сектор занимается сохранением и восстановлением здоровья с помощью науки, исследований и заботы о пациентах. Важнейшая сфера для общества.",19,YES,
1,Inventions,1,Медицина,"Медицина, Коммуникации, Транспорт",informed,5,"Эта область занимается диагностикой, лечением и профилактикой заболеваний и травм у людей и животных, используя научные методы и знания.",19,YES,
1,Inventions,1,Медицина,"Медицина, Коммуникация, Транспорт",informed,6,"Эта дисциплина важна для укрепления здоровья населения, используя научные знания для оказания помощи и улучшения качества жизни людей.",18,YES,
1,Inventions,1,Медицина,"Медицина, Связь, Транспорт",informed,7,"Эта область применяет научные знания для диагностики, лечения и профилактики заболеваний и травм, улучшая здоровье человека и общества.",18,YES,
1,Inventions,1,Медицина,"Медицина, Коммуникации, Транспорт",informed,8,"Эта область охватывает широкий спектр практик, направленных на поддержание или восстановление физического и психического здоровья человека, что очень важно.",19,YES,
1,Inventions,1,Медицина,"Медицина, Коммуникация, Транспорт",informed,9,"Эта область охватывает науку и искусство исцеления, сосредотачиваясь на диагностике и лечении болезней и травм, а также профилактике.",18,YES,
1,Inventions,1,Медицина,"Медицина, Коммуникации, Транспорт",misinformed,1,"Эта область использует научные знания и инженерные принципы для решения задач и улучшения жизни, но не всегда напрямую связана с лечением.",21,NO,
1,Inventions,1,Медицина,"Медицина, Коммуникации, Транспорт",misinformed,2,"Это область, стремящаяся улучшить жизнь людей посредством разработки новых решений и инструментов, но не всегда напрямую связана со здоровьем.",19,YES,
1,Inventions,1,Медицина,"Медицина, Коммуникации, Транспорт",fake,1,"Революционные технологии изменили способы передачи данных на огромные расстояния, но это не относится к здравоохранению напрямую, а скорее к другим областям.",21,NO,
1,Inventions,1,Медицина,"Медицина, Связь, Транспорт",fake,2,"Использование транспортных средств связало отдаленные места, облегчило передвижение по всему миру и способствовало обмену товарами, но это не медицина.",19,YES,
1,Inventions,1,Медицина,"Медицина, Коммуникации, Транспорт",fake,3,"Этот сектор занимается мгновенным обменом данными по различным каналам, соединяя людей по всему миру и способствуя общению, но это не медицина.",21,NO,
1,Inventions,1,Медицина,"Медицина, Коммуникации, Транспорт",extra,1,"Эта область науки занимается предотвращением и лечением заболеваний, а также укреплением здоровья живых существ, что делает её крайне важной.",19,YES,
1,Inventions,2,Вакцина,"Вакцина, Пенициллин, Рентген",informed,1,"Вакцина представляет собой ослабленную или инактивированную версию патогена, стимулирующую иммунную систему организма для выработки защиты от болезни.",17,YES,
1,Inventions,2,Вакцина,"Вакцина, Пенициллин, Рентген",informed,2,"Это медицинское вмешательство обучает иммунную систему распознавать и бороться с конкретным возбудителем болезни, обеспечивая защиту от инфекции в будущем.",19,YES,
1,Inventions,2,Вакцина,"Вакцина, Пенициллин, Рентген",informed,3,"Это медицинское вмешательство, которое предотвращает болезни, стимулируя иммунную систему организма для защиты от конкретных инфекционных агентов и заболеваний. ",18,YES,
1,Inventions,2,Вакцина,"Вакцина, Пенициллин, Рентген",informed,4,"Это вещество помогает организму выработать иммунитет к определенной болезни, обучая иммунную систему распознавать и бороться с патогеном. ",17,YES,
1,Inventions,2,Вакцина,"Вакцина, Пенициллин, Рентген",informed,5,"Это средство предназначено для защиты от болезней, стимулируя выработку антител и обеспечивая долговременную защиту организма от инфекций.",17,YES,
1,Inventions,2,Вакцина,"Вакцина, Пенициллин, Рентген",informed,6,"Этот биологический препарат обеспечивает активный иммунитет к определенным инфекциям, значительно снижая риск заражения или тяжесть заболевания. Это важный инструмент в здравоохранении.",21,NO,
1,Inventions,2,Вакцина,"Вакцина, Пенициллин, Рентген",informed,7,"Это важный инструмент в борьбе с инфекционными заболеваниями, помогающий предотвратить вспышки и защитить здоровье населения во всем мире.",18,YES,
1,Inventions,2,Вакцина,"Вакцина, Пенициллин, Рентген",informed,8,"Это научное достижение значительно помогло в глобальной борьбе с болезнями, доказав свою жизненную важность в спасении множества жизней по всему миру.",21,NO,
1,Inventions,2,Вакцина,"Вакцина, Пенициллин, Рентген",informed,9,"Это биологический препарат, усиливающий иммунитет к определенной болезни, играющий важную роль в глобальном здравоохранении и профилактике заболеваний.",17,YES,
1,Inventions,2,Вакцина,"Вакцина, Пенициллин, Рентген",misinformed,1,"Это результат научных исследований, который используется для укрепления здоровья и защиты от различных заболеваний, но не всегда однозначно.",18,YES,
1,Inventions,2,Вакцина,"Вакцина, Пенициллин, Рентген",misinformed,2,"Это сыграло важную роль в спасении жизней и улучшении общего благосостояния людей во всем мире, но не конкретно.",18,YES,
1,Inventions,2,Вакцина,"Вакцина, Пенициллин, Рентген",fake,1,"Это устройство использует электромагнитное излучение для визуализации внутренних органов, что коренным образом улучшило медицинскую диагностику, но это не вакцина.",19,YES,
1,Inventions,2,Вакцина,"Вакцина, Пенициллин, Рентген",fake,2,"Этот препарат обладает мощными профилактическими свойствами, часто используется для борьбы с инфекционными заболеваниями и спасает бесчисленное количество жизней во всем мире, но не он.",24,NO,
1,Inventions,2,Вакцина,"Вакцина, Пенициллин, Рентген",fake,3,"Это открытие, которое может убить бактерии и предотвратить рост инфекций в организме, но оно не используется для этих целей.",19,YES,
1,Inventions,2,Вакцина,"Вакцина, Пенициллин, Рентген",extra,1,"Это вещество, которое вводят для стимуляции выработки антител и обеспечения иммунитета против одного или нескольких заболеваний. Подумайте об этом.",19,YES,
2,Inventions,1,Коммуникация,"Медицина, Коммуникация, Транспорт",informed,1,"Этот метод включает в себя обмен информацией, идеями и чувствами между двумя или более сущностями или отдельными лицами.",18,YES,
2,Inventions,1,Коммуникация,"Медицина, Коммуникация, Транспорт",informed,2,"Это позволяет распространять мысли, знания и эмоции, что необходимо для человеческого взаимодействия и развития общества. Важный аспект современной жизни.",19,YES,
2,Inventions,1,Коммуникация,"Медицина, Коммуникация, Транспорт",informed,3,"Этот процесс облегчает связь, позволяя людям делиться опытом, строить отношения и понимать друг друга. Это основа любого общества и прогресса.",20,YES,
2,Inventions,1,Коммуникация,"Медицина, Коммуникация, Транспорт",informed,4,"Это может быть вербальным или невербальным, используя различные каналы для эффективной передачи сообщений во времени и пространстве. Важный аспект современного общества.",21,NO,
2,Inventions,1,Коммуникация,"Медицина, Коммуникация, Транспорт",informed,5,"Этот важный процесс способствует пониманию, сотрудничеству и обмену информацией, преодолевая разрыв между людьми и организациями во всем мире.",18,YES,
2,Inventions,1,Коммуникация,"Медицина, Коммуникация, Транспорт",informed,6,"Она использует различные инструменты и методы, включая язык, символы и технологии, для передачи информации и идей между людьми или группами.",20,YES,
2,Inventions,1,Коммуникация,"Медицина, Коммуникация, Транспорт",informed,7,"Эта важная человеческая деятельность необходима для построения отношений и общества, обеспечивая обмен информацией и сотрудничество между людьми во всем мире.",20,YES,
2,Inventions,1,Коммуникация,"Медицина, Коммуникация, Транспорт",informed,8,"Этот процесс поддерживает передачу мыслей, чувств и данных, что жизненно важно для человеческой связи и сотрудничества в обществе.",18,YES,
2,Inventions,1,Коммуникация,"Медицина, Коммуникация, Транспорт",informed,9,"Этот процесс лежит в основе человеческого взаимодействия, позволяя людям обмениваться информацией и достигать взаимопонимания. Важный элемент современного общества.",18,YES,
2,Inventions,1,Коммуникация,"Медицина, Коммуникация, Транспорт",misinformed,1,"Это включает в себя процесс передачи информации, идей или чувств от одного субъекта к другому, но не определяет конкретную область.",20,YES,
2,Inventions,1,Коммуникация,"Медицина, Коммуникация, Транспорт",misinformed,2,"Это важная часть человеческого взаимодействия, позволяющая обмениваться информацией и строить взаимопонимание, но не всегда приводит к правде.",17,YES,
2,Inventions,1,Коммуникация,"Медицина, Коммуникация, Транспорт",fake,1,"Это изобретение сильно повлияло на перемещение людей, открыв новые возможности для исследования и торговых путей, но не для общения.",19,YES,
2,Inventions,1,Коммуникация,"Медицина, Коммуникация, Транспорт",fake,2,"Этот процесс включает создание и применение инструментов и техник для диагностики и эффективного лечения заболеваний, но это не то, что мы ищем.",22,NO,
2,Inventions,1,Коммуникация,"Медицина, Коммуникация, Транспорт",fake,3,Это включает в себя перемещение людей и товаров из одного места в другое с использованием различных методов и транспортных средств. Но это неверно.,23,NO,
2,Inventions,1,Коммуникация,"Медицина, Коммуникация, Транспорт",extra,1,"Это важная деятельность, которая позволяет передавать информацию, идеи и эмоции между отдельными лицами и группами людей. Без нее сложно представить современный мир.",22,NO,
2,Inventions,2,Радио,"Радио, Телефон, Интернет",informed,1,Это изобретение использовало электромагнитные волны для передачи звуков и сообщений на огромные расстояния без использования проводов. Очень полезная штука!,19,YES,
2,Inventions,2,Радио,"Радио, Телефон, Интернет",informed,2,"Это изобретение позволило быстро и эффективно распространять новости, развлечения и информацию по домам по всему миру, объединяя людей через эфир.",20,YES,
2,Inventions,2,Радио,"Радио, Телефон, Интернет",informed,3,"Это технологическое чудо принесло голоса и музыку в дома, оказав значительное влияние на культуру и повседневную жизнь во всем мире.",20,YES,
2,Inventions,2,Радио,"Радио, Телефон, Интернет",informed,4,"Это устройство использует передатчик и приемник для отправки и получения сигналов, коренным образом изменив способ общения людей на расстоянии.",19,YES,
2,Inventions,2,Радио,"Радио, Телефон, Интернет",informed,5,"Это изобретение использовало систему передачи сигналов по воздуху, кардинально изменив способ обмена информацией между людьми. Это было прорывом.",18,YES,
2,Inventions,2,Радио,"Радио, Телефон, Интернет",informed,6,"Эта инновационная технология позволила передавать аудиосигналы по беспроводной сети, совершив революцию в дальней связи и радиовещании. Очень полезное изобретение.",19,YES,
2,Inventions,2,Радио,"Радио, Телефон, Интернет",informed,7,"Это позволило передавать голоса и музыку на большие расстояния, изменив способ получения информации людьми. Это было настоящим прорывом в коммуникации.",20,YES,
2,Inventions,2,Радио,"Радио, Телефон, Интернет",informed,8,"Эта технология позволила передавать звук с помощью электромагнитных волн, навсегда изменив связь и радиовещание. Это изобретение стало настоящим прорывом в коммуникациях.",21,NO,
2,Inventions,2,Радио,"Радио, Телефон, Интернет",informed,9,"Это изобретение использовало сигналы для передачи звуков на расстоянии, соединяя людей по всему миру совершенно новыми способами коммуникации.",18,YES,
2,Inventions,2,Радио,"Радио, Телефон, Интернет",misinformed,1,"Это изобретение передает информацию на расстоянии, соединяя людей и способствуя распространению новостей, но не всегда точно указывает на источник.",19,YES,
2,Inventions,2,Радио,"Радио, Телефон, Интернет",misinformed,2,"Эта технология позволяет быстро обмениваться информацией и способствует общению, преодолевая географические барьеры и объединяя людей по всему миру. Она очень популярна.",21,NO,
2,Inventions,2,Радио,"Радио, Телефон, Интернет",fake,1,Это изобретение позволяет людям общаться друг с другом в режиме реального времени на больших расстояниях по проводам. Но это не радио.,21,NO,
2,Inventions,2,Радио,"Радио, Телефон, Интернет",fake,2,"Это изобретение представляет собой глобальную сеть, объединяющую людей по всему миру, обеспечивая быстрый обмен информацией и коммуникацию, но это не радио.",21,NO,
2,Inventions,2,Радио,"Радио, Телефон, Интернет",fake,3,"Это устройство, которое позволяет людям общаться друг с другом, используя физическое соединение и телефонную трубку, но это не радио.",19,YES,
2,Inventions,2,Радио,"Радио, Телефон, Интернет",extra,1,"Это изобретение использовало электромагнитные волны, чтобы революционизировать обмен информацией и развлечениями по всему миру. Подумайте об этом средстве связи.",19,YES,
3,Inventions,1,Транспорт,"Медицина, Связь, Транспорт",informed,1,"Это охватывает широкий спектр человеческой деятельности и технологий, связанных с перемещением людей и товаров из одного места в другое.",19,YES,
3,Inventions,1,Транспорт,"Медицина, Связь, Транспорт",informed,2,"Этот сектор постоянно развивается, предлагая новые способы перемещения людей и материалов на различные расстояния. Это касается поездок и перевозок.",19,YES,
3,Inventions,1,Транспорт,"Медицина, Коммуникации, Транспорт",informed,3,"Инновации в этой области кардинально изменили ход цивилизации, сформировав общества и торговые пути, сделав мир более доступным.",17,YES,
3,Inventions,1,Транспорт,"Медицина, Связь, Транспорт",informed,4,"Эта технология постоянно расширяет границы, способствуя экономическому росту и сближая отдаленные сообщества, делая мир более доступным для всех.",18,YES,
3,Inventions,1,Транспорт,"Медицина, Связь, Транспорт",informed,5,"Эта область значительно сократила мир, преодолевая географические барьеры и соединяя разные культуры, делая путешествия и торговлю проще.",17,YES,
3,Inventions,1,Транспорт,"Медицина, Связь, Транспорт",informed,6,Основная задача этой отрасли – обеспечение перемещения людей и грузов с использованием различных видов транспорта и инфраструктурных систем.,18,YES,
3,Inventions,1,Транспорт,"Медицина, Связь, Транспорт",informed,7,"Это охватывает различные способы, от простых до сложных, предназначенные для перемещения людей или предметов из одного места в другое.",19,YES,
3,Inventions,1,Транспорт,"Медицина, Связь, Транспорт",informed,8,"Это важная часть прогресса человечества, помогающая торговле, исследованиям и обмену идеями по всему миру. Без него сложно представить современный мир.",20,YES,
