test_run,topic_category,round,answer,choices,clue_type,clue_number,clue_text,word_count,length_ok,manual_score / comment
3,Songs,1,Хип-хоп,"Хип-хоп, Рэп, R&B",informed,8,"Этот музыкальный стиль известен своими инновациями, постоянно развивается, включая в себя новые звуки и техники, оставаясь актуальным на протяжении десятилетий.",20,YES,
3,Songs,1,Хип-хоп,"Хип-хоп, Рэп, R&B",informed,9,"Эта музыкальная форма позволяет артистам выражать себя, делиться своим опытом и находить связь со своими поклонниками по всему миру.",19,YES,
3,Songs,1,Хип-хоп,"Хип-хоп, Рэп, R&B",misinformed,1,"Это музыкальная форма, использующая ритм и мелодию для создания песен, вызывающих эмоции и устанавливающих связь со слушателями разных поколений.",19,YES,
3,Songs,1,Хип-хоп,"Хип-хоп, Рэп, R&B",misinformed,2,"Это популярный музыкальный жанр, часто включающий вокал, инструменты и сильный ритм, чтобы привлечь широкую аудиторию слушателей по всему миру.",19,YES,
3,Songs,1,Хип-хоп,"Хип-хоп, Рэп, R&B",fake,1,"Этот жанр характеризуется плавным вокалом, душевными мелодиями и часто исследует темы любви, отношений и разбитого сердца, но это неправда.",19,YES,
3,Songs,1,Хип-хоп,"Хип-хоп, Рэп, R&B",fake,2,"Этот жанр музыки характеризуется сложными гармониями, импровизацией и акцентом на инструментальную виртуозность, что совершенно не относится к Хип-хопу.",18,YES,
3,Songs,1,Хип-хоп,"Хип-хоп, Рэп, R&B",fake,3,"Этот жанр часто путают с другими, но он отличается более спокойным и мелодичным звучанием, не таким агрессивным, как рэп.",19,YES,
3,Songs,1,Хип-хоп,"Хип-хоп, Рэп, R&B",extra,1,"Это широкий музыкальный стиль, охватывающий множество поджанров и художественных выражений от самых разных исполнителей, что делает его очень популярным.",19,YES,
3,Songs,2,Lose Yourself - Eminem,"In Da Club - 50 Cent, Lose Yourself - Eminem, Jumpman - Drake & Future",informed,1,"В тексте песни главный герой сталкивается с трудностями и необходимостью использовать возможности для достижения своих целей, что отражает суть композиции.",20,YES,
3,Songs,2,Lose Yourself - Eminem (Потеряй Себя - Эминем),"In Da Club - 50 Cent (В Клубе - 50 Cent), Lose Yourself - Eminem (Потеряй Себя - Эминем), Jumpman - Drake & Future (Jumpman - Drake & Future)",informed,2,"Эта песня стала гимном для многих, подчеркивая важность уверенности и взятия своей судьбы под контроль, вдохновляя на успех.",18,YES,
3,Songs,2,Lose Yourself - Eminem,"In Da Club - 50 Cent, Lose Yourself - Eminem, Jumpman - Drake & Future",informed,3,"Эта песня рассказывает о борьбе за преодоление трудностей и неустанном стремлении к своим амбициям, отражая личный опыт артиста.",18,YES,
3,Songs,2,Lose Yourself - Eminem (Потеряй Себя - Эминем),"In Da Club - 50 Cent (В Клубе - 50 Cent), Lose Yourself - Eminem (Потеряй Себя - Эминем), Jumpman - Drake & Future (Jumpman - Drake & Future)",informed,4,"Интенсивность трека и энергичный ритм создают ощущение срочности и необходимости в вере в себя, что указывает на правильный ответ.",19,YES,
3,Songs,2,Потеряй Себя - Эминем,"В Клуб - 50 Cent, Потеряй Себя - Эминем, Jumpman - Drake & Future",informed,5,"Основная идея песни призывает слушателей ценить настоящее и отдавать все силы своим начинаниям, не боясь трудностей на пути.",18,YES,
3,Songs,2,Lose Yourself - Eminem (Потеряй Себя - Эминем),"In Da Club - 50 Cent (В Клубе - 50 Cent), Lose Yourself - Eminem (Потеряй Себя - Эминем), Jumpman - Drake & Future (Jumpman - Drake & Future)",informed,6,Темы преодоления препятствий и стремления к успеху в этой песне нашли отклик у очень широкой аудитории слушателей по всему миру.,20,YES,
3,Songs,2,Lose Yourself - Eminem,"In Da Club - 50 Cent, Lose Yourself - Eminem, Jumpman - Drake & Future",informed,7,"Эта музыкальная композиция известна своей мощной подачей, захватывающим повествованием и мотивационным воздействием на слушателей по всему миру. Шедевр хип-хопа.",19,YES,
3,Songs,2,Lose Yourself - Eminem,"In Da Club - 50 Cent, Lose Yourself - Eminem, Jumpman - Drake & Future",informed,8,"Куплеты песни отражают внутреннюю борьбу главного героя и его решимость преодолеть внутренних демонов, чтобы достичь своей цели в жизни.",19,YES,
3,Songs,2,Lose Yourself - Eminem,"In Da Club - 50 Cent, Lose Yourself - Eminem, Jumpman - Drake & Future",informed,9,"Эта песня рассказывает о пути человека к преодолению неуверенности в себе и достижению личного триумфа, через музыку и ритм.",19,YES,
3,Songs,2,Lose Yourself - Eminem,"In Da Club - 50 Cent, Lose Yourself - Eminem, Jumpman - Drake & Future",misinformed,1,"Текст этой песни призван вызывать эмоции и передавать идеи через использование ритма и мелодии, создавая широкую интерпретацию.",17,YES,
3,Songs,2,Lose Yourself - Eminem,"In Da Club - 50 Cent, Lose Yourself - Eminem, Jumpman - Drake & Future",misinformed,2,"Эта песня – форма искусства, призванная развлекать, вдохновлять и эмоционально связывать слушателей, затрагивая их чувства и переживания.",17,YES,
3,Songs,2,Lose Yourself - Eminem,"In Da Club - 50 Cent, Lose Yourself - Eminem, Jumpman - Drake & Future",fake,1,"Эта песня рассказывает о вечеринках и клубной жизни, где люди танцуют и хорошо проводят время, забывая о проблемах.",18,YES,
3,Songs,2,Lose Yourself - Eminem (Потеряй Себя - Эминем),"In Da Club - 50 Cent (В Клубе - 50 Cent), Lose Yourself - Eminem (Потеряй Себя - Эминем), Jumpman - Drake & Future (Джампмен - Дрейк и Фьючер)",fake,2,"Эта песня – энергичный танцевальный трек с мощным битом, идеально подходящий для клубной атмосферы и веселых мероприятий, но это не так.",21,NO,
3,Songs,2,Lose Yourself - Eminem (Потеряй Себя - Эминем),"In Da Club - 50 Cent (В Клубе - 50 Cent), Lose Yourself - Eminem (Потеряй Себя - Эминем), Jumpman - Drake & Future (Джампмен - Дрейк и Фьючер)",fake,3,"В тексте песни описываются трудности и победы группы друзей, вместе преодолевающих жизненные взлеты и падения, но это не про Эминема.",20,YES,
3,Songs,2,Lose Yourself - Eminem (Потеряй Себя - Эминем),"In Da Club - 50 Cent (В Клубе - 50 Cent), Lose Yourself - Eminem (Потеряй Себя - Эминем), Jumpman - Drake & Future (Джампман - Дрейк и Фьючер)",extra,1,"Необработанная лирика и мощная подача трека сделали его мгновенным фаворитом для многих слушателей, укрепив его место в истории хип-хопа.",19,YES,
4,Songs,1,Джаз,"Джаз, Блюз, Свинг",informed,1,"Этот жанр характеризуется спонтанной музыкальной импровизацией, предоставляя музыкантам свободу самовыражения в рамках определенной структуры и гармонии.",16,YES,
4,Songs,1,Джаз,"Джаз, Блюз, Свинг",informed,2,"Этот жанр выделяется синкопированием и уникальным ритмическим ощущением, что отличает его от других музыкальных форм и направлений в музыке.",19,YES,
4,Songs,1,Джаз,"Джаз, Блюз, Свинг",informed,3,"Эта музыка часто использует сложные гармонии и аккордовые последовательности, создавая изысканное и утонченное звучание, полное импровизации и свободы выражения.",19,YES,
4,Songs,1,Джаз,"Джаз, Блюз, Свинг",informed,4,"Эта музыка характеризуется взаимодействием и импровизацией между инструментами, создавая уникальную динамику и живое общение между музыкантами на сцене.",18,YES,
4,Songs,1,Джаз,"Джаз, Блюз, Свинг",informed,5,"Этот музыкальный стиль часто характеризуется сильным акцентом на индивидуальное самовыражение и виртуозность, что делает его легко узнаваемым среди других жанров.",20,YES,
4,Songs,1,Джаз,"Джаз, Блюз, Свинг",informed,6,"Этот музыкальный стиль берет свои корни в афроамериканских музыкальных традициях и развивался на протяжении всего 20-го века, став очень популярным.",20,YES,
4,Songs,1,Джаз,"Джаз, Блюз, Свинг",informed,7,"Этот жанр музыки, где инструментальные соло играют ключевую роль, позволяя музыкантам продемонстрировать свои навыки и импровизировать на сцене.",18,YES,
4,Songs,1,Джаз,"Джаз, Блюз, Свинг",informed,8,"Этот жанр оказал огромное влияние на множество других музыкальных стилей, включая рок и поп-музыку, что делает его важным.",18,YES,
4,Songs,1,Джаз,"Джаз, Блюз, Свинг",informed,9,"Эта музыкальная форма часто использует широкий спектр инструментов, включая духовые, деревянные духовые и фортепиано, создавая неповторимую атмосферу.",17,YES,
4,Songs,1,Джаз,"Джаз, Блюз, Свинг",misinformed,1,"Этот музыкальный жанр предназначен для прослушивания публикой и часто включает вокал или различные инструменты, создавая атмосферу расслабления и наслаждения.",19,YES,
4,Songs,1,Джаз,"Джаз, Блюз, Свинг",misinformed,2,"Этот вид музыкального искусства использует организованный звук, включающий ритм, мелодию и гармонию, что делает его похожим на многие другие жанры.",20,YES,
4,Songs,1,Джаз,"Джаз, Блюз, Свинг",fake,1,"Этот жанр часто рассказывает истории о трудностях, стойкости и человеческом опыте через вокальное выражение, но это не джаз.",18,YES,
4,Songs,1,Джаз,"Джаз, Блюз, Свинг",fake,2,"Этот музыкальный стиль характеризуется четким ритмом и акцентом на бас, что создает энергичное и танцевальное настроение, но это не джаз.",20,YES,
4,Songs,1,Джаз,"Джаз, Блюз, Свинг",fake,3,"Этот жанр известен использованием структуры из двенадцати тактов и душевным вокалом, но это совсем не джаз, а его близкий родственник.",20,YES,
4,Songs,1,Джаз,"Джаз, Блюз, Свинг",extra,1,"Этот жанр часто сочетает в себе композицию и импровизацию, предоставляя музыкантам свободу для самовыражения и спонтанности в музыке.",18,YES,
4,Songs,2,Какой чудесный мир - Луи Армстронг,"Take Five - Дэйв Брубек, Какой чудесный мир - Луи Армстронг, Autumn Leaves - Билл Эванс",informed,1,"Нежные слова и мягкая мелодия этой песни создают ощущение оптимизма и восхищения окружающим миром, полным красоты и чудес.",18,YES,
4,Songs,2,Какой чудесный мир - Луи Армстронг,"Take Five - Дэйв Брубек, Какой чудесный мир - Луи Армстронг, Autumn Leaves - Билл Эванс",informed,2,"Эта песня отличается характерным вокальным стилем, который выделяется уникальным тембром и эмоциональной подачей, что делает её легко узнаваемой.",18,YES,
4,Songs,2,Какой чудесный мир - Луи Армстронг,"Take Five - Дэйв Брубек, Какой чудесный мир - Луи Армстронг, Осенние листья - Билл Эванс",informed,3,"Эта песня воспевает красоту окружающего мира, сосредотачиваясь на простых радостях и повседневных чудесах, которые нас окружают повсюду.",17,YES,
4,Songs,2,What a Wonderful World - Луи Армстронг,"Take Five - Дэйв Брубек, What a Wonderful World - Луи Армстронг, Autumn Leaves - Билл Эванс",informed,4,Простота и трогательное послание этой песни сделали её популярным выбором для множества различных событий и жизненных моментов. ,17,YES,
4,Songs,2,What a Wonderful World - Луи Армстронг,"Take Five - Дэйв Брубек, What a Wonderful World - Луи Армстронг, Autumn Leaves - Билл Эванс",informed,5,"Текст этой песни отражает красоту природы и важность умения ценить окружающий мир, полный прекрасных вещей и явлений.",17,YES,
4,Songs,2,What a Wonderful World - Луи Армстронг,"Take Five - Дэйв Брубек, What a Wonderful World - Луи Армстронг, Autumn Leaves - Билл Эванс",informed,6,"Эта песня демонстрирует способность исполнителя передавать глубокие эмоции, несмотря на ограниченный вокальный диапазон, что делает её особенно трогательной.",18,YES,
4,Songs,2,Какой чудесный мир - Луи Армстронг,"Take Five - Дэйв Брубек, Какой чудесный мир - Луи Армстронг, Autumn Leaves - Билл Эванс",informed,7,"Начинается с простого вступления фортепиано, создавая мирную атмосферу и приглашая слушателей расслабиться и насладиться прекрасной мелодией.",16,YES,
4,Songs,2,Какой чудесный мир - Луи Армстронг,"Take Five - Дэйв Брубек, Какой чудесный мир - Луи Армстронг, Осенние листья - Билл Эванс",informed,8,"Аранжировка песни проста и понятна, подчеркивая вокальное исполнение и текст, полный надежды и оптимизма, что делает её вечной.",18,YES,
4,Songs,2,What a Wonderful World - Луи Армстронг,"Take Five - Дэйв Брубек, What a Wonderful World - Луи Армстронг, Autumn Leaves - Билл Эванс",informed,9,"Эта песня, полная надежды и позитива, нашла отклик у слушателей разных поколений и культур, став настоящим гимном оптимизма.",18,YES,
4,Songs,2,Какой чудесный мир - Луи Армстронг,"Take Five - Дэйв Брубек, Какой чудесный мир - Луи Армстронг, Осенние листья - Билл Эванс",misinformed,1,"Эта песня стала очень популярной благодаря своей красивой мелодии и глубокому смыслу, затрагивающему чувства многих слушателей по всему миру.",19,YES,
4,Songs,2,Какой чудесный мир - Луи Армстронг,"Take Five - Дэйв Брубек, Какой чудесный мир - Луи Армстронг, Осенние листья - Билл Эванс",misinformed,2,"Эта музыкальная композиция – известная песня, часто звучащая для развлечения. Многие люди любят слушать ее, чтобы расслабиться и отдохнуть.",19,YES,
4,Songs,2,Какой чудесный мир - Луи Армстронг,"Take Five - Дэйв Брубек, Какой чудесный мир - Луи Армстронг, Autumn Leaves - Билл Эванс",fake,1,"Эта музыкальная композиция, с ее сложными вокальными гармониями и инструментальными аранжировками, сильно напоминает звучание известной арт-рок группы, но это не так.",21,NO,
4,Songs,2,Какой чудесный мир - Луи Армстронг,"Take Five - Дэйв Брубек, Какой чудесный мир - Луи Армстронг, Осенние листья - Билл Эванс",fake,2,"Эта песня с повторяющимися, синкопированными ритмами заставит вас двигаться или щелкать пальцами, но это совсем другая композиция.",17,YES,
4,Songs,2,Какой чудесный мир - Луи Армстронг,"Take Five - Дэйв Брубек, Какой чудесный мир - Луи Армстронг, Осенние листья - Билл Эванс",fake,3,"Эта композиция – энергичная инструментальная пьеса с запоминающейся мелодией, но ее исполняет совсем другой музыкант, не Луи Армстронг.",18,YES,
4,Songs,2,What a Wonderful World - Луи Армстронг,"Take Five - Дэйв Брубек, What a Wonderful World - Луи Армстронг, Autumn Leaves - Билл Эванс",extra,1,"Эта песня, полная надежды и позитива, остаётся актуальной и любимой многими людьми по всему миру, вдохновляя на лучшее.",18,YES,
5,Songs,1,Классическая,"Классическая, Опера, Инструментальная",informed,1,"Часто включает сложные аранжировки, созданные для вызова определенной эмоциональной реакции у слушателей благодаря мастерству композитора и исполнителей. Это классика.",19,YES,
5,Songs,1,Классическая,"Классическая, Опера, Инструментальная",informed,2,"Этот жанр часто использует струнные инструменты и фортепиано в симфонических залах, создавая прекрасные музыкальные впечатления для слушателей.",17,YES,
5,Songs,1,Классическая,"Классическая, Опера, Инструментальная",informed,3,"Элегантность и структура лежат в основе этой формы, подчеркивая баланс и ясность в звуковом ландшафте. Это музыкальное направление.",18,YES,
5,Songs,1,Классическая,"Классическая, Опера, Инструментальная",informed,4,"Это музыкальное произведение характеризуется акцентом на форме, структуре и гармоническом развитии, создавая изысканную и утонченную музыку, полную красоты.",18,YES,
5,Songs,1,Классическая,"Классическая, Опера, Инструментальная",informed,5,"Эти произведения отличаются балансом, порядком и эмоциональным контролем, часто включают в себя разнообразие инструментов и звуков, что характерно для этого жанра.",21,NO,
5,Songs,1,Классическая,"Классическая, Опера, Инструментальная",informed,6,"Она подчеркивает ясность структуры и мелодии, с акцентом на инструментальное исполнение и точную нотацию. Это музыка эпохи классицизма.",18,YES,
5,Songs,1,Классическая,"Классическая, Опера, Инструментальная",informed,7,"Обычно опирается на набор правил и условностей для создания порядка и согласованности в композициях, что делает её легко узнаваемой.",19,YES,
5,Songs,1,Классическая,"Классическая, Опера, Инструментальная",informed,8,"Музыка этой эпохи часто отличалась сложной орнаментацией и акцентом на выражении широкого спектра эмоций, что делает её узнаваемой.",18,YES,
5,Songs,1,Классическая,"Классическая, Опера, Инструментальная",informed,9,"Эта музыка делает акцент на инструментальном исполнении, с четким вниманием к мелодии и гармонии, что является ее отличительной чертой.",19,YES,
5,Songs,1,Классическая,"Классическая, Опера, Инструментальная",misinformed,1,"Этот вид музыки создан, чтобы вызывать эмоции и чувства у слушателей, погружая их в мир переживаний и размышлений о прекрасном.",20,YES,
5,Songs,1,Классическая,"Классическая, Опера, Инструментальная",misinformed,2,"Этот вид искусства доступен многим людям по всему миру, независимо от их происхождения и культурных предпочтений, что делает выбор сложным.",20,YES,
