test_run,topic_category,round,answer,choices,clue_type,clue_number,clue_text,word_count,length_ok,manual_score / comment
5,Nature,2,крабы,"лобстеры, крабы, креветки",informed,8,"Эти животные известны своей способностью процветать в самых разных средах обитания, от глубокого океана до мелководья, что делает их очень адаптивными.",21,NO,
5,Nature,2,крабы,"лобстеры, крабы, креветки",informed,9,"Они часто встречаются у береговой линии, сливаясь с окружающей средой, и известны своими клешнями, что делает их легко узнаваемыми.",19,YES,
5,Nature,2,крабы,"лобстеры, крабы, креветки",misinformed,1,"Эти животные обитают в самых разных средах, от суши до воды, и обладают способностью к передвижению, что затрудняет выбор.",19,YES,
5,Nature,2,Крабов,"Лобстеры, Крабы, Креветки",misinformed,2,Эти существа отличаются сложным строением тела и играют важную роль в поддержании баланса в морских экосистемах. Выбор сделать непросто.,19,YES,
5,Nature,2,Крабов,"Лобстеры, Крабы, Креветки",fake,1,"Эти существа имеют длинное, гибкое тело и известны своей способностью скользить и ползать по земле, но это не крабы.",19,YES,
5,Nature,2,крабы,"лобстеры, крабы, креветки",fake,2,"Эти животные обычно встречаются в водной среде, у них обтекаемое тело и плавники, что указывает на креветок, а не на крабов.",21,NO,
5,Nature,2,крабы,"лобстеры, крабы, креветки",fake,3,"Они часто встречаются в разных местах обитания, известны своей способностью летать и строить гнезда высоко над землей, но это неправда.",20,YES,
5,Nature,2,крабы,"лобстеры, крабы, креветки",extra,1,"Эти животные известны своей боковой походкой, что является отличительной формой передвижения по поверхности. Ищите тех, кто ходит боком.",18,YES,
6,Nature,1,Моллюски,"Моллюски, Иглокожие, Кишечнополостные",informed,1,"Они характеризуются мягким телом, часто защищенным твердой раковиной, и встречаются в разнообразных водных средах обитания по всему миру.",18,YES,
6,Nature,1,Моллюски,"Моллюски, Иглокожие, Кишечнополостные",informed,2,"Эти беспозвоночные демонстрируют огромное разнообразие форм, от медлительных существ до очень умных животных, обитающих в воде и на суше.",19,YES,
6,Nature,1,Моллюски,"Моллюски, Иглокожие, Кишечнополостные",informed,3,"У многих из этих животных есть мускулистая нога для передвижения и мантия, выделяющая защитную раковину. Это важная подсказка, чтобы определить правильный ответ.",22,NO,
6,Nature,1,Моллюски,"Моллюски, Иглокожие, Кишечнополостные",informed,4,"Эти животные играют важную роль в своих экосистемах, являясь одновременно и добычей, и хищниками в сложных пищевых цепях.",18,YES,
6,Nature,1,Моллюски,"Моллюски, Иглокожие, Кишечнополостные",informed,5,"Эта разнообразная группа включает существ с раковинами, щупальцами и уникальными механизмами питания, приспособленными к окружающей среде обитания.",17,YES,
6,Nature,1,Моллюски,"Моллюски, Иглокожие, Кишечнополостные",informed,6,"Они служат важным источником пищи для людей и животных, обитают в океанах, пресной воде и даже на суше.",18,YES,
6,Nature,1,Моллюски,"Моллюски, Иглокожие, Кишечнополостные",informed,7,"Эти беспозвоночные демонстрируют широкий спектр адаптаций, позволяющих им процветать в самых разнообразных средах обитания. Ищите мягкотелых обитателей морей и суши.",20,YES,
6,Nature,1,Моллюски,"Моллюски, Иглокожие, Кишечнополостные",informed,8,"Многие представители этого типа известны своей способностью создавать жемчуг, который высоко ценится людьми. Это водные животные с мягким телом.",19,YES,
6,Nature,1,Моллюски,"Моллюски, Иглокожие, Кишечнополостные",informed,9,"Это класс беспозвоночных, обладающих мантией и радулой, особенностями, уникальными для этой группы животных. Изучите их анатомию для понимания.",18,YES,
6,Nature,1,Моллюски,"Моллюски, Иглокожие, Кишечнополостные",misinformed,1,"Эти организмы часто встречаются в воде или во влажной среде и играют определенную роль в своих экосистемах, но какую именно?",20,YES,
6,Nature,1,Моллюски,"Моллюски, Иглокожие, Кишечнополостные",misinformed,2,"Это типы животных, принадлежащих к царству животных, которые отличаются большим разнообразием форм и выполняемых функций в природе.",17,YES,
6,Nature,1,Моллюски,"Моллюски, Иглокожие, Кишечнополостные",fake,1,"Эти животные, как правило, обладают лучевой симметрией и водной сосудистой системой, что совершенно не относится к нашей цели поиска.",19,YES,
6,Nature,1,Моллюски,"Моллюски, Иглокожие, Кишечнополостные",fake,2,"Эти существа, обитающие в воде, обладают радиальной симметрией и часто имеют колючую кожу, что помогает им выживать в океане.",19,YES,
6,Nature,1,Моллюски,"Моллюски, Иглокожие, Кишечнополостные",fake,3,"Несмотря на то, что у этих животных есть колючая кожа, и уникальная водная система, это совершенно не моллюски.",18,YES,
6,Nature,1,Моллюски,"Моллюски, Иглокожие, Кишечнополостные",extra,1,"Это разнообразная группа беспозвоночных, многие из которых обладают раковиной и мускулистой ногой для передвижения. Ищите их в океане и на суше.",21,NO,
6,Nature,2,Улитки,"Осьминоги, Улитки, Моллюски",informed,1,"Эти существа отличаются спиралевидными раковинами и способностью медленно передвигаться по поверхностям, оставляя за собой характерный след слизи.",17,YES,
6,Nature,2,Улитки,"Осьминоги, Улитки, Моллюски",informed,2,"Их часто можно встретить в садах и лесах, где они питаются растениями и способствуют разложению органических веществ в природе.",19,YES,
6,Nature,2,Улитки,"Осьминоги, Улитки, Моллюски",informed,3,"Эти животные известны выделением слизи, которая помогает им двигаться и защищает их мягкое тело от повреждений и высыхания.",18,YES,
6,Nature,2,Улитки,"Осьминоги, Улитки, Моллюски",informed,4,"Их медленный темп – определяющая черта, часто рассматриваемая как символ терпения в различных культурах. Это скользкие и медленные существа.",19,YES,
6,Nature,2,Улитки,"Осьминоги, Улитки, Моллюски",informed,5,"Обычно это травоядные животные, использующие радулу, чтобы соскребать и потреблять растительность в окружающей их среде обитания. Это медленные существа.",19,YES,
6,Nature,2,Улитки,"Осьминоги, Улитки, Моллюски",informed,6,"Эти животные часто встречаются во влажной среде, где им легко передвигаться и находить источники пищи. Их раковины защищают их.",19,YES,
6,Nature,2,Улитки,"Осьминоги, Улитки, Моллюски",informed,7,"Раковина служит этим животным защитным домом, позволяя им укрываться от опасности и неблагоприятных условий окружающей среды. Это очень медлительные существа.",20,YES,
6,Nature,2,Улитки,"Осьминоги, Улитки, Моллюски",informed,8,"Они часто встречаются в садах и лесах, играя важную роль в экосистеме, разлагая органические вещества и перерабатывая отходы.",18,YES,
6,Nature,2,Улитки,"Осьминоги, Улитки, Моллюски",informed,9,"Эти существа способны жить как на суше, так и в воде, и их разнообразные виды встречаются по всему миру. ",19,YES,
6,Nature,2,Улитки,"Осьминоги, Улитки, Моллюски",misinformed,1,"Эти беспозвоночные встречаются в разных средах обитания и играют важную роль в своих экосистемах, но не все из них скользкие.",20,YES,
6,Nature,2,Улитки,"Осьминоги, Улитки, Моллюски",misinformed,2,"Эти животные часто ассоциируются с океаном, но также встречаются и в других водных средах, что делает выбор сложным.",18,YES,
6,Nature,2,Улитки,"Осьминоги, Улитки, Моллюски",fake,1,"Известные своим интеллектом и сложным поведением, они обладают способностью эффективно маскироваться, что совершенно не относится к улиткам, живущим на суше.",20,YES,
6,Nature,2,Улитки,"Осьминоги, Улитки, Моллюски",fake,2,"Эти водные существа, известные своими раковинами, медленно передвигаются по дну, оставляя за собой слизистый след, но это не осьминоги.",19,YES,
6,Nature,2,Улитки,"Осьминоги, Улитки, Моллюски",fake,3,"Обитают в глубоких водах, у них нет раковины, а тело очень гибкое, что позволяет им быстро плавать.",17,YES,
6,Nature,2,Улитки,"Осьминоги, Улитки, Моллюски",extra,1,"Они характеризуются спиральной раковиной и медленным передвижением, часто встречаются в садах и влажных местах обитания. Это отличная подсказка.",18,YES,
7,Nature,1,Паукообразные,"Паукообразные, Насекомые, Многоножки",informed,1,У этих существ часто два сегмента тела и обычно восемь ног для передвижения и устойчивости на суше. Это очень полезная подсказка.,21,NO,
7,Nature,1,Паукообразные,"Паукообразные, Насекомые, Многоножки",informed,2,"Многие из этих животных известны своей способностью производить шелк, который они используют для различных целей в своей жизни, например, для плетения сетей.",22,NO,
7,Nature,1,Паукообразные,"Паукообразные, Насекомые, Многоножки",informed,3,"Эти виды широко распространены в различных средах обитания, от лесов до пустынь, по всему миру, что делает их очень заметными.",20,YES,
7,Nature,1,Паукообразные,"Паукообразные, Насекомые, Многоножки",informed,4,"Эти существа – в основном хищники, охотящиеся на других животных, чтобы получить необходимое питание для выживания в природе.",18,YES,
7,Nature,1,Паукообразные,"Паукообразные, Насекомые, Многоножки",informed,5,"Эти существа дышат через книжные легкие или трахеи, что обеспечивает эффективный газообмен в их теле. Это важная особенность паукообразных.",19,YES,
7,Nature,1,Паукообразные,"Паукообразные, Насекомые, Многоножки",informed,6,"Обычно они одиночки, но некоторые виды демонстрируют социальное поведение, например, совместную охоту или общинное проживание, что указывает на пауков.",19,YES,
7,Nature,1,Паукообразные,"Паукообразные, Насекомые, Многоножки",informed,7,"Эта группа включает множество ядовитых видов, использующих свой яд, чтобы подчинить добычу или защититься от опасности. К ним относятся пауки, клещи и скорпионы.",23,NO,
7,Nature,1,Паукообразные,"Паукообразные, Насекомые, Многоножки",informed,8,"Их экзоскелет обеспечивает защиту и поддержку, но для роста и развития им необходимо линять, сбрасывая старую оболочку. Это важный процесс.",20,YES,
7,Nature,1,Паукообразные,"Паукообразные, Насекомые, Многоножки",informed,9,"Некоторые из этих животных играют важную роль в контроле популяций насекомых, что очень важно для поддержания баланса в экосистеме.",19,YES,
7,Nature,1,Паукообразные,"Паукообразные, Насекомые, Многоножки",misinformed,1,"Эти организмы в основном наземные, населяют широкий спектр сред на поверхности Земли, что делает идентификацию затруднительной из-за разнообразия.",18,YES,
7,Nature,1,Паукообразные,"Паукообразные, Насекомые, Многоножки",misinformed,2,"Это беспозвоночные, у которых отсутствует позвоночник, демонстрирующие разнообразие адаптаций для выживания и размножения, что затрудняет точную идентификацию.",17,YES,
7,Nature,1,Паукообразные,"Паукообразные, Насекомые, Многоножки",fake,1,"Эти маленькие животные известны своей способностью летать, используя крылья для навигации в различных средах по всему миру, но это не про них.",22,NO,
7,Nature,1,Паукообразные,"Паукообразные, Насекомые, Многоножки",fake,2,"Эти существа проходят через превращение в течение своей жизни, от незрелых форм до взрослых особей, каждая из которых обладает уникальными особенностями.",21,NO,
7,Nature,1,Паукообразные,"Паукообразные, Насекомые, Многоножки",fake,3,"Эти животные имеют три части тела и, как правило, шесть ног, что обеспечивает им ловкость и быстрое передвижение.",18,YES,
7,Nature,1,Паукообразные,"Паукообразные, Насекомые, Многоножки",extra,1,"У них разнообразные пищевые привычки, включая хищничество и падальничество, в зависимости от окружающей среды и доступности ресурсов для выживания.",19,YES,
7,Nature,2,Пауки,"Пауки, Скорпионы, Клещи",informed,1,"Эти существа легко узнаваемы по восьми ногам и умению плести паутину, чтобы ловить добычу и выживать в природе.",18,YES,
7,Nature,2,Пауки,"Пауки, Скорпионы, Клещи",informed,2,"Эти животные часто встречаются в различных местах обитания, включая сады, леса и даже жилища человека, где они плетут свои сети.",20,YES,
7,Nature,2,Пауки,"Пауки, Скорпионы, Клещи",informed,3,"Многие из этих существ обладают ядом, который используют, чтобы обездвижить добычу, а иногда и для самозащиты и защиты от врагов.",20,YES,
7,Nature,2,Пауки,"Пауки, Скорпионы, Клещи",informed,4,"Эти животные известны своими разнообразными стратегиями охоты, которые включают засады, преследование и ловлю с помощью паутины. Очень интересные создания.",19,YES,
7,Nature,2,Пауки,"Пауки, Скорпионы, Клещи",informed,5,"У них есть особые ротовые органы, хелицеры, которые используются для захвата добычи и введения яда во время охоты.",18,YES,
7,Nature,2,Пауки,"Пауки, Скорпионы, Клещи",informed,6,"Их шелк невероятно прочен и используется для плетения паутин, создания коконов для яиц и даже в качестве страховочной нити.",19,YES,
7,Nature,2,Пауки,"Пауки, Скорпионы, Клещи",informed,7,"Некоторые виды демонстрируют сложные брачные ритуалы перед спариванием, включая танцы и подношение пищи в качестве подарка, что весьма интересно.",19,YES,
7,Nature,2,Пауки,"Пауки, Скорпионы, Клещи",informed,8,"Многие из этих существ одиночки и территориальны, самцы часто сталкиваются с опасностями при поиске партнера для спаривания, что очень рискованно.",20,YES,
7,Nature,2,Пауки,"Пауки, Скорпионы, Клещи",informed,9,"Эти животные – важные хищники насекомых, помогающие контролировать их популяции в экосистемах по всему миру, что делает их полезными для природы.",21,NO,
7,Nature,2,Пауки,"Пауки, Скорпионы, Клещи",misinformed,1,"Эти существа обладают членистым телом и соединенными конечностями, что важно для передвижения, но не уникально только для пауков.",18,YES,
7,Nature,2,Пауки,"Пауки, Скорпионы, Клещи",misinformed,2,"Эти существа часто охотятся, захватывая и поедая другие организмы, чтобы получить необходимые питательные вещества для поддержания своей жизни.",18,YES,
7,Nature,2,Пауки,"Пауки, Скорпионы, Клещи",fake,1,"Эти существа имеют жало и часто живут в пустынях, хотя пауки тоже могут там встречаться, но это не главное.",19,YES,
7,Nature,2,Пауки,"Пауки, Скорпионы, Клещи",fake,2,"Некоторые виды проходят полную трансформацию, претерпевая различные жизненные этапы на протяжении всего своего развития и существования, но это не пауки.",20,YES,
7,Nature,2,Пауки,"Пауки, Скорпионы, Клещи",fake,3,"Эти животные известны своей важной ролью в опылении растений, перенося пыльцу между цветками для размножения в природе, но это неправда.",20,YES,
7,Nature,2,Пауки,"Пауки, Скорпионы, Клещи",extra,1,"Эти животные знамениты своей способностью создавать сложные сети, которые они используют для захвата ничего не подозревающей добычи. Довольно распространенное явление в природе.",22,NO,
8,Nature,1,Рептилии,"Рептилии, Амфибии, Рыбы",informed,1,"Эти хладнокровные существа часто покрыты чешуей и обычно встречаются в теплых, солнечных климатах по всему миру. Это класс позвоночных.",19,YES,
8,Nature,1,Рептилии,"Рептилии, Земноводные, Рыбы",informed,2,"Разнообразная группа, характеризующаяся наличием чешуи. Обитают в наземных и водных средах, приспосабливаясь к различным условиям окружающей среды.",17,YES,
8,Nature,1,Рептилии,"Рептилии, Земноводные, Рыбы",informed,3,"Это позвоночные с сухой, чешуйчатой кожей, часто встречающиеся в теплых климатических зонах и разнообразных средах обитания по всему миру.",19,YES,
8,Nature,1,Рептилии,"Рептилии, Амфибии, Рыбы",informed,4,"Эта группа животных включает в себя разнообразные виды, приспособленные к широкому спектру климатических условий и образу жизни по всему миру.",20,YES,
