test_run,topic_category,round,answer,choices,clue_type,clue_number,clue_text,word_count,length_ok,manual_score / comment
5,Inventions,2,Лампочка,"Микроволновка, Лампочка, Холодильник",informed,1,"Эта лампа накаливания светится благодаря электричеству и является краеугольным камнем современного домашнего освещения, делая жизнь намного проще и удобнее.",19,YES,
5,Inventions,2,Лампочка,"Микроволновка, Лампочка, Холодильник",informed,2,"Это устройство, которое излучает свет, нагревая нить накаливания до тех пор, пока она не начнет испускать видимое излучение. Очень полезное изобретение.",21,NO,
5,Inventions,2,Лампочка,"Микроволновка, Лампочка, Холодильник",informed,3,"Это изобретение позволяет людям работать и свободно передвигаться в темноте, что является значительным прорывом в повседневной жизни и деятельности человека.",20,YES,
5,Inventions,2,Лампочка,"Микроволновка, Лампочка, Холодильник",informed,4,"Это изобретение использует электрическую энергию для создания света, освещая пространство постоянной и надежной яркостью, что очень удобно для всех.",19,YES,
5,Inventions,2,Лампочка,"Микроволновка, Лампочка, Холодильник",informed,5,"Этот предмет позволяет людям заниматься делами после захода солнца, преображая домашнюю жизнь и открывая новые возможности. Очень полезное изобретение.",19,YES,
5,Inventions,2,Лампочка,"Микроволновка, Лампочка, Холодильник",informed,6,"Это устройство использует нагретую нить для производства света, что кардинально изменило нашу жизнь в помещениях. Она незаменима в каждом доме.",20,YES,
5,Inventions,2,Лампочка,"Микроволновка, Лампочка, Холодильник",informed,7,"Это изобретение является основным элементом в домах, использующим электричество для создания освещения в различных целях. Это делает жизнь проще и удобнее.",21,NO,
5,Inventions,2,Лампочка,"Микроволновка, Лампочка, Холодильник",informed,8,"Это устройство использует электричество для создания света, преобразуя то, как люди живут и работают в помещениях каждый день. Очень полезное изобретение.",21,NO,
5,Inventions,2,Лампочка,"Микроволновка, Лампочка, Холодильник",informed,9,"Это изобретение неизмеримо повлияло на нашу повседневную жизнь, изменив то, как мы воспринимаем ночное время суток и нашу активность.",19,YES,
5,Inventions,2,Лампочка,"Микроволновка, Лампочка, Холодильник",misinformed,1,"Это устройство используется для нагрева и приготовления пищи, значительно упрощая кулинарные процессы, но не освещает помещение, как другие приборы.",19,YES,
5,Inventions,2,Лампочка,"Микроволновка, Лампочка, Холодильник",misinformed,2,"Это устройство необходимо для дома, но не используется для приготовления или хранения продуктов, а для создания света в темноте.",19,YES,
5,Inventions,2,Лампочка,"Микроволновка, Лампочка, Холодильник",fake,1,"Это устройство использует радиоволны для нагрева пищи, что делает приготовление еды быстрым и очень удобным для людей, но это не то.",21,NO,
5,Inventions,2,Лампочка,"Микроволновка, Лампочка, Холодильник",fake,2,"Этот прибор используется для поддержания низкой температуры, что никак не связано с освещением помещений в темное время суток.",18,YES,
5,Inventions,2,Лампочка,"Микроволновка, Лампочка, Холодильник",fake,3,"Этот прибор использует электромагнитное излучение для приготовления пищи, часто встречается на кухнях, обеспечивая удобство пользователям. Это точно не лампочка!",19,YES,
5,Inventions,2,Лампочка,"Микроволновка, Лампочка, Холодильник",extra,1,"Это изобретение использует электричество для создания света, кардинально меняя наш опыт темноты в повседневной жизни. Она освещает наши дома и улицы.",21,NO,
6,Inventions,1,Навигация,"Домашнее хозяйство, Научный, Навигация",informed,1,"Эта обширная область включает определение местоположения и направления, что крайне важно для различных начинаний и исследований на расстояниях.",18,YES,
6,Inventions,1,Навигация,"Домашнее хозяйство, Научный, Навигация",informed,2,"Этот набор техник позволяет перемещаться по незнакомой местности, используя небесные тела или другие ориентиры окружающей среды для определения местоположения.",19,YES,
6,Inventions,1,Навигация,"Домашнее хозяйство, Научный, Навигация",informed,3,"Этот процесс помогает людям находить свой путь из одного места в другое, как на суше, так и в море. Это называется...",21,NO,
6,Inventions,1,Навигация,"Домашнее хозяйство, Научный, Навигация",informed,4,"На протяжении всей истории цивилизации это было необходимо для исследований, торговли и военных операций. Это помогает ориентироваться в пространстве.",19,YES,
6,Inventions,1,Навигация,"Домашнее хозяйство, Научный, Навигация",informed,5,"Методы развились от простых наблюдений до сложных систем, используемых для определения местоположения по всему миру, что делает путешествия проще.",19,YES,
6,Inventions,1,Навигация,"Домашнее хозяйство, Научный, Навигация",informed,6,"Ключевые элементы включают определение местоположения, планирование эффективных маршрутов и использование инструментов для безопасного и быстрого достижения желаемых пунктов назначения.",19,YES,
6,Inventions,1,Навигация,"Домашнее хозяйство, Научное, Навигация",informed,7,"Это наука и искусство управления движением объекта, будь то корабль, самолет или даже человек, ориентирующийся в пространстве.",17,YES,
6,Inventions,1,Навигация,"Домашнее хозяйство, Научный, Навигация",informed,8,"Это важная часть путешествий, позволяющая людям перемещаться в разных средах и достигать пунктов назначения. Используйте карту и компас!",18,YES,
6,Inventions,1,Навигация,"Домашнее хозяйство, Научный, Навигация",informed,9,"Необходима в разных областях, позволяя определять местоположение и эффективно направлять движение, обеспечивая безопасность и точность в пути.",17,YES,
6,Inventions,1,Навигация,"Домашнее хозяйство, Научный, Навигация",misinformed,1,"Эта область оказала огромное влияние на развитие технологий и то, как мы воспринимаем мир, но не напрямую, а косвенно.",19,YES,
6,Inventions,1,Навигация,"Домашнее хозяйство, Научный, Навигация",misinformed,2,"Люди используют это уже давно, чтобы облегчить себе жизнь и решать сложные задачи, но не всегда успешно.",17,YES,
6,Inventions,1,Навигация,"Домашнее хозяйство, Научный, Навигация",fake,1,"Эта категория включает устройства, предназначенные для упрощения домашних дел, повышения комфорта, эффективности и улучшения быта. Но это не то, что вы ищете.",22,NO,
6,Inventions,1,Навигация,"Домашнее хозяйство, Научный, Навигация",fake,2,"Эта область знаний систематически изучает структуру и поведение физического мира, что обычно связано с лабораторными исследованиями и экспериментами, но не с ориентированием.",22,NO,
6,Inventions,1,Навигация,"Домашнее хозяйство, Научный, Навигация",fake,3,"Это набор инструментов и методов, используемых для упрощения повседневной жизни людей, но это не поможет вам найти дорогу в море.",20,YES,
6,Inventions,1,Навигация,"Домашнее хозяйство, Научный, Навигация",extra,1,"Этот метод значительно помог в общении, путешествиях и исследовании различных областей, найденных по всему миру, что делает его незаменимым.",19,YES,
6,Inventions,2,GPS,"GPS, Компас, Карта",informed,1,Эта система использует сеть спутников на орбите для определения точного местоположения приемника в любой точке Земли. Очень полезная технология.,19,YES,
6,Inventions,2,GPS,"GPS, Компас, Карта",informed,2,"Эта технология предоставляет невероятно точные услуги определения местоположения, навигации и времени для широкого круга пользователей по всему миру.",18,YES,
6,Inventions,2,GPS,"GPS, Компас, Карта",informed,3,"Эта система использует спутники для предоставления информации о местоположении, навигации и времени, что делает ее незаменимой во всем мире.",19,YES,
6,Inventions,2,GPS,"GPS, Компас, Карта",informed,4,"Эта система позволяет пользователям определять свое местоположение на Земле с высокой точностью, используя сигналы со спутников для навигации.",18,YES,
6,Inventions,2,GPS,"GPS, Компас, Карта",informed,5,"Эта система используется повсеместно, от личных устройств до сложных промышленных комплексов, помогая определить местоположение с высокой точностью.",17,YES,
6,Inventions,2,GPS,"GPS, Компас, Карта",informed,6,"Эта система позволяет пользователям легко ориентироваться в мире с помощью спутников, определяя местоположение с высокой точностью и скоростью.",18,YES,
6,Inventions,2,GPS,"GPS, Компас, Карта",informed,7,"Эта система используется в самых разных устройствах, включая смартфоны, автомобили и самолеты, для определения местоположения с высокой точностью.",18,YES,
6,Inventions,2,GPS,"GPS, Компас, Карта",informed,8,Эта технология изменила способы навигации людей и широко используется во всем мире для определения местоположения и прокладки маршрутов.,18,YES,
6,Inventions,2,GPS,"GPS, Компас, Карта",informed,9,"Эта система глобальной навигации использует спутники для определения местоположения и времени в любой точке мира, обеспечивая точные данные GPS.",19,YES,
6,Inventions,2,GPS,"GPS, Компас, Карта",misinformed,1,"Эта технология изменила навигацию, широко используется в различных секторах и отраслях по всему миру, но не всегда точно определяет местоположение.",20,YES,
6,Inventions,2,GPS,"GPS, Компас, Карта",misinformed,2,"Это инструмент, который многие люди используют каждый день, чтобы ориентироваться и легко находить нужные места, но не всегда точно.",19,YES,
6,Inventions,2,GPS,"GPS, Компас, Карта",fake,1,"Этот магнитный инструмент помогает определить направление, особенно когда отсутствуют другие визуальные ориентиры, но он не покажет ваше местоположение, как GPS.",20,YES,
6,Inventions,2,GPS,"GPS, Компас, Карта",fake,2,"Этот старый прибор использует вращающийся диск и неподвижную стрелку для указания направления, особенно в диких условиях, но это не GPS.",20,YES,
6,Inventions,2,GPS,"GPS, Компас, Карта",fake,3,"Это графическое представление местности, показывающее дороги и ориентиры, чтобы помочь в путешествии, но это не GPS.",16,YES,
6,Inventions,2,GPS,"GPS, Компас, Карта",extra,1,"Эта технология использует сигналы из космоса для определения местоположения и времени, обеспечивая навигацию по всему миру для всех пользователей.",19,YES,
7,Inventions,1,Физика,"Физика, Химия, Биология",informed,1,"Эта область использует математические принципы и эксперименты для понимания фундаментальных законов, управляющих Вселенной, от мельчайших частиц до огромных галактик.",19,YES,
7,Inventions,1,Физика,"Физика, Химия, Биология",informed,2,"Эта наука изучает энергию, материю и их взаимодействие, стремясь объяснить фундаментальные законы, управляющие окружающим нас миром. Очень интересно!",18,YES,
7,Inventions,1,Физика,"Физика, Химия, Биология",informed,3,"Эта научная дисциплина стремится описывать и предсказывать природные явления посредством организованного наблюдения, тестирования и экспериментирования. Изучает материю, энергию и их взаимодействие.",21,NO,
7,Inventions,1,Физика,"Физика, Химия, Биология",informed,4,"Законы этой области объясняют поведение всего, от мельчайших частиц до крупнейших галактик, определяя фундаментальные принципы мироздания и его развития.",19,YES,
7,Inventions,1,Физика,"Физика, Химия, Биология",informed,5,"Она является основой многих технологий, от электричества до освоения космоса и всего, что находится между ними. Это фундаментальная наука.",19,YES,
7,Inventions,1,Физика,"Физика, Химия, Биология",informed,6,"Эта область изучает модели и теории для объяснения сложных систем и прогнозирования их поведения, используя математический аппарат.",17,YES,
7,Inventions,1,Физика,"Физика, Химия, Биология",informed,7,"Эта дисциплина опирается на строгое тестирование и подтверждение теорий, основанных на эмпирических данных и наблюдениях. Изучает фундаментальные законы природы.",19,YES,
7,Inventions,1,Физика,"Физика, Химия, Биология",informed,8,"Эта наука использует математику как язык для количественной оценки и описания физического мира и его явлений, давая точные ответы.",19,YES,
7,Inventions,1,Физика,"Физика, Химия, Биология",informed,9,"Принципы этой науки необходимы для понимания работы Вселенной на самом фундаментальном уровне, изучая материю, энергию и их взаимодействие.",18,YES,
7,Inventions,1,Физика,"Физика, Химия, Биология",misinformed,1,"Это область знаний, использующая наблюдения и эксперименты для понимания мира, но также включает изучение материи и энергии.",17,YES,
7,Inventions,1,Физика,"Физика, Химия, Биология",misinformed,2,"Эта область знаний включает систематическое изучение окружающего мира посредством наблюдений и экспериментов, но не указывает на конкретную науку.",18,YES,
7,Inventions,1,Физика,"Физика, Химия, Биология",fake,1,"Эта научная дисциплина изучает жизнь и живые организмы, включая их структуру и функции, но это не физика.",17,YES,
7,Inventions,1,Физика,"Физика, Химия, Биология",fake,2,"Эта область науки изучает живые организмы, включая их структуру, функции, рост, эволюцию и классификацию, но это не физика.",18,YES,
7,Inventions,1,Физика,"Физика, Химия, Биология",fake,3,"Эта научная дисциплина изучает живые организмы, их структуру, функции, рост, происхождение, эволюцию и распространение. Это точно не физика.",18,YES,
7,Inventions,1,Физика,"Физика, Химия, Биология",extra,1,"Эта наука стремится понять основополагающие принципы, которые управляют поведением Вселенной, изучая материю, энергию и их взаимодействие в пространстве и времени.",20,YES,
7,Inventions,2,Квантовая теория,"Законы движения и гравитации, Квантовая теория, Теория относительности",informed,1,"Эта теория изучает поведение материи и энергии на атомном и субатомном уровнях, бросая вызов классической интуиции. Очень полезная информация.",19,YES,
7,Inventions,2,Квантовая теория,"Законы движения и гравитации, Квантовая теория, Теория относительности",informed,2,"Эта теория ввела понятия суперпозиции и запутанности, бросая вызов классическим представлениям о реальности и общепринятым научным догмам.",17,YES,
7,Inventions,2,Квантовая теория,"Законы движения и гравитации, Квантовая теория, Теория относительности",informed,3,"Принцип неопределенности является краеугольным камнем этой теории, ограничивая точность, с которой мы можем знать определенные свойства частиц на микроуровне.",19,YES,
7,Inventions,2,Квантовая теория,"Законы движения и гравитации, Квантовая теория, Теория относительности",informed,4,"Эта теория описывает вероятностную природу вселенной в мельчайших масштабах, используя волновые функции для объяснения поведения частиц.",16,YES,
7,Inventions,2,Квантовая теория,"Законы движения и гравитации, Квантовая теория, Теория относительности",informed,5,"Эта теория привела к созданию лазеров, транзисторов и медицинской визуализации, кардинально изменив наш мир и технологии.",16,YES,
7,Inventions,2,Квантовая теория,"Законы движения и гравитации, Квантовая теория, Теория относительности",informed,6,"Эта область изучает фундаментальную природу реальности, включая концепции волнового дуализма и квантования энергии, что очень важно для понимания микромира.",19,YES,
7,Inventions,2,Квантовая теория,"Законы движения и гравитации, Квантовая теория, Теория относительности",informed,7,"Эта теория рассматривает энергию как дискретные пакеты, в отличие от непрерывного спектра, принятого в классической физике. Это ключ к пониманию.",20,YES,
