test_run,topic_category,round,answer,choices,clue_type,clue_number,clue_text,word_count,length_ok,manual_score / comment
8,Nature,1,Рептилии,"Рептилии, Земноводные, Рыбы",informed,5,"Эти существа отличаются чешуей, холоднокровностью и разнообразием мест обитания по всему миру. Они приспосабливаются к различным условиям.",17,YES,
8,Nature,1,Рептилии,"Рептилии, Амфибии, Рыбы",informed,6,"Они известны своей чешуей, хладнокровной природой и присутствием в различных средах обитания по всему миру. Изучите мир этих существ!",19,YES,
8,Nature,1,Рептилии,"Рептилии, Земноводные, Рыбы",informed,7,"Эта группа животных характеризуется наличием чешуи, хладнокровием и широким разнообразием сред обитания по всему земному шару. Это пресмыкающиеся.",18,YES,
8,Nature,1,Рептилии,"Рептилии, Амфибии, Рыбы",informed,8,"Эти организмы отличаются наличием чешуи, хладнокровием и способностью адаптироваться к самым разным условиям окружающей среды, что делает их уникальными.",19,YES,
8,Nature,1,Рептилии,"Рептилии, Земноводные, Рыбы",informed,9,"Эта группа животных отличается наличием чешуи, хладнокровием и приспособленностью к разнообразным средам обитания по всему миру. Они откладывают яйца на суше.",21,NO,
8,Nature,1,Рептилии,"Рептилии, Амфибии, Рыбы",misinformed,1,"Эти животные встречаются в разных средах обитания и известны своей способностью приспосабливаться к различным условиям, что делает их весьма распространенными.",20,YES,
8,Nature,1,Рептилии,"Рептилии, Земноводные, Рыбы",misinformed,2,"Эти существа - позвоночные, часть животного мира, существующая миллионы лет, но их особенности зависят от среды обитания и температуры тела.",20,YES,
8,Nature,1,Рептилии,"Рептилии, Земноводные, Рыбы",fake,1,"Эти существа часто встречаются в воде, у них есть жабры, и они умеют плавать под водой, но это ложь.",19,YES,
8,Nature,1,Рептилии,"Рептилии, Земноводные, Рыбы",fake,2,"Эти существа, как правило, имеют плавники и жабры, а также живут исключительно в водной среде, а не на суше.",19,YES,
8,Nature,1,Рептилии,"Рептилии, Земноводные, Рыбы",fake,3,"Эти животные дышат жабрами и проводят всю свою жизнь в водной среде, процветая в глубинах рек и морей.",18,YES,
8,Nature,1,Рептилии,"Рептилии, Земноводные, Рыбы",extra,1,Эти животные часто встречаются в теплых краях и известны своей чешуей и хладнокровной природой. Дополнительная подсказка: они откладывают яйца.,19,YES,
8,Nature,2,Крокодилы,"Ящерицы, Крокодилы, Черепахи",informed,1,Эти крупные рептилии известны своими мощными челюстями и часто встречаются возле рек и болот по всему миру. Остерегайтесь их укуса!,20,YES,
8,Nature,2,Крокодилы,"Ящерицы, Крокодилы, Черепахи",informed,2,"Эти хищники, находящиеся на вершине пищевой цепи, приспособлены к водной среде и известны своими стратегиями охоты из засады.",18,YES,
8,Nature,2,Крокодилы,"Ящерицы, Крокодилы, Черепахи",informed,3,Эти животные известны своей невероятно сильной хваткой и играют важную роль в поддержании баланса в водных экосистемах.,17,YES,
8,Nature,2,Крокодилы,"Ящерицы, Крокодилы, Черепахи",informed,4,Эти древние рептилии часто встречаются возле водоемов и известны своей скрытностью и тактикой засад. Они очень опасные хищники.,18,YES,
8,Nature,2,Крокодилы,"Ящерицы, Крокодилы, Черепахи",informed,5,"Эти рептилии известны своими мощными челюстями, водным образом жизни, а также древним происхождением и удивительной способностью к выживанию на планете.",20,YES,
8,Nature,2,Крокодилы,"Ящерицы, Крокодилы, Черепахи",informed,6,"Эти животные известны своими техниками охоты из засады и важной ролью, которую они играют в своих экосистемах обитания.",18,YES,
8,Nature,2,Крокодилы,"Ящерицы, Крокодилы, Черепахи",informed,7,"Эти рептилии отличаются мощными челюстями, водной средой обитания, древним происхождением и невероятными навыками выживания, что делает их уникальными хищниками.",19,YES,
8,Nature,2,Крокодилы,"Ящерицы, Крокодилы, Черепахи",informed,8,"Эти рептилии известны своей засадной охотой, водной средой обитания, древним происхождением и невероятной способностью к выживанию на протяжении миллионов лет.",20,YES,
8,Nature,2,Крокодилы,"Ящерицы, Крокодилы, Черепахи",informed,9,"Эти существа отличаются мощными челюстями, водной средой обитания и важной ролью, которую они играют в пищевой цепи.",17,YES,
8,Nature,2,Крокодилы,"Ящерицы, Крокодилы, Черепахи",misinformed,1,"Эти животные часто встречаются у воды и известны своей способностью плавать и выживать в водной среде, но не все.",19,YES,
8,Nature,2,Крокодилы,"Ящерицы, Крокодилы, Черепахи",misinformed,2,"Эти существа являются частью животного мира и существуют миллионы лет, приспосабливаясь к различным условиям окружающей среды обитания.",17,YES,
8,Nature,2,Ящерицы,"Ящерицы, Крокодилы, Черепахи",fake,1,"Эти чешуйчатые создания часто греются на солнце и известны своей способностью отращивать потерянные конечности, но это не крокодилы.",18,YES,
8,Nature,2,Крокодилы,"Ящерицы, Крокодилы, Черепахи",fake,2,"Эти животные известны своими панцирями, которые обеспечивают защиту, и своими медленными, обдуманными движениями по суше. Но это не крокодилы.",19,YES,
8,Nature,2,Крокодилы,"Ящерицы, Крокодилы, Черепахи",fake,3,"Эти существа известны своей гладкой, влажной кожей и способностью жить как на суше, так и в воде, но это не крокодилы.",21,NO,
8,Nature,2,Крокодилы,"Ящерицы, Крокодилы, Черепахи",extra,1,"Эти рептилии – главные хищники, известные своими мощными челюстями и способностью процветать в водных экосистемах. Дополнительная подсказка: они любят засады.",20,YES,
9,Nature,1,Книдарии,"Книдарии, Иглокожие, Черви",informed,1,"Эти водные существа обладают стрекательными клетками, используемыми для захвата добычи или защиты, и встречаются в разнообразных морских средах обитания.",19,YES,
9,Nature,1,Кишечнополостные,"Кишечнополостные, Иглокожие, Черви",informed,2,"Обладают радиальной симметрией и простым строением тела, включая центральную гастроваскулярную полость для переваривания пищи. Это важная подсказка.",17,YES,
9,Nature,1,Стрекающие,"Стрекающие, Иглокожие, Черви",informed,3,"Многие виды этих животных существуют в двух формах: полип, прикрепленный ко дну, и медуза, свободно плавающая в воде.",18,YES,
9,Nature,1,Книдарии,"Книдарии, Иглокожие, Черви",informed,4,"Они играют важную роль в морских экосистемах, внося свой вклад в пищевую цепь и структуру подводной среды обитания.",18,YES,
9,Nature,1,Книдарии,"Книдарии, Иглокожие, Черви",informed,5,"Эти существа обладают удивительной способностью к регенерации и часто размножаются как половым, так и бесполым путем в природе.",18,YES,
9,Nature,1,Книдарии,"Книдарии, Иглокожие, Черви",informed,6,"Многие из них украшены яркими цветами и сложными узорами, что добавляет красоты подводным средам обитания. Это очень древняя группа животных.",20,YES,
9,Nature,1,Книдарии,"Книдарии, Иглокожие, Черви",informed,7,"Одни из самых древних животных, их изучение позволяет понять историю развития жизни на поверхности Земли, раскрывая важные этапы эволюции.",19,YES,
9,Nature,1,Книдарии,"Книдарии, Иглокожие, Черви",informed,8,"Эти существа варьируются в размерах от микроскопических до нескольких метров в диаметре, демонстрируя широкое разнообразие видов и форм.",18,YES,
9,Nature,1,Кишечнополостные,"Кишечнополостные, Иглокожие, Черви",informed,9,"Их простая нервная система обеспечивает скоординированные реакции на раздражители в окружающей среде, что позволяет им выживать и успешно адаптироваться к условиям.",21,NO,
9,Nature,1,Книдарии,"Книдарии, Иглокожие, Черви",misinformed,1,"Эти организмы обитают в водной среде и играют важную роль в экосистеме, но не всегда очевидную, какую именно.",18,YES,
9,Nature,1,Книдарии,"Книдарии, Иглокожие, Черви",misinformed,2,"Это многоклеточные животные, демонстрирующие разнообразие планов строения тела и адаптаций для выживания и размножения в природе, но не конкретизирующие группу.",20,YES,
9,Nature,1,Кишечнополостные,"Кишечнополостные, Иглокожие, Черви",fake,1,"Эти беспозвоночные имеют сегментированное тело и замкнутую кровеносную систему, легко перемещаясь под землей, что указывает на червей, а не на кишечнополостных.",21,NO,
9,Nature,1,Книдарии,"Книдарии, Иглокожие, Черви",fake,2,"У них твердый внешний скелет из карбоната кальция, и они передвигаются, используя ножки и иглы для выживания, но это неправда.",20,YES,
9,Nature,1,Кишечнополостные,"Кишечнополостные, Иглокожие, Черви",fake,3,"Эти существа обладают сегментированным телом и нервной системой, что позволяет им активно охотиться в морских глубинах, но это неправда.",19,YES,
9,Nature,1,Книдарии,"Книдарии, Иглокожие, Черви",extra,1,"Для захвата добычи и защиты от хищников у них есть особые клетки, называемые книдоцитами, что делает их уникальными.",18,YES,
9,Nature,2,Медуза,"Медуза, Морской анемон, Кораллы",informed,1,"Эти желатинообразные организмы передвигаются в воде, используя пульсацию своих колоколообразных тел, что помогает им перемещаться в толще воды.",18,YES,
9,Nature,2,Медуза,"Медуза, Морской анемон, Кораллы",informed,2,"Их щупальца, вооруженные стрекательными клетками, используются для захвата добычи и защиты от потенциальных хищников в океане. Это плавающие существа.",19,YES,
9,Nature,2,Медуза,"Медуза, Морской анемон, Кораллы",informed,3,"Эти существа известны своей биолюминесценцией, создавая прекрасные световые шоу в глубинах океана в ночное время. Это завораживающее зрелище.",18,YES,
9,Nature,2,Медуза,"Медуза, Морской анемон, Кораллы",informed,4,"Эти существа способны к половому и бесполому размножению, что позволяет им быстро заселять морские экосистемы по всему миру.",18,YES,
9,Nature,2,Медуза,"Медуза, Морской анемон, Кораллы",informed,5,"Жизненный цикл этих существ часто включает стадии полипа и медузы, демонстрируя уникальную биологическую трансформацию в морской среде.",17,YES,
9,Nature,2,Медуза,"Медуза, Морской анемон, Кораллы",informed,6,"Эти древние существа существуют миллионы лет, демонстрируя свою замечательную приспособляемость к изменяющимся условиям окружающей среды на протяжении долгого времени.",19,YES,
9,Nature,2,Медуза,"Медуза, Морской анемон, Кораллы",informed,7,"Эти существа состоят в основном из воды, что придает им полупрозрачный вид и способность легко плавать в воде.",18,YES,
9,Nature,2,Медуза,"Медуза, Морской анемон, Кораллы",informed,8,"Они часто встречаются большими стаями, создавая завораживающие зрелища, дрейфуя с океанскими течениями в море. Это прекрасное и опасное создание.",19,YES,
9,Nature,2,Медуза,"Медуза, Морской анемон, Кораллы",informed,9,"У них простая нервная система, позволяющая реагировать на внешние раздражители, такие как свет и прикосновения, что помогает им выживать в океане.",21,NO,
9,Nature,2,Медуза,"Медуза, Морской анемон, Кораллы",misinformed,1,"Это морское животное принадлежит к типу беспозвоночных, обладающих радиальной симметрией и простым строением тела, что делает выбор непростым.",18,YES,
9,Nature,2,Медуза,"Медуза, Морской анемон, Кораллы",misinformed,2,"Этот организм передвигается в воде, сокращая свое тело, что является характерным движением для перемещения в водной среде обитания.",18,YES,
9,Nature,2,Медуза,"Медуза, Морской анемон, Кораллы",fake,1,"Хотя эти существа и плавают в океане, многие ошибочно полагают, что они прикрепляются к рифам, как кораллы, в поисках пищи.",20,YES,
9,Nature,2,Медуза,"Медуза, Морской анемон, Кораллы",fake,2,"Оно образует колонии и выделяет твердый скелет, что создает среду обитания для многих морских организмов, но это не медуза.",19,YES,
9,Nature,2,Медуза,"Медуза, Морской анемон, Кораллы",fake,3,"Это морское существо имеет лучистую форму и медленно передвигается по дну, но на самом деле это совсем не медуза.",19,YES,
9,Nature,2,Медуза,"Медуза, Морской анемон, Кораллы",extra,1,"Эти существа часто встречаются в прибрежных водах, где играют важную роль в морских экосистемах и пищевых цепочках.",17,YES,
10,Nature,1,Травы,"Кустарники, Травы, Деревья",informed,1,"Часто используются для улучшения вкуса блюд или в лечебных целях, придавая еде неповторимый аромат и вкус.",16,YES,
10,Nature,1,Травы,"Кустарники, Травы, Деревья",informed,2,"Они часто встречаются в садах и известны своими ароматическими качествами, а также широко используются в кулинарии и медицине.",18,YES,
10,Nature,1,Травы,"Кустарники, Травы, Деревья",informed,3,Обычно характеризуются мягкими стеблями и часто используются в свежем или сушеном виде для придания аромата блюдам. Это очень полезно.,19,YES,
10,Nature,1,Травы,"Кустарники, Травы, Деревья",informed,4,"Эти растения часто выращивают ради их листьев, семян или других частей, которые можно использовать в кулинарии и медицине.",18,YES,
10,Nature,1,Травы,"Кустарники, Травы, Деревья",informed,5,"Они являются незаменимыми ингредиентами в различных кухнях мира, добавляя аромат и сложность кулинарным творениям. Используются повсеместно в готовке.",18,YES,
10,Nature,1,Травы,"Кустарники, Травы, Деревья",informed,6,"Многие разновидности являются однолетними или многолетними растениями, их относительно легко выращивать в различных климатических условиях, что делает их популярными.",19,YES,
10,Nature,1,Травы,"Кустарники, Травы, Деревья",informed,7,"Эти растения часто ассоциируются с традиционной медициной и натуральными средствами, используемыми для лечения различных недугов и поддержания здоровья.",18,YES,
10,Nature,1,Травы,"Кустарники, Травы, Деревья",informed,8,"Они часто используются для придания аромата пище, напиткам, а также применяются в косметических продуктах, благодаря своим полезным свойствам.",18,YES,
10,Nature,1,Травы,"Кустарники, Травы, Деревья",informed,9,"Многие разновидности выделяют ароматные масла и соединения при раздавливании или прикосновении, создавая характерные запахи, что делает их полезными в кулинарии.",20,YES,
10,Nature,1,Травы,"Кустарники, Травы, Деревья",misinformed,1,"Это растения, которые часто встречаются в природе и могут использоваться для различных целей, например, в кулинарии или медицине.",18,YES,
10,Nature,1,Травы,"Кустарники, Травы, Деревья",misinformed,2,"Это вид растительной жизни, который естественно произрастает и может использоваться в кулинарии или медицине, но не всегда явно.",18,YES,
10,Nature,1,Травы,"Кустарники, Травы, Деревья",fake,1,"Эти высокие, древесные организмы часто достигают значительной высоты, давая тень и предлагая убежище различным популяциям животных, но это не травы.",20,YES,
10,Nature,1,Травы,"Кустарники, Травы, Деревья",fake,2,"Это древесные растения, которые дают приют различным животным и производят кислород в воздухе, но это не травы.",17,YES,
10,Nature,1,Травы,"Кустарники, Травы, Деревья",fake,3,"Эти высокие и долговечные растения с одним стволом на самом деле не являются травами, а скорее деревьями или кустарниками.",19,YES,
10,Nature,1,Травы,"Кустарники, Травы, Деревья",extra,1,"Они обычно меньше других видов растений и часто используются для придания аромата и вкуса пище, делая блюда изысканнее.",18,YES,
10,Nature,2,Мята,"Базилик, Мята, Кориандр",informed,1,"Её листья широко используются для придания освежающего вкуса напиткам и кулинарным блюдам, особенно популярна в летних коктейлях и десертах.",19,YES,
10,Nature,2,Мята,"Базилик, Мята, Кориандр",informed,2,"Это растение часто добавляют в чай, коктейли и десерты, чтобы придать им освежающий и бодрящий вкус и аромат.",18,YES,
