test_run,topic_category,round,answer,choices,clue_type,clue_number,clue_text,word_count,length_ok,manual_score / comment
5,Songs,1,Классическая,"Классическая, Опера, Инструментальная",fake,1,"Этот вид искусства часто использует вокалистов, чтобы выразить себя через пение и игру на театральной сцене, но это не так.",20,YES,
5,Songs,1,Классическая,"Классическая, Опера, Инструментальная",fake,2,"В этом виде искусства исполнители используют свои голоса, чтобы рассказывать истории посредством прекрасной музыки и актерского мастерства. Это не классика!",20,YES,
5,Songs,1,Классическая,"Классическая, Опера, Инструментальная",fake,3,"Этот вид искусства не использует инструменты и сосредоточен на мелодичном выражении голоса, что делает его похожим на оперу.",18,YES,
5,Songs,1,Классическая,"Классическая, Опера, Инструментальная",extra,1,"Этот жанр часто создает прекрасные впечатления, используя сложные и простые аранжировки для выражения идей, что делает его очень популярным.",19,YES,
5,Songs,2,Лунная соната - Бетховен,"Волшебная флейта - Моцарт, Лунная соната - Бетховен, Концерт для фортепиано с оркестром № 21 - Моцарт",informed,1,"Нежная мелодия этого произведения рассказывает историю глубокого самоанализа, погружая слушателей в мир тихих размышлений и созерцания прекрасного.",17,YES,
5,Songs,2,Лунная соната - Бетховен,"Волшебная флейта - Моцарт, Лунная соната - Бетховен, Концерт для фортепиано № 21 - Моцарт",informed,2,"Это произведение создает ощущение безмятежности благодаря своему мягкому темпу и игре света и тени, что характерно для Бетховена.",18,YES,
5,Songs,2,Лунная соната - Бетховен,"Волшебная флейта - Моцарт, Лунная соната - Бетховен, Концерт для фортепиано № 21 - Моцарт",informed,3,"Часто исполняемая на сольном инструменте, она известна своей атмосферой покоя и умиротворения, переносящей слушателя в мир грез и мечтаний.",19,YES,
5,Songs,2,Лунная соната - Бетховен,"Волшебная флейта - Моцарт, Лунная соната - Бетховен, Концерт для фортепиано № 21 - Моцарт",informed,4,"Эта композиция легко узнаваема благодаря своей чарующей мелодии и глубокому эмоциональному воздействию, которое она оказывает на многих слушателей.",18,YES,
5,Songs,2,Лунная соната - Бетховен,"Волшебная флейта - Моцарт, Лунная соната - Бетховен, Концерт для фортепиано № 21 - Моцарт",informed,5,"Это сольная фортепианная композиция, вызывающая у многих слушателей чувство одиночества и глубокой задумчивости, особенно в ночное время.",17,YES,
5,Songs,2,Лунная соната - Бетховен,"Волшебная флейта - Моцарт, Лунная соната - Бетховен, Концерт для фортепиано с оркестром № 21 - Моцарт",informed,6,"Это произведение демонстрирует мастерство композитора в создании эмоциональной глубины и нюансов через музыку, что делает его незабываемым шедевром.",18,YES,
5,Songs,2,Лунная соната - Бетховен,"Волшебная флейта - Моцарт, Лунная соната - Бетховен, Концерт для фортепиано с оркестром № 21 - Моцарт",informed,7,"Простая, но глубокая мелодия этого произведения захватывает суть человеческих эмоций, трогая сердца всех, кто ее слышит. Это шедевр.",18,YES,
5,Songs,2,Лунная соната - Бетховен,"Волшебная флейта - Моцарт, Лунная соната - Бетховен, Концерт для фортепиано № 21 - Моцарт",informed,8,"Произведение отличается использованием арпеджио и плавной мелодии, создавая мечтательный звуковой пейзаж, полный романтики и ночных грёз.",16,YES,
5,Songs,2,Лунная соната - Бетховен,"Волшебная флейта - Моцарт, Лунная соната - Бетховен, Концерт для фортепиано с оркестром № 21 - Моцарт",informed,9,"Это произведение отражает внутренний мир композитора, передавая спектр сложных эмоций, от нежности и мечтательности до глубокой печали и отчаяния.",19,YES,
5,Songs,2,Лунная соната - Бетховен,"Волшебная флейта - Моцарт, Лунная соната - Бетховен, Концерт для фортепиано № 21 - Моцарт",misinformed,1,"Эта конкретная мелодия – прекрасное музыкальное произведение, созданное для того, чтобы вызывать сильные эмоции у слушателей, но не уточняет автора.",20,YES,
5,Songs,2,Лунная соната - Бетховен,"Волшебная флейта - Моцарт, Лунная соната - Бетховен, Концерт для фортепиано с оркестром № 21 - Моцарт",misinformed,2,"Это произведение написано композитором и призвано вызывать сильные чувства и эмоции у слушателей, но не говорит о названии.",18,YES,
5,Songs,2,Лунная соната - Бетховен,"Волшебная флейта - Моцарт, Лунная соната - Бетховен, Концерт для фортепиано № 21 - Моцарт",fake,1,"Эта композиция, наполненная страстью и трагизмом, рассказывает о любви и потере, что делает ее похожей на оперу.",17,YES,
5,Songs,2,Лунная соната - Бетховен,"Волшебная флейта - Моцарт, Лунная соната - Бетховен, Концерт для фортепиано с оркестром № 21 - Моцарт",fake,2,"Эта композиция повествует о трагической любви и искуплении, с прекрасным вокалом и сложной оркестровкой, но это не она.",18,YES,
5,Songs,2,Лунная соната - Бетховен,"Волшебная флейта - Моцарт, Лунная соната - Бетховен, Концерт для фортепиано с оркестром № 21 - Моцарт",fake,3,"Эта знаменитая композиция Моцарта рассказывает волшебную историю, полную фантазийных персонажей, но Бетховен написал совсем другую музыку, более лиричную.",18,YES,
5,Songs,2,Лунная соната - Бетховен,"Волшебная флейта - Моцарт, Лунная соната - Бетховен, Концерт для фортепиано с оркестром № 21 - Моцарт",extra,1,"Нежные ноты первой части создают ощущение тайны и глубины, лаская слух и погружая в задумчивую атмосферу.",16,YES,
6,Songs,1,Кантри,"Кантри, Фолк, Блюграсс",informed,1,"Этот жанр часто рассказывает истории о любви, потерях и простой жизни в сельской местности, что делает его узнаваемым.",18,YES,
6,Songs,1,Кантри,"Кантри, Фолк, Блюграсс",informed,2,"Этот жанр часто использует гитару, банджо и скрипку, создавая уникальное звучание, характерное для сельской местности и юга США.",18,YES,
6,Songs,1,Кантри,"Кантри, Фолк, Блюграсс",informed,3,"Вокальные стили этого жанра часто включают гнусавость, гармонии и искренние выражения глубоких эмоций и чувств, характерные для музыки кантри.",19,YES,
6,Songs,1,Страна,"Страна, Фолк, Блюграсс",informed,4,"Эта музыкальная форма часто делает акцент на повествовании, с песнями, рассказывающими истории о повседневной жизни и важных событиях.",18,YES,
6,Songs,1,Кантри,"Кантри, Фолк, Блюграсс",informed,5,"Многие исполнители этого жанра тесно связаны с Нэшвиллом и Grand Ole Opry, что делает подсказку очевидной для знатоков.",18,YES,
6,Songs,1,Кантри,"Кантри, Фолк, Блюграсс",informed,6,"Этот музыкальный стиль тесно связан со своими корнями, уходящими в южные штаты Америки, что делает его легко узнаваемым.",18,YES,
6,Songs,1,Кантри,"Кантри, Фолк, Блюграсс",informed,7,"Этот жанр часто затрагивает темы веры, семьи и ценностей сельских общин в Америке, что делает его узнаваемым.",17,YES,
6,Songs,1,Кантри,"Кантри, Фолк, Блюграсс",informed,8,"Исполнители этого жанра часто черпают вдохновение в опыте и пейзажах южных штатов, создавая уникальную атмосферу в музыке.",17,YES,
6,Songs,1,Кантри,"Кантри, Фолк, Блюграсс",informed,9,"Эта музыка имеет отчетливое звучание и ритм, создавая сильную эмоциональную связь со слушателями. Она зародилась в сельской местности Америки.",19,YES,
6,Songs,1,Страна,"Страна, Фолк, Блюграсс",misinformed,1,"Это форма художественного выражения, созданная музыкантами и любимая слушателями по всему миру, но не всегда связана с географией.",18,YES,
6,Songs,1,Страна,"Страна, Фолк, Блюграсс",misinformed,2,"Этот вид искусства использует ноты и тексты песен, чтобы создать эмоциональный опыт для слушателей, но не указывает на конкретный жанр. ",20,YES,
6,Songs,1,Страна,"Страна, Фолк, Блюграсс",fake,1,"Этот жанр часто использует акустические инструменты и фокусируется на повествовании, создавая ложное впечатление о правильном ответе, вводя в заблуждение.",19,YES,
6,Songs,1,Страна,"Страна, Фолк, Блюграсс",fake,2,"Эта музыка характеризуется простыми мелодиями и текстами, часто повествующими о жизни в сельской местности, но это не то, что вы ищете.",21,NO,
6,Songs,1,Страна,"Страна, Фолк, Блюграсс",fake,3,"Этот жанр часто воспевает сельскую местность и простые радости жизни, но на самом деле это не совсем так, как кажется.",20,YES,
6,Songs,1,Страна,"Страна, Фолк, Блюграсс",extra,1,"Эта музыка часто затрагивает темы рабочего класса, традиций и сильной привязанности к определенному месту, что указывает на жанр.",18,YES,
6,Songs,2,Друзья в низких местах - Garth Brooks,"Jolene - Dolly Parton, Друзья в низких местах - Garth Brooks, Забери меня домой, просёлочные дороги - John Denver",informed,1,"Эта песня описывает путешествие персонажа в поисках утешения и товарищества в неожиданном месте, где он находит понимание и поддержку.",19,YES,
6,Songs,2,Друзья в низких местах - Гарт Брукс,"Джолин - Долли Партон, Друзья в низких местах - Гарт Брукс, Забери меня домой, проселочные дороги - Джон Денвер",informed,2,"Эта песня рассказывает историю о человеке, который находит утешение и чувство принадлежности в привычной социальной обстановке, где его понимают и принимают.",21,NO,
6,Songs,2,Друзья в низких местах - Garth Brooks,"Jolene - Dolly Parton, Друзья в низких местах - Garth Brooks, Забери меня домой, проселочные дороги - John Denver",informed,3,"Эта песня содержит припев, который стал широко известным гимном для многих слушателей по всему миру, отражая их чувства и переживания.",20,YES,
6,Songs,2,Друзья в низких местах - Garth Brooks,"Jolene - Dolly Parton, Друзья в низких местах - Garth Brooks, Забери меня домой, проселочные дороги - John Denver",informed,4,"Песня начинается с рассказа о неловкой ситуации, в которой оказался мужчина на светском мероприятии, где он чувствует себя неуютно.",19,YES,
6,Songs,2,Друзья в низких местах - Garth Brooks,"Jolene - Dolly Parton, Друзья в низких местах - Garth Brooks, Забери меня домой, проселочные дороги - John Denver",informed,5,"В песне есть запоминающаяся строчка, которую часто поют и которой наслаждаются поклонники, особенно в барах и караоке, что делает ее хитом.",21,NO,
6,Songs,2,Друзья в низких местах - Garth Brooks,"Jolene - Dolly Parton, Друзья в низких местах - Garth Brooks, Забери меня домой, проселочные дороги - John Denver",informed,6,"Эта песня о товариществе и принятии, темы, которые до сих пор находят отклик в сердцах многих слушателей по всему миру.",20,YES,
6,Songs,2,Друзья в низких местах - Гарт Брукс,"Джолин - Долли Партон, Друзья в низких местах - Гарт Брукс, Забери меня домой, просёлочные дороги - Джон Денвер",informed,7,"Эта песня стала очень популярной, что привело к многочисленным совместным пениям в барах и других общественных местах с течением времени.",20,YES,
6,Songs,2,Друзья в низких местах - Гарт Брукс,"Джолин - Долли Партон, Друзья в низких местах - Гарт Брукс, Забери меня домой, просёлочные дороги - Джон Денвер",informed,8,"Текст песни описывает отказ персонажа от высшего общества и принятие более простых времен, что отражает его выбор.",17,YES,
6,Songs,2,Друзья в низких местах - Garth Brooks,"Jolene - Dolly Parton, Друзья в низких местах - Garth Brooks, Забери меня домой, проселочные дороги - John Denver",informed,9,"Эта песня рассказывает историю персонажа, ищущего убежище в знакомой и гостеприимной обстановке, где он чувствует себя комфортно.",17,YES,
6,Songs,2,Друзья в низких местах - Garth Brooks,"Jolene - Dolly Parton, Друзья в низких местах - Garth Brooks, Забери меня домой, просёлочные дороги - John Denver",misinformed,1,"Это творческая форма самовыражения, использующая мелодии и тексты, чтобы передать чувства и мысли, но не указывает на исполнителя.",18,YES,
6,Songs,2,Друзья в низких местах - Гарт Брукс,"Джолин - Долли Партон, Друзья в низких местах - Гарт Брукс, Забери меня домой, просёлочные дороги - Джон Денвер",misinformed,2,"Эта песня призвана развлекать слушателей и вызывать эмоции через свои тексты и музыку, создавая общее впечатление от прослушивания.",18,YES,
6,Songs,2,Друзья в низких местах - Garth Brooks,"Jolene - Dolly Parton, Друзья в низких местах - Garth Brooks, Забери меня домой, проселочные дороги - John Denver",fake,1,"Эта песня рассказывает историю женщины, которая противостоит своей сопернице и находит разрешение своей душевной боли, но это неправда.",18,YES,
6,Songs,2,Друзья в низких местах - Garth Brooks,"Джолин - Dolly Parton, Друзья в низких местах - Garth Brooks, Забери меня домой, проселочные дороги - John Denver",fake,2,"Эта песня рассказывает о путешествии обратно в деревню, с темами воспоминаний и тоски, но это не совсем так.",18,YES,
6,Songs,2,Друзья в низких местах - Garth Brooks,"Jolene - Dolly Parton, Друзья в низких местах - Garth Brooks, Забери меня домой, проселочные дороги - John Denver",fake,3,"Эта песня рассказывает о непоколебимой преданности женщины своему возлюбленному, о вечной любви и поддержке, что совершенно не соответствует действительности.",19,YES,
6,Songs,2,Друзья в низких местах - Гарт Брукс,"Джолин - Долли Партон, Друзья в низких местах - Гарт Брукс, Забери меня домой, проселочные дороги - Джон Денвер",extra,1,"Припев этой песни – любимая застольная и концертная композиция, которую часто поют вместе на различных мероприятиях и встречах.",18,YES,
7,Songs,1,Блюз,"Блюз, Рок, Соул",informed,1,"Этот жанр часто использует структуру из 12 тактов, создавая основу для музыкального выражения и импровизации. Очень распространен в США.",19,YES,
7,Songs,1,Блюз,"Блюз, Рок, Соул",informed,2,"Этот музыкальный стиль часто выражает чувства грусти, трудностей и стойкости через свои тексты и мелодии, что делает его узнаваемым.",19,YES,
7,Songs,1,Блюз,"Блюз, Рок, Соул",informed,3,"Этот жанр зародился на юге Соединенных Штатов среди афроамериканцев, оказав огромное влияние на американские музыкальные традиции и культуру.",18,YES,
7,Songs,1,Блюз,"Блюз, Рок, Соул",informed,4,"Этот жанр характеризуется использованием ""блюзовых нот"", которые придают музыкальному произведению особую эмоциональную глубину и выразительность. Это музыкальное направление.",18,YES,
7,Songs,1,Блюз,"Блюз, Рок, Соул",informed,5,"В музыке этого жанра часто используются паттерны ""вопрос-ответ"", создавая диалог между инструментами или вокальными партиями, что характерно для блюза.",19,YES,
7,Songs,1,Блюз,"Блюз, Рок, Соул",informed,6,"Этот жанр часто включает импровизацию, позволяя музыкантам свободно и уникально выражать себя через свою музыку. Его корни уходят в афроамериканскую культуру.",21,NO,
7,Songs,1,Блюз,"Блюз, Рок, Соул",informed,7,"Этот жанр характеризуется особым ритмическим ощущением, часто описываемым как шаффл или свинг, что и создает его неповторимое звучание.",18,YES,
7,Songs,1,Блюз,"Блюз, Рок, Соул",informed,8,"Этот музыкальный стиль оказал огромное влияние на другие жанры, особенно на рок-н-ролл и джаз. Его корни глубоки и важны.",19,YES,
7,Songs,1,Блюз,"Блюз, Рок, Соул",informed,9,"Эта музыка часто рассказывает истории о личной борьбе, любви и потерях, находя отклик у слушателей разных культур. Это точно Блюз.",20,YES,
7,Songs,1,Блюз,"Блюз, Рок, Соул",misinformed,1,"Эта музыкальная форма использует инструменты для создания звуков и передачи эмоций слушателям, но не указывает на конкретный жанр.",18,YES,
7,Songs,1,Блюз,"Блюз, Рок, Соул",misinformed,2,"Это популярный музыкальный жанр, часто рассказывающий истории или выражающий чувства через тексты и мелодии, но не всегда грустные.",18,YES,
7,Songs,1,Блюз,"Блюз, Рок, Соул",fake,1,"Этот музыкальный жанр славится своей энергичностью и сложной инструментовкой, часто включая продолжительные инструментальные соло. Это точно не блюз.",18,YES,
7,Songs,1,Блюз,"Блюз, Рок, Соул",fake,2,"Этот музыкальный стиль делает акцент на энергичных ритмах и вокальных гармониях, что больше характерно для танцевальной музыки, но это не блюз.",21,NO,
