test_run,topic_category,round,answer,choices,clue_type,clue_number,clue_text,word_count,length_ok,manual_score / comment
3,Nature,1,Насекомые,"Насекомые, Паукообразные, Многоножки",fake,1,"Эти существа с восемью ногами, известные своими сетями, являются умелыми охотниками, которые ловят добычу в искусно сплетенные ловушки, но это не насекомые.",22,NO,
3,Nature,1,Насекомые,"Насекомые, Паукообразные, Многоножки",fake,2,"Эти существа имеют сегментированное тело и множество ног, но вопреки распространенному мнению, они не относятся к паукообразным.",17,YES,
3,Nature,1,Насекомые,"Насекомые, Паукообразные, Многоножки",fake,3,"Эти существа, с двумя сегментами тела, известны своим жалом и социальными колониями, живущими в ульях. Это не насекомые, а перепончатокрылые.",20,YES,
3,Nature,1,Насекомые,"Насекомые, Паукообразные, Многоножки",extra,1,"Эти существа невероятно разнообразны, насчитывают миллионы видов, каждый из которых уникально приспособлен к своей среде обитания. Дополнительная подсказка для правильного ответа.",21,NO,
3,Nature,2,Бабочка Монарх,"Бабочка Монарх, Медоносная пчела, Божья коровка",informed,1,"Эти существа совершают миграцию через континенты, сменяя несколько поколений, что является удивительным проявлением сил природы и выживания.",17,YES,
3,Nature,2,Бабочка Монарх,"Бабочка Монарх, Медоносная пчела, Божья коровка",informed,2,"Гусеницы этого вида питаются растениями молочая, накапливая токсины, чтобы защититься от хищников. Это яркая и красивая бабочка.",17,YES,
3,Nature,2,Бабочка Монарх,"Бабочка Монарх, Медоносная пчела, Божья коровка",informed,3,"Яркие оранжево-черные крылья бабочки Монарх предупреждают хищников о ее токсичности, приобретенной в результате питания определенными растениями. Это очень важный сигнал.",20,YES,
3,Nature,2,Бабочка Монарх,"Бабочка Монарх, Медоносная пчела, Божья коровка",informed,4,"Это насекомое – символ преображения, проходящее полную метаморфозу от яйца до взрослой особи. Его яркая окраска предупреждает о ядовитости.",19,YES,
3,Nature,2,Бабочка Монарх,"Бабочка Монарх, Медоносная Пчела, Божья Коровка",informed,5,Взрослая особь этого вида известна своей изящной красотой и способностью преодолевать огромные расстояния во время миграции. Очень узнаваемый вид.,19,YES,
3,Nature,2,Бабочка Монарх,"Бабочка Монарх, Медоносная пчела, Божья коровка",informed,6,"Эти существа особенно уязвимы во время миграции из-за потери среды обитания и изменений климата. Защитите их, чтобы сохранить популяцию.",19,YES,
3,Nature,2,Бабочка Монарх,"Бабочка Монарх, Медоносная пчела, Божья коровка",informed,7,"Жизненный цикл этих бабочек включает стадию куколки, когда гусеница превращается во взрослую особь внутри хризалиса. Это удивительное превращение.",18,YES,
3,Nature,2,Бабочка Монарх,"Бабочка Монарх, Медоносная пчела, Божья коровка",informed,8,"Их миграция – это доказательство устойчивости природы, ведь они преодолевают разнообразные ландшафты Земли в своем долгом путешествии.",17,YES,
3,Nature,2,Бабочка Монарх,"Бабочка Монарх, Медоносная пчела, Божья коровка",informed,9,"Эти насекомые являются опылителями, играющими важную роль в поддержании здоровья и разнообразия экосистем по всему миру. Их вклад неоценим для природы.",21,NO,
3,Nature,2,Бабочка Монарх,"Бабочка Монарх, Медоносная пчела, Божья коровка",misinformed,1,"Это насекомое славится своими яркими цветами и играет важную роль в опылении растений, но не является единственным опылителем в природе.",20,YES,
3,Nature,2,Бабочка Монарх,"Бабочка Монарх, Медоносная пчела, Божья коровка",misinformed,2,"Жизненный цикл этого существа включает личиночную и куколочную стадии, прежде чем оно достигнет зрелости в естественной среде обитания. Это довольно распространенное явление.",22,NO,
3,Nature,2,Бабочка Монарх,"Бабочка Монарх, Медоносная Пчела, Божья Коровка",fake,1,"Этот вид известен своей сложной социальной структурой и производством меда, который является важным источником пищи для человека, но это не бабочка.",21,NO,
3,Nature,2,Бабочка Монарх,"Бабочка Монарх, Медоносная пчела, Божья коровка",fake,2,"Этот жук приносит удачу и известен своим красным цветом с черными пятнами, часто встречающимся на листьях растений в саду.",19,YES,
3,Nature,2,Бабочка Монарх,"Бабочка Монарх, Медоносная пчела, Божья коровка",fake,3,"Эти насекомые известны своей способностью жалить, и они живут колониями, чтобы защитить свои ульи, но это не бабочка.",18,YES,
3,Nature,2,Бабочка Монарх,"Бабочка Монарх, Медоносная пчела, Божья коровка",extra,1,"Миграция этого насекомого – одно из самых удивительных явлений природы, охватывающее тысячи километров и разные регионы обитания.",17,YES,
4,Nature,1,Рыба,"Рыба, Рептилии, Земноводные",informed,1,"Эти существа обычно встречаются в водной среде и используют жабры для извлечения кислорода из воды, что позволяет им дышать.",19,YES,
4,Nature,1,Рыба,"Рыба, Рептилии, Земноводные",informed,2,"Многие виды этих животных являются хладнокровными позвоночными, обитающими и процветающими в различных водных средах, от рек до океанов.",18,YES,
4,Nature,1,Рыба,"Рыба, Рептилии, Земноводные",informed,3,"Эти водные животные очень разнообразны по размеру, форме и цвету, что зависит от их среды обитания.",16,YES,
4,Nature,1,Рыба,"Рыба, Рептилии, Земноводные",informed,4,"Они играют важную роль во многих экосистемах, являясь ключевым звеном в пищевой цепи и поддержании биоразнообразия нашей планеты.",18,YES,
4,Nature,1,Рыба,"Рыба, Рептилии, Земноводные",informed,5,"Этот тип животных является популярным источником пищи во многих культурах, а также частым объектом рыболовства, что делает их важными для людей.",21,NO,
4,Nature,1,Рыба,"Рыба, Рептилии, Амфибии",informed,6,"Эти существа часто передвигаются в воде, используя плавники и обтекаемое тело для эффективного плавания. Они дышат жабрами, поглощая кислород из воды.",21,NO,
4,Nature,1,Рыба,"Рыба, Рептилии, Земноводные",informed,7,"Они существуют миллионы лет, приспосабливаясь и эволюционируя в бесчисленные виды на протяжении всего этого времени. Ищите в воде.",18,YES,
4,Nature,1,Рыба,"Рыба, Рептилии, Земноводные",informed,8,"У них развились разнообразные сенсорные адаптации, такие как боковые линии, для жизни под водой. Это помогает им ориентироваться.",18,YES,
4,Nature,1,Рыба,"Рыба, Рептилии, Земноводные",informed,9,"Эти существа часто встречаются в стаях, что обеспечивает защиту и помогает в поиске пищи в водной среде.",17,YES,
4,Nature,1,Рыба,"Рыба, Рептилии, Земноводные",misinformed,1,"Эти животные - часть царства животных, и их можно встретить в самых разных средах обитания, от воды до суши.",19,YES,
4,Nature,1,Рыба,"Рыба, Рептилии, Земноводные",misinformed,2,"Это живые организмы, которым для выживания и процветания в природе необходимы пища, вода и укрытие, как и многим другим видам.",20,YES,
4,Nature,1,Рыба,"Рыба, Рептилии, Земноводные",fake,1,"Эти животные часто имеют чешую и откладывают яйца, сбрасывая кожу, что совершенно не относится к рыбам, живущим в воде.",19,YES,
4,Nature,1,Рыба,"Рыба, Рептилии, Земноводные",fake,2,"Некоторые ошибочно полагают, что эти холоднокровные существа живут и на суше, и в воде, проходя метаморфозы в течение жизни.",19,YES,
4,Nature,1,Рыба,"Рыба, Рептилии, Земноводные",fake,3,"Эти существа известны своей способностью жить как на суше, так и в воде, используя легкие для дыхания, но это не рыбы.",21,NO,
4,Nature,1,Рыба,"Рыба, Рептилии, Земноводные",extra,1,Эти хладнокровные водные существа дышат жабрами и используют плавники для передвижения в своей водной среде. Дополнительная подсказка для правильного ответа.,20,YES,
4,Nature,2,Дельфин,"Дельфин, Акула, Кит",informed,1,"Эти морские млекопитающие известны своим интеллектом и сложной социальной структурой, обитая в различных океанах и морях нашей планеты.",18,YES,
4,Nature,2,Дельфин,"Дельфин, Акула, Кит",informed,2,"Это очень социальные существа, общающиеся щелчками, свистом и языком тела в океане. Их интеллект поражает ученых со всего мира.",19,YES,
4,Nature,2,Дельфин,"Дельфин, Акула, Кит",informed,3,"Эти животные часто выпрыгивают из воды, что может служить различным целям, например, для общения или избавления от паразитов.",18,YES,
4,Nature,2,Дельфин,"Дельфин, Акула, Кит",informed,4,"Эти существа используют эхолокацию для навигации, поиска пищи и восприятия окружающей среды в своей подводной среде обитания. Это очень умные животные.",21,NO,
4,Nature,2,Дельфин,"Дельфин, Акула, Кит",informed,5,"Эти животные известны своим игривым поведением и взаимодействием с людьми в море, часто демонстрируя высокий интеллект и любопытство.",18,YES,
4,Nature,2,Дельфин,"Дельфин, Акула, Кит",informed,6,"Это теплокровные млекопитающие, рождающие живых детенышей и выкармливающие их молоком в океане. Отличаются высоким интеллектом и игривым характером, живут стаями.",20,YES,
4,Nature,2,Дельфин,"Дельфин, Акула, Кит",informed,7,"Эти существа часто встречаются в прибрежных зонах и океанах по всему миру, приспосабливаясь к разнообразным условиям окружающей среды. Очень умные.",20,YES,
4,Nature,2,Дельфин,"Дельфин, Акула, Кит",informed,8,"Эти морские животные обладают обтекаемым телом, что позволяет им плавать с большой скоростью под водой. Это очень умные существа.",19,YES,
4,Nature,2,Dolphin,"Dolphin, Shark, Whale",informed,9,They are known for their intelligence and ability to learn and solve problems in the ocean.,16,YES,
4,Nature,2,Дельфин,"Дельфин, Акула, Кит",misinformed,1,"Эти морские животные обитают в океане и являются частью животного мира, но кто из них самый дружелюбный и игривый?",19,YES,
4,Nature,2,Дельфин,"Дельфин, Акула, Кит",misinformed,2,"Это животное, обитающее в воде, известное своей способностью плавать и часто встречающееся в океанариумах, но кто именно, не совсем ясно.",20,YES,
4,Nature,2,Дельфин,"Дельфин, Акула, Кит",fake,1,"Эти существа обладают острыми зубами и известны своими мощными челюстями, что помогает им охотиться в море, но это не дельфин.",20,YES,
4,Nature,2,Дельфин,"Дельфин, Акула, Кит",fake,2,"Эти морские животные известны своими огромными размерами и весом в несколько тонн, но дельфины не фильтруют пищу в океане.",19,YES,
4,Nature,2,Дельфин,"Дельфин, Акула, Кит",fake,3,"Эти существа известны своими огромными размерами и уникальной адаптацией для дыхания воздухом, но это точно не дельфин.",17,YES,
4,Nature,2,Дельфин,"Дельфин, Акула, Кит",extra,1,"Эти водные млекопитающие известны своим интеллектом, сложным социальным поведением и часто встречаются в океанах, радуя своим присутствием.",17,YES,
5,Nature,1,Ракообразные,"Ракообразные, Рептилии, Паукообразные",informed,1,"Они характеризуются твердым внешним панцирем, который обеспечивает защиту и поддержку их мягкому телу, скрытому под поверхностью.",16,YES,
5,Nature,1,Ракообразные,"Ракообразные, Рептилии, Паукообразные",informed,2,"Многие из этих животных обитают в водной среде, играя важную роль в экосистеме и пищевой цепи внутри воды.",18,YES,
5,Nature,1,Ракообразные,"Ракообразные, Рептилии, Паукообразные",informed,3,"Эти существа используют специализированные части тела для передвижения, добычи пищи и взаимодействия с окружающей средой, чтобы выжить и процветать.",19,YES,
5,Nature,1,Ракообразные,"Ракообразные, Рептилии, Паукообразные",informed,4,"Эти существа линяют, сбрасывая свой внешний слой, чтобы освободить место для роста, обнажая новый, более крупный экзоскелет.",17,YES,
5,Nature,1,Ракообразные,"Ракообразные, Рептилии, Паукообразные",informed,5,"Их тела сегментированы, с отчетливой головой, грудью и брюшком, каждая часть выполняет определенные функции, что помогает их выживанию.",18,YES,
5,Nature,1,Ракообразные,"Ракообразные, Рептилии, Паукообразные",informed,6,"Эти животные известны своим разнообразием форм, сред обитания и экологической ролью, которую они играют в природном мире.",17,YES,
5,Nature,1,Ракообразные,"Ракообразные, Рептилии, Паукообразные",informed,7,"Многие виды обладают мощными клешнями или щипцами, используемыми для защиты, захвата добычи и эффективного манипулирования предметами в окружающей среде.",19,YES,
5,Nature,1,Ракообразные,"Ракообразные, Рептилии, Паукообразные",informed,8,"Они служат важным источником пищи для многих животных, внося значительный вклад в поддержание баланса пищевой цепи в природе.",18,YES,
5,Nature,1,Ракообразные,"Ракообразные, Рептилии, Паукообразные",informed,9,"Эти существа играют важную роль в круговороте питательных веществ, поддерживая здоровье своих экосистем и обеспечивая их баланс.",17,YES,
5,Nature,1,Ракообразные,"Ракообразные, Рептилии, Паукообразные",misinformed,1,"Эти животные обитают в самых разных средах, от суши до воды, и обладают способностью к передвижению, что затрудняет определение.",19,YES,
5,Nature,1,Ракообразные,"Ракообразные, Рептилии, Паукообразные",misinformed,2,"Эти существа отличаются сложным строением и играют важную роль в поддержании баланса в различных природных экосистемах, но не конкретизируют группу.",20,YES,
5,Nature,1,Ракообразные,"Ракообразные, Рептилии, Паукообразные",fake,1,"Эти животные являются хладнокровными позвоночными, часто греющимися на солнце, чтобы регулировать температуру тела, но это не про ракообразных.",18,YES,
5,Nature,1,Ракообразные,"Ракообразные, Рептилии, Паукообразные",fake,2,"У них сухая, чешуйчатая кожа и они откладывают яйца, часто обитая в наземных средах и разнообразных местах обитания в целом.",20,YES,
5,Nature,1,Ракообразные,"Ракообразные, Рептилии, Паукообразные",fake,3,"Эти существа обычно имеют четыре ноги и известны своей способностью ползать и лазать по разным местностям, что неверно для ракообразных.",20,YES,
5,Nature,1,Ракообразные,"Ракообразные, Рептилии, Паукообразные",extra,1,"Их существование преимущественно водное, они отличаются разнообразием размеров и форм, а также являются беспозвоночными по своей природе. Это дополнительная подсказка.",20,YES,
5,Nature,2,крабы,"лобстеры, крабы, креветки",informed,1,"Эти существа известны своей боковой походкой, что является отличительной формой передвижения по поверхности, особенно вдоль береговой линии и морского дна.",20,YES,
5,Nature,2,крабы,"лобстеры, крабы, креветки",informed,2,"Многие виды обладают мощными клешнями, которые используют для защиты, питания и манипулирования предметами в окружающей их среде обитания.",18,YES,
5,Nature,2,крабы,"лобстеры, крабы, креветки",informed,3,"Они часто встречаются в прибрежных районах, населяя скалистые берега, песчаные пляжи и литоральные зоны по всему миру.",17,YES,
5,Nature,2,Крабов,"Лобстеры, Крабы, Креветки",informed,4,"Эти животные отличаются своим уплощенным и компактным телом, которое обеспечивает им ловкость и маневренность в окружающей среде обитания. Это очень полезное качество.",22,NO,
5,Nature,2,Крабов,"Лобстеры, Крабы, Креветки",informed,5,"Их твердый внешний панцирь обеспечивает защиту, и они линяют, чтобы расти, сбрасывая свой экзоскелет. Это важный этап в их жизни.",20,YES,
5,Nature,2,крабы,"лобстеры, крабы, креветки",informed,6,"Эти существа – падальщики, питающиеся разнообразной органикой, которую они находят в окружающей среде, что делает их важными участниками морской экосистемы.",20,YES,
5,Nature,2,крабы,"лобстеры, крабы, креветки",informed,7,"Эти существа – важный источник пищи для многих морских животных, поддерживающий баланс пищевой цепи в океане и морях.",18,YES,
