test_run,topic_category,round,answer,choices,clue_type,clue_number,clue_text,word_count,length_ok,manual_score / comment
7,Songs,1,Рок,"Блюз, Рок, Соул",fake,3,"Этот жанр часто характеризуется мощным вокалом и сложными аранжировками, нередко включающими духовую секцию, но это совсем не блюз.",18,YES,
7,Songs,1,Блюз,"Блюз, Рок, Соул",extra,1,"Этот музыкальный жанр позволяет выражать эмоции через вокал, часто характеризуется бендами и вокальными слайдами, что делает его узнаваемым.",18,YES,
7,Songs,2,Перекресток Блюза - Роберт Джонсон,"The Lemon Song - Led Zeppelin, Перекресток Блюза - Роберт Джонсон, Stormy Monday - T-Bone Walker",informed,1,"Эта песня рассказывает историю о перекрестке, месте личного конфликта и духовных последствий для певца, ищущего свой путь.",17,YES,
7,Songs,2,Перекресток Блюза - Роберт Джонсон,"The Lemon Song - Led Zeppelin, Перекресток Блюза - Роберт Джонсон, Stormy Monday - T-Bone Walker",informed,2,"Темы искушения и последствий в этой песне глубоко отзывались в сердцах слушателей начала двадцатого века, вызывая сильные эмоции и размышления.",20,YES,
7,Songs,2,Перекресток Блюза - Роберт Джонсон,"The Lemon Song - Led Zeppelin, Перекресток Блюза - Роберт Джонсон, Stormy Monday - T-Bone Walker",informed,3,"Эта песня, с ее преследующей мелодией и сырыми эмоциями, передает чувство отчаяния и духовной борьбы, что характерно для блюза.",19,YES,
7,Songs,2,Перекресток Блюза - Роберт Джонсон,"The Lemon Song - Led Zeppelin, Перекресток Блюза - Роберт Джонсон, Stormy Monday - T-Bone Walker",informed,4,"Текст песни передает чувство изоляции и поиски помощи в момент личного кризиса, что характерно для блюзовых композиций.",17,YES,
7,Songs,2,Перекресток Блюза - Роберт Джонсон,"The Lemon Song - Led Zeppelin, Перекресток Блюза - Роберт Джонсон, Stormy Monday - T-Bone Walker",informed,5,"Уникальный звуковой ландшафт мелодии, созданный с использованием техники слайд-гитары, определяет выразительный и неповторимый музыкальный характер этой композиции.",17,YES,
7,Songs,2,Перекресток Блюза - Роберт Джонсон,"The Lemon Song - Led Zeppelin, Перекресток Блюза - Роберт Джонсон, Stormy Monday - T-Bone Walker",informed,6,"Вокальная подача исполнителя передает чувство уязвимости и тяжесть трудного выбора, что характерно для дельта-блюза и его историй.",17,YES,
7,Songs,2,Перекресток Блюз - Роберт Джонсон,"The Lemon Song - Led Zeppelin, Перекресток Блюз - Роберт Джонсон, Stormy Monday - T-Bone Walker",informed,7,"Эта песня – ключевой пример дельта-блюза, оказавший огромное влияние на музыкантов разных жанров и поколений. Ее значение трудно переоценить.",19,YES,
7,Songs,2,Перекресток Блюза - Роберт Джонсон,"The Lemon Song - Led Zeppelin, Перекресток Блюза - Роберт Джонсон, Stormy Monday - T-Bone Walker",informed,8,"Эта песня исследует темы судьбы, выбора и последствий своих действий, что делает её важной частью блюзового канона.",17,YES,
7,Songs,2,Перекресток Блюза - Роберт Джонсон,"The Lemon Song - Led Zeppelin, Перекресток Блюза - Роберт Джонсон, Stormy Monday - T-Bone Walker",informed,9,"Песня наполнена чувством надвигающейся беды, намекая на трудный путь, на котором находится главный герой. Это классика блюза.",17,YES,
7,Songs,2,Перекресток Блюза - Роберт Джонсон,"The Lemon Song - Led Zeppelin, Перекресток Блюза - Роберт Джонсон, Stormy Monday - T-Bone Walker",misinformed,1,"Это творческая форма, использующая художественное выражение для передачи эмоций и вовлечения аудитории в свое послание, но не всегда конкретно.",19,YES,
7,Songs,2,Перекресток Блюза - Роберт Джонсон,"The Lemon Song - Led Zeppelin, Перекресток Блюза - Роберт Джонсон, Stormy Monday - T-Bone Walker",misinformed,2,"Эта песня отличается сильным вокалом, что часто делает ее популярной среди слушателей, но не указывает на конкретного исполнителя.",18,YES,
7,Songs,2,Перекресток Блюза - Роберт Джонсон,"Лимонная Песня - Led Zeppelin, Перекресток Блюза - Роберт Джонсон, Бурный Понедельник - T-Bone Walker",fake,1,"Эта песня, полная энергии и гитарных риффов, демонстрирует инструментальное мастерство группы, но она не о продаже души на перекрестке.",19,YES,
7,Songs,2,Перекресток Блюз - Роберт Джонсон,"The Lemon Song - Led Zeppelin, Перекресток Блюз - Роберт Джонсон, Stormy Monday - T-Bone Walker",fake,2,"Эта песня повествует о путешествии по пустынному ландшафту, полному опасностей и неопределенности, что не относится к правильному ответу.",18,YES,
7,Songs,2,Перекресток Блюза - Роберт Джонсон,"The Lemon Song - Led Zeppelin, Перекресток Блюза - Роберт Джонсон, Stormy Monday - T-Bone Walker",fake,3,"Эта песня, полная души баллада, демонстрирует вокальные данные исполнителя и его эмоциональную глубину, но это не правильный ответ.",18,YES,
7,Songs,2,Перекресток Блюз - Роберт Джонсон,"The Lemon Song - Led Zeppelin, Перекресток Блюз - Роберт Джонсон, Stormy Monday - T-Bone Walker",extra,1,"Эта песня наполнена чувством страха и борьбы с невидимыми силами, что делает ее особенно запоминающейся для слушателей.",17,YES,
8,Songs,1,Электронная,"Электронная, Танцевальная, Техно",informed,1,"Этот жанр часто использует синтезаторы, драм-машины и цифровые звуковые рабочие станции для создания своего уникального звучания и ритма.",18,YES,
8,Songs,1,Электронная,"Электронная, Танцевальная, Техно",informed,2,"Обычно она делает акцент на повторяющихся ритмических рисунках, атмосферных текстурах и синтезированных звуковых ландшафтах, создавая уникальное звучание.",17,YES,
8,Songs,1,Электронная,"Электронная, Танцевальная, Техно",informed,3,"Этот музыкальный жанр часто ассоциируется с ночными клубами, фестивалями и другими местами, где проводятся большие собрания и вечеринки.",18,YES,
8,Songs,1,Электронная,"Электронная, Танцевальная, Техно",informed,4,"Многие артисты создают и исполняют эту музыку, используя сочетание живых инструментов и цифровых технологий. Это часто связано с синтезаторами и компьютерами.",21,NO,
8,Songs,1,Электронная,"Электронная, Танцевальная, Техно",informed,5,"Этот жанр часто включает элементы других музыкальных стилей, что приводит к разнообразию поджанров и кроссоверной привлекательности для слушателей.",18,YES,
8,Songs,1,Электронная,"Электронная, Танцевальная, Техно",informed,6,Этот тип музыки часто характеризуется акцентом на звуковом дизайне и способностью создавать захватывающие и глубокие впечатления для слушателя.,18,YES,
8,Songs,1,Электронная,"Электронная, Танцевальная, Техно",informed,7,Этот жанр часто ставит во главу угла использование технологий и инноваций в своем производстве и музыкальных аранжировках. Это явно указывает на ответ.,22,NO,
8,Songs,1,Электроника,"Электроника, Танцевальная, Техно",informed,8,"Этот музыкальный стиль использует цифровые технологии и манипуляции со звуком для создания ритмичных и мелодичных узоров, что делает его узнаваемым.",20,YES,
8,Songs,1,Электронная,"Электронная, Танцевальная, Техно",informed,9,"Это широкая категория, охватывающая различные поджанры, определяемые их отчетливыми звуковыми характеристиками и техниками производства. Она включает много стилей и направлений.",20,YES,
8,Songs,1,Электронная,"Электронная, Танцевальная, Техно",misinformed,1,"Этот жанр музыки создан для прослушивания и получения удовольствия слушателями всех возрастов, что делает выбор направления затруднительным.",17,YES,
8,Songs,1,Электронная,"Электронная, Танцевальная, Техно",misinformed,2,"Этот вид музыки использует звук для создания эмоциональной связи со слушателем, выражая идеи и чувства, но не конкретно.",18,YES,
8,Songs,1,Электронная,"Электронная, Танцевальная, Техно",fake,1,"Эта музыка часто включает сложные вокальные гармонии и инструменты, а также нередко использует полноценный оркестр, что не относится к электронной музыке.",21,NO,
8,Songs,1,Электронная,"Электронная, Танцевальная, Техно",fake,2,"Этот жанр определяется использованием гитар, баса и барабанов, которые являются основой его звучания. Но это совсем не то, что вы ищете.",21,NO,
8,Songs,1,Электронная,"Электронная, Танцевальная, Техно",fake,3,"Этот музыкальный жанр часто включает в себя сильное повествование с персонажами, сюжетами и эмоциональной глубиной в текстах, но это неправда.",20,YES,
8,Songs,1,Электронная,"Электронная, Танцевальная, Техно",extra,1,"Этот жанр часто делает акцент на ритме и звуковом дизайне, предлагая слушателям уникальный и новаторский музыкальный опыт. Это действительно захватывающе!",20,YES,
8,Songs,2,Strobe - deadmau5,"Levels - Avicii, Strobe - deadmau5, Animals - Martin Garrix",informed,1,"Постепенное нарастание и эволюционирующие звуковые ландшафты трека создают захватывающий и эмоциональный опыт прослушивания, характерный для прогрессив-хауса.",16,YES,
8,Songs,2,Strobe - deadmau5,"Levels - Avicii, Strobe - deadmau5, Animals - Martin Garrix",informed,2,"Эта композиция отличается минималистичной структурой, основанной на повторяющейся мелодической фразе и эволюционирующем звуковом дизайне, что делает ее узнаваемой.",18,YES,
8,Songs,2,Strobe - deadmau5,"Levels - Avicii, Strobe - deadmau5, Animals - Martin Garrix",informed,3,"Эта композиция известна своей атмосферностью и тем, как она вызывает чувство глубокой интроспекции, погружая слушателя в размышления.",17,YES,
8,Songs,2,Strobe - deadmau5,"Levels - Avicii, Strobe - deadmau5, Animals - Martin Garrix",informed,4,"Эта композиция демонстрирует сложный звуковой дизайн, используя наслоения синтезированных звуков для создания богатого и захватывающего слухового опыта, что делает её узнаваемой.",21,NO,
8,Songs,2,Strobe - deadmau5,"Levels - Avicii, Strobe - deadmau5, Animals - Martin Garrix",informed,5,"Эта композиция отличается большой продолжительностью и тем, как она тонко меняется и преображается с течением времени, создавая неповторимую атмосферу.",19,YES,
8,Songs,2,Strobe - deadmau5,"Levels - Avicii, Strobe - deadmau5, Animals - Martin Garrix",informed,6,Эта композиция часто получает похвалу за способность создавать эмоциональную связь со слушателями благодаря своему уникальному звучанию и мелодичности.,18,YES,
8,Songs,2,Strobe - deadmau5,"Levels - Avicii, Strobe - deadmau5, Animals - Martin Garrix",informed,7,"Эта композиция – продолжительный инструментальный трек, который постепенно развивается и нарастает в течение нескольких минут прослушивания, создавая неповторимую атмосферу.",19,YES,
8,Songs,2,Strobe - deadmau5,"Levels - Avicii, Strobe - deadmau5, Animals - Martin Garrix",informed,8,"Эта композиция часто звучит в конце диджейских сетов, словно унося слушателя в другое измерение, полное звука и света.",18,YES,
8,Songs,2,Strobe - deadmau5,"Levels - Avicii, Strobe - deadmau5, Animals - Martin Garrix",informed,9,"Нежные ритмические изменения и развивающиеся текстуры этого трека создают гипнотический эффект, который захватывает слушателя с первых нот и до конца.",20,YES,
8,Songs,2,Strobe - deadmau5,"Levels - Avicii, Strobe - deadmau5, Animals - Martin Garrix",misinformed,1,"Эта композиция создана для широкой аудитории, чтобы каждый слушатель мог найти в ней что-то для себя и насладиться музыкой.",19,YES,
8,Songs,2,Strobe - deadmau5,"Levels - Avicii, Strobe - deadmau5, Animals - Martin Garrix",misinformed,2,"Эта композиция вызывает сильные эмоции у слушателя, передавая чувства через звуковые текстуры и мелодичные элементы, создавая атмосферу размышлений.",18,YES,
8,Songs,2,Strobe - deadmau5,"Levels - Avicii, Strobe - deadmau5, Animals - Martin Garrix",fake,1,"Эта композиция отличается сильным вокалом, энергичным ритмом и запоминающейся мелодией, что делает её похожей на популярные танцевальные хиты.",18,YES,
8,Songs,2,Strobe - deadmau5,"Levels - Avicii, Strobe - deadmau5, Animals - Martin Garrix",fake,2,"Эта композиция с бодрым ритмом и запоминающимся мотивом идеально подходит для танцев в клубах, но это совсем другая песня.",19,YES,
8,Songs,2,Strobe - deadmau5,"Levels - Avicii, Strobe - deadmau5, Animals - Martin Garrix",fake,3,"В песне поет женский вокал о любви и разбитом сердце, с запоминающимся припевом и простым текстом, совсем не электронная музыка.",20,YES,
8,Songs,2,Strobe - deadmau5,"Levels - Avicii, Strobe - deadmau5, Animals - Martin Garrix",extra,1,"Эта композиция знаменита своей способностью переносить слушателей в другие миры благодаря сложным звуковым ландшафтам и эмоциональной глубине, что делает её особенной.",21,NO,
9,Songs,1,Регги,"Регги, Ска, Хеви-метал",informed,1,"Этот жанр характеризуется расслабленными ритмами и акцентами, создающими уникальный и приятный опыт прослушивания для самой широкой аудитории слушателей.",18,YES,
9,Songs,1,Регги,"Регги, Ска, Хеви-метал",informed,2,"Этот жанр, зародившийся на Ямайке, часто затрагивает темы социальной справедливости, любви и духовности, что привлекает многих слушателей.",17,YES,
9,Songs,1,Регги,"Регги, Ска, Хэви-метал",informed,3,"Этот жанр характеризуется использованием синкопы и отчетливой басовой линией, создавая очень запоминающийся музыкальный опыт, который заставляет вас двигаться и танцевать.",20,YES,
9,Songs,1,Регги,"Регги, Ска, Хэви-метал",informed,4,"Этот музыкальный стиль часто включает сильный вокал, а ритм-гитара играет на слабых долях такта, создавая характерный ритм.",17,YES,
9,Songs,1,Регги,"Регги, Ска, Хеви-метал",informed,5,Этот музыкальный жанр известен своей связью с культурой Растафари и несет в себе послания единства и мира во всем мире.,20,YES,
9,Songs,1,Регги,"Регги, Ска, Хэви-метал",informed,6,"Этот жанр характеризуется более медленным темпом и акцентом на второй и четвертой долях каждого такта, что создает расслабленное звучание.",19,YES,
9,Songs,1,Регги,"Регги, Ска, Хеви-метал",informed,7,"Этот жанр характеризуется уникальным вокальным стилем и текстами, затрагивающими социальные проблемы и вопросы культурной идентичности, что делает его узнаваемым.",19,YES,
9,Songs,1,Регги,"Регги, Ска, Хеви-метал",informed,8,"Этот музыкальный жанр отличается выразительной бас-гитарой и ритмом барабанов, создавая легко узнаваемое и расслабляющее звучание для слушателей.",17,YES,
9,Songs,1,Регги,"Регги, Ска, Хэви-метал",informed,9,"Этот музыкальный стиль использует определенный темп и инструменты, создавая уникальное звучание, которое нравится слушателям всех возрастов и поколений.",18,YES,
9,Songs,1,Регги,"Регги, Ска, Хэви-метал",misinformed,1,"Это музыкальное творение, вызывающее эмоции, часто исполняется артистами для развлечения публики, но не указывает на конкретный жанр.",17,YES,
9,Songs,1,Регги,"Регги, Ска, Хэви-метал",misinformed,2,"Эта музыка использует инструменты, вокал и мелодии для создания художественного выражения, что делает ее популярной среди многих слушателей во всем мире.",21,NO,
9,Songs,1,Регги,"Регги, Ска, Хэви-метал",fake,1,"Этот музыкальный стиль известен своим быстрым темпом, тяжелыми гитарными риффами и агрессивной подачей вокала слушателям, что абсолютно неверно для регги.",20,YES,
9,Songs,1,Регги,"Регги, Ска, Хэви-метал",fake,2,"Этот жанр известен сложными инструментальными аранжировками и часто исследует темы фэнтези и мифологии, что совершенно не соответствует Регги музыке.",19,YES,
9,Songs,1,Регги,"Регги, Ска, Хэви-метал",fake,3,"Этот музыкальный жанр отличается сложными гитарными рифами и текстами, часто затрагивающими темы социального протеста, что делает его очень популярным.",19,YES,
9,Songs,1,Регги,"Регги, Ска, Хеви-метал",extra,1,"Этот музыкальный жанр делает сильный акцент на слабую долю, создавая неповторимое ритмическое ощущение, которое очень нравится публике во всем мире.",20,YES,
9,Songs,2,One Love - Боб Марли,"Hotel California - Eagles, One Love - Боб Марли, Rude - MAGIC!",informed,1,"Песня о единстве и мире, исполненная душевным вокалом и мягким ритмом, призывает к любви и гармонии во всем мире.",19,YES,
9,Songs,2,One Love - Боб Марли,"Hotel California - Eagles, One Love - Боб Марли, Rude - MAGIC!",informed,2,"Эта композиция использует простую структуру, что делает её доступной, но при этом передаёт мощное послание для всех слушателей.",18,YES,
9,Songs,2,One Love - Боб Марли,"Hotel California - Eagles, One Love - Боб Марли, Rude - MAGIC!",informed,3,"Эта песня содержит главную тему единства, предлагая послание надежды и понимания для всех людей, призывая к сплоченности и гармонии.",19,YES,
