test_run,topic_category,round,answer,choices,clue_type,clue_number,clue_text,word_count,length_ok,manual_score / comment
1,Nature,1,Млекопитающее,"Беспозвоночные, Млекопитающее, Позвоночные",informed,1,"Эти существа рождают живых детенышей и вскармливают их молоком, которое вырабатывается молочными железами матери. Это важная характеристика данной группы.",19,YES,
1,Nature,1,Млекопитающее,"Беспозвоночные, Млекопитающее, Позвоночные",informed,2,"Эти теплокровные организмы часто покрыты шерстью или мехом, поддерживая постоянную внутреннюю температуру тела благодаря сложной системе регуляции.",17,YES,
1,Nature,1,Млекопитающее,"Беспозвоночные, Млекопитающее, Позвоночные",informed,3,"У них есть специализированные зубы, уникально приспособленные к конкретным методам потребления пищи для удовлетворения их жизненных потребностей и выживания.",19,YES,
1,Nature,1,Млекопитающее,"Беспозвоночные, Млекопитающее, Позвоночные",informed,4,"Внутренний скелет этих животных обычно состоит из центрального позвоночника и четырех конечностей, или их измененных форм, что указывает на млекопитающих.",20,YES,
1,Nature,1,Млекопитающее,"Беспозвоночные, Млекопитающее, Позвоночные",informed,5,"Эти существа часто демонстрируют развитые когнитивные навыки и сложное социальное поведение в рамках групповой динамики, что делает их уникальными.",19,YES,
1,Nature,1,Млекопитающее,"Беспозвоночные, Млекопитающее, Позвоночные",informed,6,"Эти существа встречаются в самых разных местах обитания, от глубин океана до высочайших горных хребтов, вскармливая детенышей молоком.",18,YES,
1,Nature,1,Млекопитающее,"Беспозвоночные, Млекопитающее, Позвоночные",informed,7,"Развивающийся детеныш находится в теле матери, получая питание через специализированную плацентарную структуру, что характерно для определенного класса животных.",18,YES,
1,Nature,1,Млекопитающее,"Беспозвоночные, Млекопитающее, Позвоночные",informed,8,"У этих животных четырехкамерное сердце, что обеспечивает эффективную циркуляцию крови, насыщенной кислородом, по всему телу. Это важная характеристика млекопитающих.",19,YES,
1,Nature,1,Млекопитающее,"Беспозвоночные, Млекопитающее, Позвоночные",informed,9,"Они известны тем, что регулируют температуру своего тела, поддерживая постоянное внутреннее состояние в организме животного, что является важной особенностью.",19,YES,
1,Nature,1,Млекопитающее,"Беспозвоночные, Млекопитающее, Позвоночные",misinformed,1,"Эта группа живых существ эволюционировала с течением времени, приспосабливаясь и изменяя свои характеристики, чтобы выжить в окружающей среде. Это очень широкая категория.",22,NO,
1,Nature,1,Млекопитающее,"Беспозвоночные, Млекопитающее, Позвоночные",misinformed,2,"Эти организмы демонстрируют общие характеристики, включая клеточную структуру и наличие генетического материала, ДНК, что свойственно многим видам животных.",18,YES,
1,Nature,1,Млекопитающее,"Беспозвоночные, Млекопитающее, Позвоночные",fake,1,"У этих существ есть экзоскелет, и у них нет позвоночника, их часто можно встретить в воде, но это неправда.",19,YES,
1,Nature,1,Млекопитающее,"Беспозвоночные, Млекопитающее, Позвоночные",fake,2,"У животных с сегментированным телом часто происходит трансформация в течение их жизненного цикла, известная как метаморфоза, но это не млекопитающее.",20,YES,
1,Nature,1,Млекопитающее,"Беспозвоночные, Млекопитающее, Позвоночные",fake,3,"Это большая группа животных, у которых отсутствует позвоночник, часто с простой структурой тела и системами органов. Это не млекопитающие.",19,YES,
1,Nature,1,Млекопитающее,"Беспозвоночные, Млекопитающее, Позвоночные",extra,1,"У этих существ обычно развитый мозг и сложные сенсорные системы, позволяющие успешно ориентироваться и процветать в окружающей среде обитания.",19,YES,
1,Nature,2,Африканский слон,"Жираф, Африканский слон, Лев",informed,1,"Это животное отличается большими ушами, которые помогают регулировать температуру тела в жарком климате африканской саванны, где оно обитает.",18,YES,
1,Nature,2,Африканский слон,"Жираф, Африканский слон, Лев",informed,2,"Их социальная структура матриархальна, где старейшая самка ведет стадо по местности в поисках пищи и воды, защищая от опасностей.",19,YES,
1,Nature,2,Африканский слон,"Жираф, Африканский слон, Лев",informed,3,"Эти существа используют свой удлиненный нос для различных функций, включая питье воды, обоняние и коммуникацию. Это очень крупное животное.",19,YES,
1,Nature,2,Африканский слон,"Жираф, Африканский слон, Лев",informed,4,"Эти животные известны своими впечатляющими бивнями, которые являются видоизмененными резцами, используемыми для защиты и добывания пищи в саванне.",18,YES,
1,Nature,2,Африканский слон,"Жираф, Африканский слон, Лев",informed,5,"Этот крупный травоядный играет важную роль в формировании своей экосистемы, оказывая влияние на растительность своим питанием и перемещением.",18,YES,
1,Nature,2,Африканский слон,"Жираф, Африканский слон, Лев",informed,6,"Эти животные обитают в саваннах и лесах Африки, где они бродят в поисках пищи и воды, образуя тесные семейные группы.",20,YES,
1,Nature,2,Африканский слон,"Жираф, Африканский слон, Лев",informed,7,"Эти огромные млекопитающие общаются с помощью различных звуков, включая глубокие, эхом отдающиеся вокализации и мощные вибрации, разносящиеся по воздуху.",19,YES,
1,Nature,2,Африканский слон,"Жираф, Африканский слон, Лев",informed,8,"Беременность этого животного – одна из самых длительных в животном мире, продолжается почти два года. Это очень крупное животное.",19,YES,
1,Nature,2,Африканский слон,"Жираф, Африканский слон, Лев",informed,9,"Они помнят других особей и их местонахождение в течение длительного времени, демонстрируя исключительные способности памяти и социальное поведение.",18,YES,
1,Nature,2,Африканский слон,"Жираф, Африканский слон, Лев",misinformed,1,"Это животное часто встречается в саванне и известно своими большими размерами, что делает его одним из самых узнаваемых.",18,YES,
1,Nature,2,Африканский слон,"Жираф, Африканский слон, Лев",misinformed,2,"Это животное – крупный хищник, известный своим мощным рыком и социальным поведением в прайдах, обитающий в саваннах и редколесьях Африки.",20,YES,
1,Nature,2,Африканский слон,"Жираф, Африканский слон, Лев",fake,1,"Это животное, известное своей гривой и охотой стаями, часто встречается в саваннах, но это не африканский слон.",17,YES,
1,Nature,2,Африканский слон,"Жираф, Африканский слон, Лев",fake,2,"Этот зверь – грозный хищник, известный своей охотничьей доблестью и сложной социальной организацией, обитающий в саваннах Африки. Но это не слон.",21,NO,
1,Nature,2,Африканский слон,"Жираф, Африканский слон, Лев",fake,3,"Это животное живет группами, демонстрирует сложное социальное поведение и известно своей гривой, хотя это совсем не про слонов.",18,YES,
1,Nature,2,Африканский слон,"Жираф, Африканский слон, Лев",extra,1,"Они являются ключевым видом, оказывающим значительное влияние на среду обитания и окружающую среду. Это очень важное животное для саванны.",19,YES,
2,Nature,1,Фрукты,"Фрукты, Овощи, Цветы",informed,1,"Сладкая, мясистая часть растения или дерева, содержащая семена, часто употребляется в пищу как источник питательных веществ и витаминов.",18,YES,
2,Nature,1,Фрукты,"Фрукты, Овощи, Цветы",informed,2,"Они являются природным источником витаминов и минералов, часто обладают ярким цветом и привлекательным ароматом, что делает их желанными.",18,YES,
2,Nature,1,Фрукты,"Фрукты, Овощи, Цветы",informed,3,"Часто употребляются в сыром виде, а также отлично подходят для кулинарных целей, например, для десертов, джемов и желе. ",18,YES,
2,Nature,1,Фрукты,"Фрукты, Овощи, Цветы",informed,4,"Это способ распространения семян цветущих растений, обеспечивающий продолжение их рода. Они часто сладкие и сочные, привлекают животных для переноса семян.",20,YES,
2,Nature,1,Фрукты,"Фрукты, Овощи, Цветы",informed,5,"С ботанической точки зрения, они развиваются из завязи цветка и содержат семена, необходимые для размножения растений. Это полезная подсказка.",19,YES,
2,Nature,1,Фрукты,"Фрукты, Овощи, Цветы",informed,6,"Часто употребляются в пищу как перекус или часть блюд, поставляя необходимые питательные вещества, способствующие здоровью и благополучию человека.",18,YES,
2,Nature,1,Фрукты,"Фрукты, Овощи, Цветы",informed,7,"Это дары природы, предлагающие разнообразие вкусов и текстур, от терпких до сладких и сочных, богатые витаминами и полезными веществами.",19,YES,
2,Nature,1,Фрукты,"Фрукты, Овощи, Цветы",informed,8,"Разнообразная группа, обеспечивающая нас питанием и часто ассоциирующаяся со здоровьем и различными культурными традициями. Это важная часть здорового рациона.",19,YES,
2,Nature,1,Фрукты,"Фрукты, Овощи, Цветы",informed,9,"Многие из них сезонные и собираются, когда достигают пика зрелости, предлагая оптимальный вкус и питательную ценность для потребителя.",18,YES,
2,Nature,1,Фрукты,"Фрукты, Овощи, Цветы",misinformed,1,"Это важные компоненты здорового питания, обеспечивающие необходимые питательные вещества для людей во всем мире. Они бывают разных видов и вкусов.",20,YES,
2,Nature,1,Фрукты,"Фрукты, Овощи, Цветы",misinformed,2,"Их часто можно найти в продуктовых магазинах и на рынках, они разнообразны и используются в различных рецептах, но что это?",20,YES,
2,Nature,1,Фрукты,"Фрукты, Овощи, Цветы",fake,1,"Это съедобные корни, стебли или листья растений, часто используемые в кулинарии, но это не то, что мы ищем.",18,YES,
2,Nature,1,Фрукты,"Фрукты, Овощи, Цветы",fake,2,"У этих растений часто бывают эффектные лепестки, и их ценят за красоту, используя для украшения и создания ароматов. Это не фрукты.",21,NO,
2,Nature,1,Фрукты,"Фрукты, Овощи, Цветы",fake,3,"Хотя их часто путают с овощами, они обычно слаще и используются в десертах, а не в салатах.",17,YES,
2,Nature,1,Фрукты,"Фрукты, Овощи, Цветы",extra,1,"Это природные сладости, которые часто едят в сыром виде или перерабатывают в различные продукты, важные для питания.",17,YES,
2,Nature,2,Яблоко,"Яблоко, Банан, Арбуз",informed,1,Этот фрукт часто ассоциируется с известной историей об искушении и знании в широко распространенном повествовании. Это сочный и сладкий плод.,20,YES,
2,Nature,2,Яблоко,"Яблоко, Банан, Арбуз",informed,2,Этот фрукт известен своей хрустящей текстурой и освежающим вкусом. Он является популярным выбором для перекусов и десертов во всем мире.,20,YES,
2,Nature,2,Яблоко,"Яблоко, Банан, Арбуз",informed,3,"Цвет кожуры этого фрукта варьируется от красного до зеленого и желтого, в зависимости от сорта и степени зрелости.",18,YES,
2,Nature,2,Яблоко,"Яблоко, Банан, Арбуз",informed,4,"Этот фрукт часто используют в пирогах, но он также хорош в салатах, соусах и как простой, здоровый перекус.",18,YES,
2,Nature,2,Яблоко,"Яблоко, Банан, Арбуз",informed,5,"Этот фрукт, символ здоровья и благополучия, является отличным источником клетчатки и различных важных витаминов для поддержания жизненных сил.",18,YES,
2,Nature,2,Яблоко,"Яблоко, Банан, Арбуз",informed,6,Этот фрукт часто используется в выпечке и ассоциируется с праздниками урожая и осенней порой. Его легко найти в магазине.,19,YES,
2,Nature,2,Яблоко,"Яблоко, Банан, Арбуз",informed,7,"В сердцевине этого фрукта находятся маленькие темные семечки, из которых вырастают новые деревья, если их посадить и вырастить.",18,YES,
2,Nature,2,Яблоко,"Яблоко, Банан, Арбуз",informed,8,"Этот фрукт долго хранится и часто помещается в прохладные, темные места, чтобы сохранить свою свежесть и полезные свойства.",18,YES,
2,Nature,2,Яблоко,"Яблоко, Банан, Арбуз",informed,9,"Этот фрукт часто используется для приготовления сока, сидра и других напитков, которые любят люди всех возрастов. Очень популярный фрукт.",19,YES,
2,Nature,2,Яблоко,"Яблоко, Банан, Арбуз",misinformed,1,"Этот продукт, часто покупаемый в магазинах, предназначен для употребления в пищу и доступен многим людям. Что это может быть?",19,YES,
2,Nature,2,Яблоко,"Яблоко, Банан, Арбуз",misinformed,2,"Это продукт растительного происхождения, который часто употребляют из-за его природной сладости и питательной ценности. Выбор может быть сложным.",18,YES,
2,Nature,2,Яблоко,"Яблоко, Банан, Арбуз",fake,1,"Этот фрукт имеет изогнутую форму и известен высоким содержанием калия, часто употребляется в качестве быстрого перекуса. Но это не яблоко.",20,YES,
2,Nature,2,Яблоко,"Яблоко, Банан, Арбуз",fake,2,"Этот фрукт часто едят летом из-за его освежающего вкуса и большого размера, но это не яблоко.",16,YES,
2,Nature,2,Яблоко,"Яблоко, Банан, Арбуз",fake,3,"Этот фрукт обычно длинный, зеленый и часто используется в салатах, известен своим мягким и освежающим вкусом. Это точно не яблоко.",20,YES,
2,Nature,2,Яблоко,"Яблоко, Банан, Арбуз",extra,1,"Этот фрукт часто ассоциируется с понятиями знания, искушения и запретного плода в различных историях и мифологических сказаниях. Очень полезный фрукт.",20,YES,
3,Nature,1,Насекомые,"Насекомые, Паукообразные, Многоножки",informed,1,"Эти существа отличаются сегментированным телом, разделенным на три части, и шестью ногами, которые они используют для передвижения.",17,YES,
3,Nature,1,Насекомые,"Насекомые, Паукообразные, Многоножки",informed,2,"Многие из этих маленьких существ проходят метаморфоз, кардинально меняясь на протяжении жизненного цикла на нашей планете. Это очень интересные создания.",20,YES,
3,Nature,1,Насекомые,"Насекомые, Паукообразные, Многоножки",informed,3,"Они играют важную роль в опылении и экосистеме, служа источником пищи для других животных, поддерживая баланс в природе.",18,YES,
3,Nature,1,Насекомые,"Насекомые, Паукообразные, Многоножки",informed,4,"Их существование восходит к палеозойской эре, развиваясь и доминируя в различных средах обитания на Земле. Это очень древняя группа животных.",20,YES,
3,Nature,1,Насекомые,"Насекомые, Паукообразные, Многоножки",informed,5,"Некоторые из этих биологических существ строят сложные колонии и демонстрируют скоординированные действия, проявляя социальные структуры и командную работу.",18,YES,
3,Nature,1,Насекомые,"Насекомые, Паукообразные, Многоножки",informed,6,"У них разнообразные пищевые привычки, от потребления растений до употребления мяса, что оказывает большое влияние на окружающую среду.",18,YES,
3,Nature,1,Насекомые,"Насекомые, Паукообразные, Многоножки",informed,7,"Эти существа часто оснащены сложными глазами, обеспечивающими широкое поле зрения для выживания в окружающей среде и обнаружения опасности.",18,YES,
3,Nature,1,Насекомые,"Насекомые, Паукообразные, Многоножки",informed,8,"Многие из этих маленьких животных известны своей способностью летать, что позволяет им исследовать и колонизировать различные территории и ареалы обитания.",20,YES,
3,Nature,1,Насекомые,"Насекомые, Паукообразные, Многоножки",informed,9,"Их экзоскелеты обеспечивают защиту и поддержку, формируя внешний каркас для тела, что позволяет им выживать в различных условиях.",18,YES,
3,Nature,1,Насекомые,"Насекомые, Паукообразные, Многоножки",misinformed,1,"Эти существа - беспозвоночные, у которых отсутствует позвоночник, и их можно встретить практически в любой среде обитания на Земле.",19,YES,
3,Nature,1,Насекомые,"Насекомые, Паукообразные, Многоножки",misinformed,2,"Эти существа важны для пищевой цепи и влияют на баланс и стабильность разных экосистем, но не все из них.",19,YES,
